Nome_Fundo,Publico_Alvo
FUNDO DE INVESTIMENTO IMOBILIÁRIO QUINTAS,INVESTIDOR QUALIFICADO
FUNDO DE INVESTIMENTO IMOBILIÁRIO COLATERAL,INVESTIDOR QUALIFICADO
HEDGE AAA FUNDO DE INVESTIMENTO IMOBILIÁRIO,INVESTIDORES EM GERAL
HEDGE LOGÍSTICA FUNDO DE INVESTIMENTO IMOBILIÁRIO,INVESTIDORES EM GERAL
FUNDO DE INVESTIMENTO IMOBILIARIO RBR ALPHA FUNDO DE FUNDOS,INVESTIDORES EM GERAL
FUNDO DE INVESTIMENTO IMOBILIÁRIO SUCCESPAR VAREJA,INVESTIDOR PROFISSIONAL
FUNDO DE INVESTIMENTO IMOBILIÁRIO SUCCESPAR VAREJO,INVESTIDOR PROFISSIONAL
FUNDO DE INVESTIMENTO IMOBILIARIO HARMONIA,INVESTIDOR QUALIFICADO
TRADE INVEST CARE II FUNDO DE INVESTIMENTO IMOBILIÁRIO - FII,INVESTIDOR PROFISSIONAL
TRADE INVEST CARE II FUNDO DE INVESTIMENTO IMOBILIÁRIO,INVESTIDOR PROFISSIONAL
MPM FUNDO DE INVESTIMENTO IMOBILIÁRIO,INVESTIDOR QUALIFICADO
RB CAPITAL PATRIMONIAL VI  FUNDO DE INVESTIMENTO IMOBILIÁRIO,INVESTIDOR QUALIFICADO
FUNDO DE INVESTIMENTO IMOBILIÁRIO MILLENIUM,INVESTIDORES EM GERAL
SJ AU LOGÍSTICA FUNDO DE INVESTIMENTO IMOBILIÁRIO,INVESTIDOR QUALIFICADO
GRUPO RCFA FUNDO DE INVESTIMENTO IMOBILIARIO,INVESTIDOR PROFISSIONAL
AIRPORT TOWN FUNDO DE INVESTIMENTO IMOBILIÁRIO - FII,INVESTIDOR QUALIFICADO
APOLO FUNDO DE INVESTIMENTO IMOBILIÁRIO,INVESTIDOR QUALIFICADO
DEL MONTE FUNDO DE INVESTIMENTO IMOBILIÁRIO - FII,INVESTIDORES EM GERAL
FUNDO DE INVEST IMOB - FII REC RECEBÍVEIS IMOBILIÁRIOS,INVESTIDORES EM GERAL
FII REC RECEBÍVEIS IMOBILIÁRIOS,INVESTIDORES EM GERAL
SUNO AGRO FIAGRO-IMOBILIARIO - SUNO AGRO FII,INVESTIDORES EM GERAL
SICOOB AGÊNCIAS FUNDO DE INVESTIMENTO IMOBILIÁRIO,INVESTIDOR QUALIFICADO
SABUGAL FUNDO DE INVESTIMENTO IMOBILIÁRIO,INVESTIDOR QUALIFICADO
BASILICA PARTNERS LED CORPORATE FII,INVESTIDOR QUALIFICADO
RIZA ARCTIUM REAL ESTATE FUNDO DE INVESTIMENTO IMOBILIÁRIO,INVESTIDORES EM GERAL
RIZA ARCTIUM REAL ESTATE FUNDO DE INVESTIMENTO IMOBILIARIO,INVESTIDORES EM GERAL
XP CRÉDITO IMOBILIÁRIO - FUNDO DE INVESTIMENTO IMOBILIÁRIO,INVESTIDORES EM GERAL
XP INDUSTRIAL FUNDO DE INVESTIMENTO IMOBILIÁRIO,INVESTIDORES EM GERAL
FUNDO DE INVEST IMOB - OURINVEST RENDA ESTRUTURADA,INVESTIDORES EM GERAL
TRX REAL ESTATE FUNDO DE INVESTIMENTO IMOBILIÁRIO - FII,INVESTIDORES EM GERAL
FUNDO DE INVESTIMENTO IMOBILIARIO - OURINVEST RE I,INVESTIDOR QUALIFICADO
FUNDO DE INVESTIMENTO IMOBILIARIO VBI CRI,INVESTIDORES EM GERAL
FUNDO DE INVESTIMENTO IMOBILIÁRIO - VBI CRI,INVESTIDORES EM GERAL
ALIANZA TRUST RENDA IMOBILIARIA FII,INVESTIDORES EM GERAL
ALIANZA TRUST RENDA IMOBILIARIA - FII,INVESTIDORES EM GERAL
XP MALLS FUNDO DE INVESTIMENTO IMOBILIARIO,INVESTIDORES EM GERAL
FUNDO DE INVESTIMENTO IMOB IRIDIUM RECEBIVEIS IMOBILIARIOS,INVESTIDORES EM GERAL
FII IRIDIUM RECEBIVEIS IMOBILIARIOS,INVESTIDORES EM GERAL
FII HOSPITAL UNIMED SUL CAPIXABA,INVESTIDORES EM GERAL
IMMOB I  FII,INVESTIDOR PROFISSIONAL
IMMOB I FUNDO DE INVESTIMENTOIMOBILIÁRIO - FII,INVESTIDOR PROFISSIONAL
FUNDO DE INVESTIMENTO IMOBILIARIOS HIRE PROPERTIES,INVESTIDOR QUALIFICADO
FUNDO DE INVESTIMENTO IMOBILIÁRIO MBM I,INVESTIDOR QUALIFICADO
TOP CENTER II FUNDO DE INVESTIMENTO IMOBILIARIO,INVESTIDOR QUALIFICADO
FUNDO DE INVESTIMENTO IMOBILIARIO MOGNO FUNDO DE FUNDOS,INVESTIDORES EM GERAL
PRAZO EDUCACIONAL - FII,INVESTIDOR QUALIFICADO
TRANCOSO FII,INVESTIDOR QUALIFICADO
TRANCOSO - FUNDO DE INVESTIMENTO IMOBILIÁRIO - FII,INVESTIDOR QUALIFICADO
FII BARIGUI RENDIMENTOS IMOBILIÁRIOS I FII,INVESTIDORES EM GERAL
RB CAPITAL TFO SITUS FUNDO DE INVESTIMENTO IMOBILIÁRIO - FII,INVESTIDOR QUALIFICADO
FII RBR RENDIMENTO HIGH GRADE,INVESTIDORES EM GERAL
CSHG RENDA URBANA FUNDO DE INVESTIMENTO IMOBILIARIO FII,INVESTIDORES EM GERAL
CSHG RENDA URBANA - FUNDO DE INVESTIMENTO IMOBILIÁRIO - FII,INVESTIDORES EM GERAL
FUNDO DE INVESTIMENTO IMOBILIARIO BTG P CREDITO IMOBILIARIO,INVESTIDORES EM GERAL
BTG PACTUAL CREDITO IMOBILIARIO FII,INVESTIDORES EM GERAL
FII BTG PACTUAL CREDITO IMOBILIARIO,INVESTIDORES EM GERAL
FUNDO DE INVESTIMENTO IMOBILIARIO  FII BRLPROP,INVESTIDOR QUALIFICADO
VALORA CRI CDI FUNDO DE INVESTIMENTO IMOBILIARIO  FII,INVESTIDORES EM GERAL
HUSI FUNDO DE INVESTIMENTO IMOBILIÁRIO,INVESTIDOR QUALIFICADO
PATRIA EDIFICIOS CORPORATIVOS  FII,INVESTIDORES EM GERAL
FUNDO DE FUNDOS DE INVESTIMENTO IMOBILIÁRIO KINEA FII,INVESTIDORES EM GERAL
FUNDO DE INVESTIMENTO IMOBILIARIO NOVA IGUACU - FII,INVESTIDORES EM GERAL
KINEA HIGH YIELD CRI FUNDO DE INVESTIMENTO IMOBILIÁRIO FII,INVESTIDOR QUALIFICADO
RBR CREDITO IMOBILIARIO ESTRUTURADO,INVESTIDORES EM GERAL
RBR CREDITO IMOBILIARIO ESTRUTURADO FII,INVESTIDORES EM GERAL
FII RBR CREDITO IMOBILIARIO HIGH YIELD,INVESTIDORES EM GERAL
FUNDO DE INVESTIMENTO IMOBILIÁRIO F2ZZ,INVESTIDOR QUALIFICADO
FII TORDESILHAS EMPREENDIMENTOS IMOBILIARIOS,INVESTIDORES EM GERAL
ENCONTRO DAS ÁGUAS II FUNDO DE INVESTIMENTO IMOBILIÁRIO,INVESTIDOR QUALIFICADO
ENCONTRO DAS ÁGUAS II  - FUNDO DE INVESTIMENTO IMOBILIÁRIO,INVESTIDOR QUALIFICADO
LEGATUS SHOPPINGS FUNDO DE INVESTIMENTO IMOBILIÁRIO - FII,INVESTIDORES EM GERAL
HECTARE CE - FUNDO DE INVESTIMENTO IMOBILIÁRIO,INVESTIDORES EM GERAL
PRAZO FUNDO DE INVESTIMENTO IMOBILIÁRIO,INVESTIDOR QUALIFICADO
FUNDO DE INVESTIMENTO IMOBILIÁRIO CDURP,INVESTIDOR QUALIFICADO
NE LOGISTIC FUNDO DE INVESTIMENTO IMOBILIÁRIO,INVESTIDORES EM GERAL
NE LOGISTIC FUNDO DE INVESTIMENTO IMOBILIÁRIO,INVESTIDOR QUALIFICADO
FUNDO DE INVESTIMENTO IMOBILIÁRIO ATHENA,INVESTIDORES EM GERAL
FII HECTARE CRI,INVESTIDOR QUALIFICADO
HECTARE I - FUNDO DE INVESTIMENTO IMOBILIÁRIO,INVESTIDOR QUALIFICADO
FUNDO DE INVESTIMENTO IMOBILIÁRIO GV BLUE CHIP,INVESTIDOR QUALIFICADO
VX XII - FUNDO DE INVESTIMENTO IMOBILIÁRIO,INVESTIDOR QUALIFICADO
HABITAT RECEBÍVEIS PULVERIZADOS FII,INVESTIDORES EM GERAL
FUNDO DE INVESTIMENTO IMOBILIARIO - VBI LOGISTICO,INVESTIDORES EM GERAL
BACURI FUNDO DE INVESTIMENTO IMOBILIÁRIO,INVESTIDOR PROFISSIONAL
RIO BRAVO CRÉDITO IMOBILIÁRIO HIGH GRADE FII,INVESTIDORES EM GERAL
XP PROPERTIES FUNDO DE INVESTIMENTO IMOBILIÁRIO - FII,INVESTIDORES EM GERAL
FUNDO DE INVEST IMOB - OURINVEST FUNDO DE FUNDOS,INVESTIDORES EM GERAL
KINEA CO-INVESTIMENTO FUNDO DE INVESTIMENTO IMOBILIÁRIO,INVESTIDOR QUALIFICADO
METROPOLITANO - FUNDO DE INVESTIMENTO IMOBILIÁRIO - FII,INVESTIDOR PROFISSIONAL
METROPOLITANO FUNDO DE INVESTIMENTO IMOBILIÁRIO - FII,INVESTIDOR PROFISSIONAL
VBI ULIVING FUNDO DE INVESTIMENTO IMOBILIÁRIO,INVESTIDOR QUALIFICADO
FII MULTI RENDA URBANA,INVESTIDORES EM GERAL
GREEN ROCK FUNDO DE INVESTIMENTO IMOBILIÁRIO,INVESTIDOR QUALIFICADO
JPP ALLOCATON MOGNO FUNDO DE INVESTIMENTO IMOBILIÁRIO,INVESTIDORES EM GERAL
FII JPP CAPITAL RECEBIVEIS IMOBILIARIOS,INVESTIDORES EM GERAL
JPP CAPITAL RECEBÍVEIS IMOBILIÁRIOS,INVESTIDORES EM GERAL
FUNDO DE INVESTIMENTO IMOBILIÁRIO - FII VITACON,INVESTIDOR QUALIFICADO
GENESIS MULTIESTRATÉGIA FUNDO DE INVESTIMENTO IMOBILIÁRIO,INVESTIDOR QUALIFICADO
GENESIS MULTIESTRATÉGIA - FII,INVESTIDOR QUALIFICADO
XP SELECTION FUNDO DE FUNDOS DE INVESTIMENTO IMOBILIÁRIO,INVESTIDORES EM GERAL
XP SELECTION - FII,INVESTIDORES EM GERAL
XP SELECTION FUNDO DE INVESTIMENTO IMOBILIÁRIO - FII,INVESTIDORES EM GERAL
BFC FUNDO DE INVESTIMENTO IMOBILIÁRIO,INVESTIDOR PROFISSIONAL
RCH FUNDO DE INVESTIMENTO IMOBILIÁRIO,INVESTIDOR QUALIFICADO
HECTARE DESENVOLVIMENTO STUDENT HOUSING - FII,INVESTIDORES EM GERAL
RB CAPITAL DESENVOLVIMENTO RESIDENCIAL IV FII,INVESTIDORES EM GERAL
SÃO JORGE FUNDO DE INVESTIMENTO IMOBILIÁRIO,INVESTIDOR QUALIFICADO
EUROPA 105 FUNDO DE INVESTIMENTO IMOBILIÁRIO - FII,INVESTIDOR QUALIFICADO
EUROPA 105 - FUNDO DE INVESTIMENTO IMOBILIÁRIO,INVESTIDOR QUALIFICADO
MULTIOFFICES 2 - FUNDO DE INVESTIMENTO IMOBILIÁRIO,INVESTIDOR QUALIFICADO
ELEV BRÁS FUNDO DE INVESTIMENTO IMOBILIARIO,INVESTIDOR QUALIFICADO
PORTO PREMIUM FUNDO DE INVESTIMENTO IMOBILIARIO,INVESTIDORES EM GERAL
FUNDO DE INVESTIMENTO IMOBILIÁRIO ECOPARQUE,INVESTIDOR PROFISSIONAL
FUNDO DE INVESTIMENTO IMOBILIARIO MIRANTE DAS AGUAS,INVESTIDOR QUALIFICADO
AGRI8 - FUNDO DE INVESTIMENTO IMOBILIÁRIO,INVESTIDOR QUALIFICADO
VINCI INSTRUMENTOS FINANCEIROS FII,INVESTIDORES EM GERAL
FUNDO DE INVESTIMENTO IMOBILIÁRIO AMÉRICA LOGÍSTICA,INVESTIDORES EM GERAL
APOLLO CORPORATE FUNDO DE INVESTIMENTO IMOBILIÁRIO,INVESTIDOR PROFISSIONAL
JACARANDÁ I FUNDO DE INVESTIMENTO IMOBILIÁRIO - FII,INVESTIDORES EM GERAL
JACARANDA I FII,INVESTIDOR QUALIFICADO
LESTE RIVA EQUITY PREFERENCIAL I FII,INVESTIDOR PROFISSIONAL
CAIXA RIO BRAVO FUNDO DE FII II,INVESTIDORES EM GERAL
FII RB CAPITAL OFFICE INCOME,INVESTIDORES EM GERAL
HEDGE OFFICE INCOME FUNDO DE INVESTIMENTO IMOBILIÁRIO,INVESTIDORES EM GERAL
SBC FUNDO DE INVESTIMENTO IMOBILIÁRIO,INVESTIDOR PROFISSIONAL
PROLOGIS BRAZIL LOGISTICS VENTURE FII,INVESTIDOR PROFISSIONAL
BRESCO GROWTH FUNDO DE INVESTIMENTO IMOBILIÁRIO,INVESTIDOR PROFISSIONAL
ÁTRIO REIT RECEBÍVEIS IMOBILIÁRIOS - FII,INVESTIDORES EM GERAL
CARTESIA RECEBÍVEIS IMOBILIÁRIOS FII,INVESTIDORES EM GERAL
CARTESIA RECEBÍVEIS IMOBILIÁRIOS - FI IMOBILIÁRIO,INVESTIDORES EM GERAL
SÃO FRANCISCO 34 FUNDO DE INVESTIMENTO IMOBILIÁRIO,INVESTIDOR PROFISSIONAL
MB BI FUNDO DE INVESTIMENTO IMOBILIÁRIO,INVESTIDOR QUALIFICADO
PRIME REAL ESTATE FUNDO DE INVESTIMENTO IMOBILIÁRIO,INVESTIDOR QUALIFICADO
FII REC RENDA IMOBILIÁRIA,INVESTIDORES EM GERAL
SNOWBIRD MASTER FUNDO DE INVESTIMENTO IMOBILIARIO,INVESTIDOR PROFISSIONAL
SNOWBIRD PARALELL FUNDO DE INVESTIMENTO IMOBILIARIO,INVESTIDOR QUALIFICADO
SNOWBIRD PARALELL FUNDO DE INVESTIMENTO IMOBILIARIO,INVESTIDOR PROFISSIONAL
DALLAS FUNDO DE INVESTIMENTO IMOBILIÁRIO,INVESTIDOR PROFISSIONAL
DALLAS - FUNDO DE INVESTIMENTO IMOBILIÁRIO,INVESTIDOR PROFISSIONAL
CMX REALTY III FUNDO DE INVESTIMENTO IMOBILIARIO,INVESTIDOR PROFISSIONAL
EVEN II KINEA FUNDO DE INVESTIMENTO IMOBILIÁRIO,INVESTIDOR QUALIFICADO
MÉRITO FUNDOS E AÇÕES IMOBILIÁRIAS FII,INVESTIDORES EM GERAL
VECTIS JUROS REAL FUNDO DE INVESTIMENTO IMOBILIÁRIO - FII,INVESTIDORES EM GERAL
QUASAR CRÉDITO IMOBILIÁRIO FUNDO DE INVESTIMENTO IMOBILIÁRIO,INVESTIDORES EM GERAL
FII RBR DESENVOLVIMENTO III,INVESTIDOR QUALIFICADO
FII - RBR DESENVOLVIMENTO III,INVESTIDOR QUALIFICADO
VIC DESENVOLVIMENTO - VINTAGE 20/21 FII,INVESTIDOR PROFISSIONAL
NEWPORT LOGISTICA FUNDO DE INVESTIMENTO IMOBILIÁRIO,INVESTIDORES EM GERAL
PLURAL RECEBÍVEIS IMOBILIÁRIOS FII,INVESTIDORES EM GERAL
IMMOB II  FII,INVESTIDOR PROFISSIONAL
M8 FUNDO DE INVESTIMENTO IMOBILIARIO MULTIESTRATEGIA,INVESTIDOR PROFISSIONAL
QUASAR AGRO - FUNDO DE INVESTIMENTO IMOBILIARIO,INVESTIDORES EM GERAL
FUNDO DE INVESTIMENTO IMOBILIARIO DE UNIDADES AUTONOMAS,INVESTIDOR PROFISSIONAL
FUNDO DE INVESTIMENTO IMOBILIÁRIO DE UNIDADES AUTÔNOMAS I,INVESTIDOR PROFISSIONAL
CSHG IMOBILIARIO FOF - FUNDO DE INVESTIMENTO IMO - FII,INVESTIDORES EM GERAL
CSHG IMOBILIARIO FOF - FDO INVESTIMENTO IMOB - FII,INVESTIDORES EM GERAL
HSI MALLS FUNDO DE INVESTIMENTO IMOBILIÁRIO,INVESTIDORES EM GERAL
SANTANDER PAPÉIS IMOBILIÁRIOS CDI FII,INVESTIDORES EM GERAL
HSI LOGÍSTICA FUNDO DE INVESTIMENTO IMOBILIÁRIO,INVESTIDORES EM GERAL
HSI LOG II FUNDO DE INVESTIMENTO IMOBILIÁRIO,INVESTIDOR QUALIFICADO
SANTANDER RENDA DE ALUGUÉIS FII,INVESTIDORES EM GERAL
FUNDO DE INVESTIMENTO IMOBILIARIO - V2 PROPERTIES,INVESTIDORES EM GERAL
FUNDO DE INVESTIMENTO IMOBILIARIO BTG PACTUAL SHOPPINGS,INVESTIDORES EM GERAL
FUNDO DE INVESTIMENTO IMOBILIARIO BTG PACTUAL SHOPPINGS,INVESTIDOR QUALIFICADO
FUNDO DE INVESTIMENTO IMOBILIARIO - AVM FII,INVESTIDOR PROFISSIONAL
FUNDO DE INVESTIMENTO IMOBILIARIO - AVM FII,INVESTIDOR QUALIFICADO
ARAM SKY FUNDO DE INVESTIMENTO IMOBILIÁRIO,INVESTIDOR PROFISSIONAL
FRAM CAPITAL PENHA FUNDO DE INVESTIMENTO OMOBILIÁRIO,INVESTIDOR QUALIFICADO
FRAM CAPITAL TESSEN FUNDO DE INVESTIMENTO IMOBILIÁRIO,INVESTIDOR QUALIFICADO
FRAM CAPITAL ODARA FUNDO DE INVESTIMENTO IMOBILIÁRIO,INVESTIDOR QUALIFICADO E PROFISSIONAL
AUREA EXTREMA LOGÍSTICA FUNDO DE INVESTIMENTO IMOBILIÁRIO,INVESTIDOR QUALIFICADO E PROFISSIONAL
INTRABANK FUNDO DE INVESTIMENTO IMOBILIÁRIO,INVESTIDORES EM GERAL
FUNDO DE INVESTIMENTO IMOBILIARIO FOF INTEGRAL BREI,INVESTIDORES EM GERAL
YORK - FUNDO DE INVESTIMENTO IMOBILIARIO,INVESTIDOR QUALIFICADO
FARIA LIMA CAPITAL RECEBÍVEIS IMOBILIÁRIOS I - FII,INVESTIDOR QUALIFICADO
FARIA LIMA CAPITAL RECEBÍVEIS IMOBILIÁRIOS I FII,INVESTIDOR QUALIFICADO
SÃO MIGUEL DOS MILAGRES FUNDO DE INVESTIMENTO IMOBILIARIO,INVESTIDORES EM GERAL
INTER TITULOS IMOBILIARIOS FUNDO DE INVESTIMENTO IMOBILIARIO,INVESTIDORES EM GERAL
FUNDO DE INVESTIMENTO IMOBILIÁRIO RB CAPITAL I FOF,INVESTIDORES EM GERAL
FII RB CAPITAL I FUNDO DE FUNDOS,INVESTIDORES EM GERAL
CAPITANIA REIT FOF - FUNDO DE INVESTIMENTO IMOBILIARIO,INVESTIDORES EM GERAL
FUNDO DE INVESTIMENTO IMOBILIÁRIO HOUSI,INVESTIDORES EM GERAL
BLUEMACAW LOGÍSTICA FUNDO INVESTIMENTO IMOBILIÁRIO,INVESTIDORES EM GERAL
G5 CIDADE NOVA FUNDO DE INVESTIMENTO IMOBILIÁRIO,INVESTIDOR QUALIFICADO
MORE REAL ESTATE FOF FII FUNDO DE INVESTIMENTO IMOBILIARIO,INVESTIDORES EM GERAL
FUNDO DE INVESTIMENTO IMOBILIARIO - MOGNO HOTEIS,INVESTIDORES EM GERAL
VALORA CRI INDICE DE PRECO - FII,INVESTIDORES EM GERAL
VALORA CRI INDICE DE PRECO FII,INVESTIDORES EM GERAL
VALORA CRI INDICE DE PRECO  - FII,INVESTIDORES EM GERAL
FRAM CAPITAL SBCLOG FUNDO DE INVESTIMENTO IMOBILIÁRIO,INVESTIDOR QUALIFICADO
URCA PRIME RENDA FUNDO DE INVESTIMENTO IMOBILIÁRIO - FII,INVESTIDORES EM GERAL
CF2 FUNDO DE INVESTIMENTO IMOBILIARIO,INVESTIDOR QUALIFICADO
HECTARE RECEBÍVEIS HIGH GRADE - FII,INVESTIDORES EM GERAL
FUNDO DE INVESTIMENTO IMOBILIÁRIO JAPURÁ,INVESTIDOR PROFISSIONAL
ARC FUNDO DE INVESTIMENTO IMOBILIÁRIO III - FII,INVESTIDOR PROFISSIONAL
ARC FUNDO DE INVESTIMENTO IMOBILIÁRIO III - FII,INVESTIDOR QUALIFICADO
LOGCP INTER FUNDO DE INVESTIMENTO IMOBILIÁRIO,INVESTIDORES EM GERAL
VBI CONSUMO ESSENCIAL FUNDO DE INVESTIMENTO IMOBILIÁRIO,INVESTIDORES EM GERAL
IMMOB III FUNDO DE INVESTIMENTO IMOBILIARIO - FII,INVESTIDOR PROFISSIONAL
IMMOB III FUNDO DE INVESTIMENTO IMOBILIÁRIO - FII,INVESTIDOR PROFISSIONAL
IMMOB IV BRAGANÇA FI IMOBILIARIO,INVESTIDOR PROFISSIONAL
QUATÁ IMOB FUNDO DE FUNDOS - FII,INVESTIDORES EM GERAL
RBR DESENVOLVIMENTO COMERCIAL I - FII,INVESTIDOR QUALIFICADO
PERFORMA REAL ESTATE - FUNDO DE INVESTIMENTO IMOBILIÁRIO,INVESTIDOR PROFISSIONAL
LUGGO FUNDO DE INVESTIMENTO IMOBILIÁRIO - FII,INVESTIDORES EM GERAL
TISHMAN SPEYER RENDA CORPORATIVA FUNDO DE INV IMOBILIÁRIO,INVESTIDORES EM GERAL
TISHMAN SPEYER RENDA CORPORATIVA FII,INVESTIDORES EM GERAL
ALIANZA FOF FUNDO DE INVESTIMENTO IMOBILIÁRIO,INVESTIDORES EM GERAL
ALIANZA MULTIESTRATEGIA FUNDO DE INVESTIMENTO IMOBILIARIO,INVESTIDORES EM GERAL
HIRE LOG I - FUNDO DE INVESTIMENTO IMOBILIÁRIO,INVESTIDOR QUALIFICADO
CIVITAS - FUNDO DE INVESTIMENTO IMOBILIÁRIO,INVESTIDOR QUALIFICADO
BRIO REAL ESTATE III FUNDO DE INVESTIMENTO IMOBILIÁRIO,INVESTIDORES EM GERAL
BLUEMACAW OFFICE FUND II F,INVESTIDORES EM GERAL
BLUEMACAW OFFICE FUND II,INVESTIDORES EM GERAL
BRIX FUNDO DE INVESTIMENTO IMOBILIÁRIO,INVESTIDOR QUALIFICADO
HSI ATIVOS FINANCEIROS - FUNDO DE INVESTIMENTO IMOBILIÁRIO,INVESTIDORES EM GERAL
HSI ATIVOS FINANCEIROS FUNDO DE INVESTIMENTO IMOBILIÁRIO,INVESTIDORES EM GERAL
ANKARA DISTRESSED FII,INVESTIDOR QUALIFICADO
LOTE M2 FUNDO IMOBILIARIO,INVESTIDORES EM GERAL
HEDGE RECEBÍVEIS IMOBILIÁRIOS FUNDO DE INVESTIMENTO IMOB,INVESTIDORES EM GERAL
VBI REITS FOF - FUNDO DE INVESTIMENTO IMOBILIÁRIO,INVESTIDORES EM GERAL
VBI REITS FOF - FUNDO DE INVESTIMENTO IMOBILIÁRIO,INVESTIDOR QUALIFICADO
BARZEL FUNDO DE INVESTIMENTO IMOBILIÁRIO,INVESTIDORES EM GERAL
HEDGE SHOPPING PARQUE DOM PEDRO FII,INVESTIDORES EM GERAL
BLUECAP RENDA LOGÍSTICA-FII,INVESTIDORES EM GERAL
BLUECAP RENDA LOGÍSTICA FII,INVESTIDORES EM GERAL
FUNDO DE INVESTIMENTO IMOBILIARIO - FII GOLDEN LOGISTICA,INVESTIDOR QUALIFICADO
FUNDO DE INVESTIMENTO IMOBILIARIO - VBI PRIME PROPERTIES,INVESTIDORES EM GERAL
GALAPAGOS FUNDO DE FUNDOS - FII,INVESTIDORES EM GERAL
FII RBR CREDITO IMOBILIARIO SPECIAL OPPORTUNITIES,INVESTIDOR QUALIFICADO
RBR CREDITO IMOBILIARIO SPECIAL OPPORTUNITIES FII,INVESTIDOR QUALIFICADO
FII MOGNO CERTIFICADOS DE RECEBIVEIS IMOBILIARIOS HIGH GRADE,INVESTIDORES EM GERAL
FII MOGNO CERTIFICADOS DE RECEBÍVEIS IMOBILIÁRIOS HIGH GRADE,INVESTIDORES EM GERAL
FII MOGNO CRI MULTIESTRATÉGIA,INVESTIDORES EM GERAL
RB CAPITAL LOGISTICO FUNDO DE INVESTIMENTO IMOBILIARIO - FII,INVESTIDOR PROFISSIONAL
NAVI IMOBILIARIO FUNDO DE FUNDOS DE INVESTIMENTO IMOBILIARIO,INVESTIDORES EM GERAL
NAVI IMOBILIARIO TOTAL RETURN FII,INVESTIDORES EM GERAL
FUNDO DE INVESTIMENTO IMOBILIARIO BRL PROP II,INVESTIDOR QUALIFICADO
HEDGE PALADIN DESIGN OFFICES FUNDO DE INVESTIMENTO IMOB,INVESTIDOR QUALIFICADO
HEDGE SEED FUNDO DE INVESTIMENTO IMOBILIÁRIO,INVESTIDOR PROFISSIONAL
RBR DESENVOLVIMENTO COMERCIAL FEEDER FOF FII,INVESTIDOR PROFISSIONAL
RBR DES COMERCIAL FEEDER FOF FII,INVESTIDOR PROFISSIONAL
RB CAPITAL RECEBÍVEIS IMOBILIÁRIOS FII,INVESTIDORES EM GERAL
MILETO - FUNDO DE INVESTIMENTO IMOBILIÁRIO,INVESTIDOR PROFISSIONAL
RBR LOG FUNDO DE INVESTIMENTO IMOBILIÁRIO,INVESTIDORES EM GERAL
JACARANDA 02 FUNDO DE INVESTIMENTO IMOBILIARIO FII,INVESTIDOR QUALIFICADO
CAPITAL RS FUNDO DE INVESTIMENTO IMOBILIARIO - FII,INVESTIDOR QUALIFICADO
CV HAUS FUNDO DE INVESTIMENTO IMOBILARIO FII,INVESTIDOR QUALIFICADO
CV HAUS - FUNDO DE INVESTIMENTO IMOBILIÁRIO - FII,INVESTIDOR QUALIFICADO
PÁTRIA LOGÍSTICA FUNDO DE INVESTIMENTO IMOBILIÁRIO,INVESTIDORES EM GERAL
XP EXETER DESENVOLVIMENTO LOGISTICO - FII,INVESTIDOR PROFISSIONAL
BRESCO COINVESTIMENTO I FUNDO DE INVESTIMENTO IMOBILIÁRIO,INVESTIDOR QUALIFICADO E PROFISSIONAL
AUTONOMY EDIFICIOS CORPORATIVOS FII,INVESTIDORES EM GERAL
JACARANDA FUNDO DE INVESTIMENTO IMOBILIÁRIO,INVESTIDOR PROFISSIONAL
JACARANDA FUNDO DE INVESTIMENTO IMOBILIARIO,INVESTIDOR PROFISSIONAL
JACARANDÁ FUNDO DE INVESTIMENTO IMOBILIÁRIO,INVESTIDOR PROFISSIONAL
GOLGI FUNDO DE INVESTIMENTO IMOBILIÁRIO,INVESTIDOR QUALIFICADO
JIVE ATIVOS IMOBILIÁRIOS III - FII,INVESTIDOR QUALIFICADO
ZION CAPITAL FUNDO DE INVESTIMENTO IMOBILIÁRIO - FII,INVESTIDORES EM GERAL
KINEA SECURITIES FUNDO DE INVESTIMENTO IMOBILIÁRIO - FII,INVESTIDORES EM GERAL
DARP JIVE FUNDO DE INVESTIMENTO IMOBILIÁRIO,INVESTIDOR QUALIFICADO
PLATINIUM XXI FUNDO DE INVESTIMENTO IMOBILIÁRIO,INVESTIDOR PROFISSIONAL
BTSP I FUNDO DE INVESTIMENTO IMOBILIÁRIO - FII,INVESTIDORES EM GERAL
VINCI FULWOOD DESENV LOGÍSTICO FUNDO DE INVEST IMOBILIÁRIO,INVESTIDOR QUALIFICADO
GTIS BRAZIL LOGISTICS FII,INVESTIDORES EM GERAL
GTIS BRAZIL LOGISTICS FUNDO DE INVESTIMENTO IMOBILIÁRIO,INVESTIDORES EM GERAL
TELLUS DESENVOLVIMENTO LOGISTICO FII,INVESTIDORES EM GERAL
VERSALHES RECEBÍVEIS IMOBILIÁRIOS - FII,INVESTIDORES EM GERAL
PIEMONTE - FUNDO DE INVESTIMENTO IMOBILIÁRIO,INVESTIDOR QUALIFICADO
INTER TEVA ÍNDICE DE TIJOLO FII,INVESTIDORES EM GERAL
POSITIVO III FUNDO DE INVESTIMENTO IMOBILIÁRIO - FII,INVESTIDOR PROFISSIONAL
INTER TEVA ÍNDICE DE PAPEL FII,INVESTIDORES EM GERAL
BLUEMACAW RENDA+ FOF FUNDO DE INVESTIMENTO IMOBILIÁRIO,INVESTIDORES EM GERAL
BLUEMACAW RENDA+ FOF FII,INVESTIDORES EM GERAL
TRX REAL ESTATE II FUNDO DE INVESTIMENTO IMOBILIÁRIO - FII,INVESTIDORES EM GERAL
TANTOU FUNDO DE INVESTIMENTO IMOBILIÁRIO,INVESTIDORES EM GERAL
TANTOU FUNDO DE INVESTIMENTO OMOBILIÁRIO,INVESTIDORES EM GERAL
YUCA FUNDO DE INVESTIMENTO IMOBILIÁRIO,INVESTIDOR PROFISSIONAL
YUCA FII,INVESTIDOR PROFISSIONAL
VINCI IMOVEIS URBANOS FUNDO DE INVESTIMENTO IMOBILIARIO,INVESTIDORES EM GERAL
FUNDO DE INVESTIMENTO IMOBILIÁRIO RIZA TERRAX,INVESTIDORES EM GERAL
FUNDO DE INVESTIMENTO IMOBILIÁRIO HBC RENDA URBANA,INVESTIDORES EM GERAL
JFL LIVING FUNDO DE INVESTIMENTO IMOBILIÁRIO,INVESTIDORES EM GERAL
PLURAL LOGÍSTICA FUNDO DE INVESTIMENTO IMOBILIÁRIO,INVESTIDORES EM GERAL
PLURAL RENDA URBANA FUNDO DE INVESTIMENTO IMOBILIÁRIO,INVESTIDORES EM GERAL
GENIAL RENDA URBANA FUNDO DE INVESTIMENTO IMOBILIÁRIO,INVESTIDORES EM GERAL
CYRELA CRÉDITO - FUNDO DE INVESTIMENTO IMOBILIÁRIO,INVESTIDORES EM GERAL
LWTC FUNDO DE INVESTIMENTO IMOBILIÁRIO,INVESTIDOR PROFISSIONAL
RIO BRAVO RENDA RESIDENCIAL FII,INVESTIDORES EM GERAL
JBFO FOF FUNDO DE INVESTIMENTO IMOBILIÁRIO,INVESTIDORES EM GERAL
MAUA CAPITAL HEDGE FUND FUNDO DE INVESTIMENTO IMOBILIARIO,INVESTIDORES EM GERAL
RIZA AKIN FUNDO DE INVESTIMENTO IMOBILIÁRIO - FII,INVESTIDORES EM GERAL
FUNDO DE INVESTIMENTO IMOBILIARIO BTG PACTUAL AGRO LOGISTICA,INVESTIDORES EM GERAL
FUNDO DE INVESTIMENTO IMOBILIARIO FII RBR DESENVOLVIMENTO IV,INVESTIDOR QUALIFICADO
AF INVEST CRI FII RECEBIVEIS IMOBILIARIOS,INVESTIDORES EM GERAL
AF INVEST CRI FII,INVESTIDORES EM GERAL
AF INVEST CRI FII - RECEBÍVEIS IMOBILIÁRIOS,INVESTIDORES EM GERAL
BTG PACTUAL REAL ESTATE PRIME OPPORTUNITIES FII,INVESTIDOR PROFISSIONAL
BTG PACTUAL REAL ESTATE PRIME OPPORTUNITIES FI,INVESTIDOR PROFISSIONAL
BTG PACTUAL REAL ESTATE PRIME OPPORTUNITIES,INVESTIDOR PROFISSIONAL
FUNDO DE INVESTIMENTO IMOBILIARIO REC FUNDO DE FUNDOS,INVESTIDORES EM GERAL
FUNDO DE INVESTIMENTO IMOBILIÁRIO - REC FUNDO DE FUNDOS,INVESTIDORES EM GERAL
FUNDO DE INVESTIMENTO IMOBILIARIO MAUA HIGH YIELD FII,INVESTIDORES EM GERAL
VENUS FUNDO DE INVESTIMENTO IMOBILIÁRIO,INVESTIDORES EM GERAL
KILIMA FUNDO DE INVEST EM COTAS DE FUNDOS IMOB SUNO 30,INVESTIDORES EM GERAL
KILIMA FII,INVESTIDORES EM GERAL
KILIMA FUNDO DE INV EM COTAS DE FII SUNO 30,INVESTIDOR QUALIFICADO
MEZANINO ESTRUTURADO FUNDO DE INVESTIMENTO IMOBILIARIO,INVESTIDOR QUALIFICADO
KRONOS FUNDO DE INVESTIMENTO IMOBILIARIO,INVESTIDOR PROFISSIONAL
STRUAN FUNDO DE INVESTIMENTO IMOBILIÁRIO - FII,INVESTIDOR PROFISSIONAL
STRUAN - FUNDO DE INVESTIMENTO IMOBILIÁRIO,INVESTIDORES EM GERAL
VALORA HEDGE FUND FUNDO DE INVESTIMENTO IMOBILIÁRIO - FII,INVESTIDORES EM GERAL
R CAP 1810 FUNDO DE FUNDOS - FUNDO DE INVEST IMOBILIÁRIO,INVESTIDORES EM GERAL
RADOMA 16 FUNDO DE INVESTIMENTO IMOBILIÁRIO - FII,INVESTIDOR PROFISSIONAL
ABEL 33 FUNDO DE INVESTIMENTO IMOBILIÁRIO - FII,INVESTIDOR PROFISSIONAL
BTSP II FUNDO DE INVESTIMENTO IMOBILIÁRIO - FII,INVESTIDORES EM GERAL
ENERGY RESORT FUNDO DE INVESTIMENTO IMOBILIÁRIO - FII,INVESTIDORES EM GERAL
ENERGY RESORT FUNDO DE INVESTIMENTO IMOBILIÁRIO,INVESTIDORES EM GERAL
GALAPAGOS RECEBÍVEIS DO AGRONEGÓCIO - FIAGRO - IMOBILIÁRIO,INVESTIDORES EM GERAL
DEVANT RECEBÍVEIS IMOBILIÁRIOS FII,INVESTIDORES EM GERAL
FUNDO DE INVESTIMENTO IMOBILIÁRIO REC LOGÍSTICA,INVESTIDORES EM GERAL
FII REC LOGISTICA,INVESTIDORES EM GERAL
BB FUNDO DE FUNDOS - FUNDO DE INVESTIMENTO IMOBILIÁRIO,INVESTIDORES EM GERAL
XP IDEA!ZARVOS FUNDO DE INVESTIMENTO IMOBILIÁRIO,INVESTIDOR QUALIFICADO E PROFISSIONAL
LAGO DA PEDRA - FUNDO DE INVESTIMENTO IMOBILIARIO,INVESTIDOR QUALIFICADO
ESTOQUE RJ FUNDO DE INVESTIMENTO IMOBILIÁRIO,INVESTIDOR PROFISSIONAL
ESTOQUE RJ FUNDO DE INVESTIMENTO IMOBILIÁRIO,INVESTIDOR QUALIFICADO
FUNDO DE INVESTIMENTO IMOBILIÁRIO GUARDIAN LOGÍSTICA,INVESTIDORES EM GERAL
FUNDO DE INVESTIMENTO IMOBILIÁRIO GUARDIAN LOGISTICA,INVESTIDORES EM GERAL
FBV KEYDEV FUNDO DE INVESTIMENTO IMOBILIÁRIO,INVESTIDOR PROFISSIONAL
LAVOURA FUNDO DE INVESTIMENTO IMOBILIÁRIO,INVESTIDOR QUALIFICADO
COOPBENS FUNDO DE INVESTIMENTO IMOBILIÁRIO,INVESTIDOR QUALIFICADO
CENU FUNDO DE INVESTIMENTO IMOBILIÁRIO,INVESTIDORES EM GERAL
PANORAMA DESENVOLVIMENTO LOGÍSTICO FII,INVESTIDOR PROFISSIONAL
RIO BRAVO CRÉDITO IMOB HIGH YIELD FUNDO DE INV. IMOB. - FII,INVESTIDORES EM GERAL
RIO BRAVO CRÉDITO IMOBILIÁRIO HIGH YIELD FII,INVESTIDORES EM GERAL
PETTRA FUNDO DE INVESTIMENTO IMOBILIÁRIO.,INVESTIDOR QUALIFICADO
PETTRA FUNDO DE INVESEIMTNO IMOBILIÁRIO,INVESTIDOR PROFISSIONAL
CONTE BIANCAMANO FUNDO DE INVESTIMENTO IMOBILIÁRIO,INVESTIDOR QUALIFICADO
FII- BLUE RECEBÍVEIS IMOBILIÁRIOS,INVESTIDORES EM GERAL
FII BLUE RECEBÍVEIS IMOBILIÁRIOS,INVESTIDORES EM GERAL
SERRA VERDE FUNDO DE INVESTIMENTO IMOBILIÁRIO,INVESTIDOR QUALIFICADO
ALIANZA DIGITAL REALTY FUNDO DE INVESTIMENTO IMOBILIARIO,INVESTIDOR QUALIFICADO
ALIANZA DIGITAL REALTY FUNDO DE INVESTIMENTO IMOBILIÁRIO,INVESTIDOR QUALIFICADO
GALAPAGOS RECEBIVEIS IMOBILIARIOS,INVESTIDORES EM GERAL
GALAPAGOS RECEBIVEIS IMOBILIARIOS FII,INVESTIDORES EM GERAL
CORE METROPOLIS FUNDO DE INVESTIMENTO IMOBILIARIO,INVESTIDORES EM GERAL
ASA METROPOLIS FUNDO DE INVESTIMENTO IMOBILIARIO,INVESTIDORES EM GERAL
BTG PACTUAL AAA CORPORATE OFFICE FUND,INVESTIDOR PROFISSIONAL
FII BTG PACTUAL AAA CORPORATE OFFICE FUND,INVESTIDOR PROFISSIONAL
BLUEMACAW CREDITO IMOBILIARIO FII,INVESTIDORES EM GERAL
BLUEMACAW CRÉDITO IMOBILIÁRIO - FII,INVESTIDORES EM GERAL
CVPAR FUNDO DE INVESTIMENTO IMOBILIARIO DE CRI,INVESTIDOR PROFISSIONAL
IMMOB V DESENVOLVIMENTO FII,INVESTIDOR PROFISSIONAL
HGI CRÉDITOS IMOBILIÁRIOS FUNDO DE INVESTIMENTO IMOBILIÁRIO,INVESTIDORES EM GERAL
HGI CRÉDITOS IMOBILIÁRIOS FUNDO DE INESTIMENTO IMOBILIÁRIO,INVESTIDORES EM GERAL
FUNDO DE INVESTIMENTO IMOBILIÁRIO ROOFTOP I,INVESTIDOR QUALIFICADO
IC LOTEAMENTOS E RECEBIVEIS FII,INVESTIDORES EM GERAL
FUNDO DE INVESTIMENTO IMOBILIÁRIO CAIXA IMÓVEIS CORPORATIVOS,INVESTIDORES EM GERAL
TELLUS HEALTHCARE & MIXED USE FEEDER FII,INVESTIDOR PROFISSIONAL
BRIO CRÉDITO ESTRUTURADO - FUNDO DE INVESTIMENTO IMOBILIÁRIO,INVESTIDOR PROFISSIONAL
F.I.I. HOSPITAL UNIMED CAMPINA GRANDE,INVESTIDORES EM GERAL
IBIZA FUNDO DE INVESTIMENTO IMOBILIÁRIO,INVESTIDOR QUALIFICADO
POMPEIA FUNDO DE INVESTIMENTO IMOBILIÁRIO,INVESTIDOR QUALIFICADO
BII VENTURA FUNDO DE INVESTIMENTO IMOBILIÁRIO,INVESTIDOR QUALIFICADO
BII VENTURA FUNDO DE INVESTIMENTO IMOBILIÁRIO - FII,INVESTIDOR QUALIFICADO
FRAM CAPITAL XXI FUNDO DE INVESTIMENTO IMOBILIÁRIO,INVESTIDOR QUALIFICADO
RB CAPITAL BUILT TO SUIT I FII,INVESTIDOR QUALIFICADO
TJK RENDA IMOBILIARIA FUNDO DE INVESTIMENTO IMOBILIARIO,INVESTIDORES EM GERAL
LIFE CAPITAL PARTNERS FUNDO DE INVESTIMENTOS IMOBILIÁRIOS,INVESTIDOR QUALIFICADO
