Nome_Fundo,Publico_Alvo
FUNDO DE INVESTIMENTO IMOBILIÁRIO VIA PARQUE SHOPPING,INVESTIDORES EM GERAL
FUNDO DE INVESTIMENTO IMOBILIÁRIO PANAMBY,INVESTIDORES EM GERAL
FUNDO INVESTIMENTO IMOBILIÁRIO CENTRO TEXTIL INTERNACIONAL,INVESTIDORES EM GERAL
FUNDOS DE INVESTIMENTO IMOBILIÁRIO HERMES,INVESTIDORES EM GERAL
FUNDO DE INVESTIMENTO IMOBILIÁRIO GRAND PLAZA SHOPPING,INVESTIDORES EM GERAL
OPPORTUNITY FUNDO E INVESTIMENTO IMOBILIÁRIO,INVESTIDOR PROFISSIONAL
OPPORTUNITY FUNDO DE INVESTIMENTO IMOBILIÁRIO,INVESTIDOR PROFISSIONAL
OPPORTUNITY FUNDO E INVESTIMENTO IMOBILIÁRIO,INVESTIDOR QUALIFICADO
LAGRA FUNDO DE INVESTIMENTO IMOBILIÁRIO,INVESTIDORES EM GERAL
FUNDO DE INVESTIMENTO IMOBILIÁRIO MISTRAL,INVESTIDORES EM GERAL
FUNDO FORTALEZA DE INVESTIMENTO IMOBILIÁRIO,INVESTIDORES EM GERAL
FUNDO DE INVESTIMENTO IMOBILIÁRIO MEMORIAL OFFICE,INVESTIDORES EM GERAL
FUNDO DE INVESTIMENTO IMOBILIÁRIO PÁTEO MOINHOS DE VENTO,INVESTIDORES EM GERAL
SCP FUNDO DE INVESTIMENTO IMOBILIÁRIO,INVESTIDORES EM GERAL
FUNDO DE INVESTIMENTO IMOBILIÁRIO GEO GUARARAPES,INVESTIDOR QUALIFICADO E PROFISSIONAL
FUNDO BRASÍLIO MACHADO DE INVESTIMENTO IMOBILIÁRIO,INVESTIDORES EM GERAL
LOGINVEST FUNDO DE INVESTIMENTO IMOBILIÁRIO INDUSTRIAL,INVESTIDORES EM GERAL
FUNDO DE INVESTIMENTO IMOBILIÁRIO PROJETO ÁGUA BRANCA,INVESTIDORES EM GERAL
FUNDO DE INVESTIMENTO IMOBILIÁRIO SHOP. PÁTIO HIGIENÓPOLIS,INVESTIDORES EM GERAL
FUNDO DE INVESTIMENTO IMOBILIARIO RIOBRAVO RENDA CORPORATIVA,INVESTIDORES EM GERAL
FUNDO DE INVESTIMENTO IMOBILIÁRIO RB LOGÍSTICA,INVESTIDORES EM GERAL
FII HOSPITAL DA CRIANCA,INVESTIDORES EM GERAL
FII HOSPITAL DA CRIANÇA,INVESTIDORES EM GERAL
FUNDO DE INVEST. IMOBILIÁRIO CONTINENTAL SQUARE FARIA LIMA,INVESTIDORES EM GERAL
FII TORRE NORTE,INVESTIDORES EM GERAL
TORRE NORTE FII,INVESTIDORES EM GERAL
FUNDO DE INVESTIMENTO IMOBILIÁRIO - FII TORRE NORTE,INVESTIDORES EM GERAL
FP. F ANDROMEDA FUNDO DE INVESTIMENTO IMOBILIÁRIO,INVESTIDOR QUALIFICADO E PROFISSIONAL
FUNDO DE INVESTIMENTO IMOBILIÁRIO EUROPAR,INVESTIDORES EM GERAL
ALMIRANTE BARROSO FII,INVESTIDORES EM GERAL
FII EDIFÍCIO ALMIRANTE BARROSO,INVESTIDORES EM GERAL
FII EDIFICIO ALMIRANTE BARROSO,INVESTIDORES EM GERAL
FUNDO DE INVESTIMENTO IMOBILIÁRIO EDIFÍCIO OURINVEST,INVESTIDORES EM GERAL
BB FUNDO DE INVESTIMENTO IMOBILIARIO PROGRESSIVO,INVESTIDORES EM GERAL
BB FUNDO DE INVESTIMENTO IMOBILIÁRIO PROGRESSIVO,INVESTIDORES EM GERAL
FII TORRE ALMIRANTE,INVESTIDORES EM GERAL
FUNDO DE INVESTIMENTO IMOBILIÁRIO - FII TORRE ALMIRANTE,INVESTIDORES EM GERAL
FII SHOPPING PARQUE D PEDRO,INVESTIDORES EM GERAL
FII SHOPPING PARQUE DOM PEDRO,INVESTIDORES EM GERAL
FUNDO DE INVESTIMENTO IMOBILIARIO PENINSULA,INVESTIDOR QUALIFICADO
FII ANCAR IC,INVESTIDORES EM GERAL
HOSPITAL NOSSA SENHORA DE LOURDES FII,INVESTIDORES EM GERAL
FII HOSPITAL NOSSA SENHORA DE LOURDES,INVESTIDORES EM GERAL
HSI RENDA IMOBILIÁRIA FUNDO DE INVESTIMENTO IMOBILIÁRIO,INVESTIDOR QUALIFICADO
HSI RENDA IMOBILIÁRIA FUNDO DE INVESTIMENTO IMOBILIÁRIO,INVESTIDORES EM GERAL
FUNDO DE INVESTIMENTO IMOBILIÁRIO FCM,INVESTIDORES EM GERAL
HEDGE BRASIL SHOPPING FUNDO DE INVESTIMENTO IMOBILIÁRIO,INVESTIDORES EM GERAL
FUNDO DE INVESTIMENTO IMOBILIARIO VEREDA - FII,INVESTIDORES EM GERAL
RB CAPITAL RENDA I FUNDO DE INVESTIMENTO IMOBILIÁRIO - FII,INVESTIDORES EM GERAL
FII HOTEL MAXINVEST,INVESTIDORES EM GERAL
HOTEL MAXINVEST FII,INVESTIDORES EM GERAL
FII BTG PACTUAL CORPORATE OFFICE FUND,INVESTIDORES EM GERAL
FUNDO RB CAPITAL RENDA II FUNDO DE INVESTIMENTO IMOBILIÁRIO,INVESTIDOR QUALIFICADO
CSHG REAL ESTATE - FUNDO DE INVESTIMENTO IMOBILIÁRIO - FII,INVESTIDORES EM GERAL
FUNDO DE INVESTIMENTO IMOBILIÁRIO PATRIMONIAL IV,INVESTIDORES EM GERAL
FUNDO DE INVESTIMENTO IMOBILIARIO PATRIMONIAL IV,INVESTIDOR QUALIFICADO
PROPERTY INVEST - FUNDO DE INVESTIMENTO IMOBILIÁRIO,INVESTIDOR QUALIFICADO
PROPERTY INVEST - FUNDO DE INVESTIMENTO IMOBILIÁRIO,INVESTIDOR PROFISSIONAL
SHOPPING WEST PLAZA FUNDO DE INVESTIMENTO IMOBILIARIO,INVESTIDORES EM GERAL
FUNDO DE INVESTIMENTO IMOBILIÁRIO SÃO FERNANDO,INVESTIDORES EM GERAL
SEQUOIA III RENDA IMOBILIÁRIA FII,INVESTIDOR QUALIFICADO
SEQUÓIA III RENDA IMOBILIÁRIA FII,INVESTIDOR QUALIFICADO
BTG PACTUAL FUNDO DE CRI FI IMOBILIARIO,INVESTIDORES EM GERAL
FII BTG PACTUAL FUNDO DE CRI,INVESTIDORES EM GERAL
FUNDO DE INVESTIMENTO IMOBILIÁRIO VOTORANTIM SECURITIES,INVESTIDOR QUALIFICADO
FII BB VOTORANTIM CIDADE JARDIM CONTINENTAL TOWER,INVESTIDOR QUALIFICADO
CIDADE JARDIM CONTINENTAL TOWER FII,INVESTIDOR QUALIFICADO
FII FLORIPA SHOPPING,INVESTIDORES EM GERAL
FLORIPA SHOPPING FII,INVESTIDORES EM GERAL
ITACOATIARA FUNDO DE INVESTIMENTO IMOBILIÁRIO,INVESTIDOR QUALIFICADO
FUNDO DE INVESTIMENTO IMOBILIARIO - FII PRIME PORTFOLIO,INVESTIDOR QUALIFICADO
FII PRIME PORTFOLIO,INVESTIDOR QUALIFICADO
FUNDO DE INVESTIMENTO IMOBILIÁRIO PHORBIS,INVESTIDORES EM GERAL
MULTIGESTÃO RENDA COMERCIAL FUNDO DE INV. IMOBILIÁRIO,INVESTIDORES EM GERAL
DOVEL FUNDO DE INVESTIMENTO IMOBILIÁRIO,INVESTIDOR QUALIFICADO E PROFISSIONAL
FII PARQUE DOM PEDRO SHOPPING CENTER,INVESTIDORES EM GERAL
FUNDO DE INVESTIMENTO IMOBILIÁRIO CAIXA CEDAE,INVESTIDORES EM GERAL
FII BTG PACTUAL FUNDO DE FUNDOS,INVESTIDORES EM GERAL
BTG PACTUAL FUNDO DE FUNDOS FII,INVESTIDORES EM GERAL
STARX FUNDO DE INVESTIMENTO IMOBILIARIO - FII,INVESTIDOR QUALIFICADO
CSHG RECEBIVEIS IMOBILIÁRIOS FUNDO DE INV IMOBILIÁRIO - FII,INVESTIDORES EM GERAL
FII ANHANGUERA EDUCACIONAL,INVESTIDORES EM GERAL
REAL MINAS FUNDO DE INVESTIMENTO IMOBILIÁRIO - FII,INVESTIDOR QUALIFICADO
CSHG PRIME OFFICES FUNDO DE INVESTIMENTO IMOBILIÁRIO FII,INVESTIDORES EM GERAL
JPP FII,INVESTIDOR PROFISSIONAL
FII MAX RETAIL,INVESTIDORES EM GERAL
MAX RETAIL FII,INVESTIDORES EM GERAL
FII PRESIDENTE VARGAS,INVESTIDORES EM GERAL
PRESIDENTE VARGAS FUNDO DE INVESTIMENTO IMOBILIÁRIO,INVESTIDORES EM GERAL
TAG GR IV FUNDO DE INVESTIMENTO IMOBILIÁRIO,INVESTIDOR QUALIFICADO
MB FUNDO DE INVESTIMENTO IMOBILIÁRIO,INVESTIDOR QUALIFICADO
FII CAMPUS FARIA LIMA,INVESTIDORES EM GERAL
FATOR VERITA FII,INVESTIDORES EM GERAL
TAURUS PATRIMONIUM FUNDO DE INVESTIMENTO IMOBILIÁRIO - FII,INVESTIDOR QUALIFICADO
CSHG LOGÍSTICA FUNDO DE INVESTIMENTO IMOBILIÁRIO - FII,INVESTIDORES EM GERAL
GENERAL SHOPPING E OUTLETS DO BRASIL FII,INVESTIDORES EM GERAL
BTG PACTUAL LOGÍSTICA FUNDO DE INVESTIMENTO IMOBILIÁRIO,INVESTIDORES EM GERAL
BTG PACTUAL LOGÍSTICA FII,INVESTIDOR QUALIFICADO
BTG PACTUAL LOGÍSTICA FUNDO DE INVESTIMENTO IMOBILIÁRIO,INVESTIDOR QUALIFICADO
RB CAPITAL DESENVOLVIMENTO RESIDENCIAL II - FII,INVESTIDOR QUALIFICADO
KINEA RENDA IMOBILIARIA FII,INVESTIDORES EM GERAL
SABIA FUNDO DE INVESTIMENTO IMOBILIARIO - FII,INVESTIDOR QUALIFICADO
SABIA FUNDO DE INVESTIMENTO IMOBILIÁRIO - FII,INVESTIDOR QUALIFICADO
EXITUS DE INVESTIMENTO IMOBILIARIO - FII,INVESTIDOR PROFISSIONAL
ATRIUM NACOES UNIDAS FI IMOBILIARIO,INVESTIDORES EM GERAL
ATRIUM NAÇÕES UNIDAS FII,INVESTIDORES EM GERAL
ATRIUM NAÇÕES UNIDAS FUNDO DE INVESTIMENTO IMOBILIÁRIO - FII,INVESTIDOR QUALIFICADO
FII ATRIUM NAÇÕES UNIDAS,INVESTIDORES EM GERAL
VINCI OFFICES FUNDO DE INVESTIMENTO IMOBILIÁRIO,INVESTIDORES EM GERAL
BB RENDA CORPORATIVA FUNDO DE INVESTIMENTO IMOBILIÁRIO - FII,INVESTIDORES EM GERAL
FUNDO DE INVESTIMENTO IMOBILIÁRIO SC 401,INVESTIDORES EM GERAL
HEDGE ATRIUM SHOPPING SANTO ANDRÉ FUNDO DE INVEST IMOB,INVESTIDORES EM GERAL
OAR FUNDO DE INVESTIMENTO IMOBILIÁRIO,INVESTIDOR QUALIFICADO
FUNDO DE INVESTIMENTO IMOBILIÁRIO CAIXA TRX LOGÍSTICA RENDA,INVESTIDORES EM GERAL
FUNDO DE INVESTIMENTO IMOBILIARIO DA REGIAO DO PORTO,INVESTIDOR QUALIFICADO
FUNDO DE INVESTIMENTO IMOBILIÁRIO THE ONE,INVESTIDORES EM GERAL
FUNDO DE INVESTIMENTO IMOBILIÁRIO CAIXA INCORPORAÇÃO,INVESTIDOR PROFISSIONAL
RB CAPITAL ANHANGUERA FUNDO DE INVESTIMENTO IMOBILIÁRIO,INVESTIDOR QUALIFICADO E PROFISSIONAL
PARQUE ANHANGUERA FUNDO DE INVESTIMENTO IMOBILIÁRIO - FII,INVESTIDOR QUALIFICADO E PROFISSIONAL
PARQUE ANHANGUERA FUNDO DE INVESTIMENTO IMOBILIÁRIO,INVESTIDORES EM GERAL
CAIXA FUNDO DE INVESTIMENTO IMOBILIARIO PORTO MARAVILHA,INVESTIDOR QUALIFICADO
OSASCO PROPERTIES FUNDO DE INVESTIMENTO IMOBILIÁRIO,INVESTIDOR QUALIFICADO
SALUS FUNDO DE INVESTIMENTO IMOBILIÁRIO - FII,INVESTIDORES EM GERAL
FII CAIXA DESENVOLVIMENTO IMOBILIARIO,INVESTIDOR QUALIFICADO
FII VBI FL 4440,INVESTIDORES EM GERAL
VBI FL 4440 FII,INVESTIDORES EM GERAL
FUNDO DE INVESTIMENTO IMOBILIÁRIO - FII ELDORADO,INVESTIDORES EM GERAL
PSG FUNDO DE INVESTIMENTO IMOBILIÁRIO,INVESTIDOR QUALIFICADO
TERRA - FUNDO DE INVESTIMENTO IMOBILIÁRIO,INVESTIDOR QUALIFICADO
JS REAL ESTATE MULTIGESTÃO FUNDO DE INVESTIMENTO IMOBILIÁRIO,INVESTIDORES EM GERAL
CIBRASEC CRÉDITO IMOBILIÁRIO - FII,INVESTIDOR QUALIFICADO
FUNDO DE INVESTIMENTO IMOBILIÁRIO MERCANTIL DO BRASIL,INVESTIDORES EM GERAL
FUNDO DE INVESTIMENTO IMOBILIARIO - FII CENESP,INVESTIDORES EM GERAL
FUNDO DE INVESTIMENTO IMOBILIÁRIO - FII CENESP,INVESTIDORES EM GERAL
AQUILLA FUNDO DE INVESTIMENTO IMOBILIÁRIO,INVESTIDOR QUALIFICADO E PROFISSIONAL
RB CAPITAL PATRIMONIAL V FUNDO DE INVESTIMENTO IMOBILIÁRIO,INVESTIDOR QUALIFICADO E PROFISSIONAL
BRAZILIAN GRAVEYARD AND DEATH CARE SERVICES FUNDO DE INV,INVESTIDORES EM GERAL
FUNDO DE INVESTIMENTO IMOBILIÁRIO DO ESTADO DE SÃO PAULO,INVESTIDOR QUALIFICADO
RB CAPITAL GENERAL SHOPPING SULACAP FII,INVESTIDORES EM GERAL
TREVISO - FUNDO DE INVESTIMENTO IMOBILIÁRIO,INVESTIDOR QUALIFICADO
SONDA FUNDO DE INVESTIMENTO IMOBILIÁRIO - FII,INVESTIDOR QUALIFICADO
VECTOR QUELUZ LAJES CORPORATIVAS FUNDO DE INVESTIMENTO IMOBI,INVESTIDOR QUALIFICADO
FUNDO INVESTIMENTO IMOBILIÁRIO RIO BRAVO RENDA EDUCACIONAL,INVESTIDORES EM GERAL
REAG CICA JUNDIAI FUNDO DE INVESTIMENTO IMOBILIARIO  FII,INVESTIDOR QUALIFICADO
FII CYRELA THERA CORPORATE,INVESTIDORES EM GERAL
FUDO DE INVESTIMENTO IMOBILIÁRIO OURINVEST LOGÍSTICA,INVESTIDORES EM GERAL
PERSONALE I FUNDO DE INVESTIMENTO IMOBILIÁRIO - FII,INVESTIDOR QUALIFICADO
AQ3 RENDA FUNDO DE INVESTIMENTO IMOBILIÁRIO,INVESTIDOR QUALIFICADO
BRAZIL REALTY FUNDO DE INVESTIMENTO IMOBILIÁRIO,INVESTIDOR QUALIFICADO
FIRENZE FUNDO DE INVESTIMENTO IMOBILIÁRIO,INVESTIDOR QUALIFICADO
POLO FII RECEBÍVEIS IMOBILIÁRIOS I,INVESTIDOR QUALIFICADO
FUNDO DE INVESTIMENTO IMOBILIÁRIO RAILWAY MALL I - FII,INVESTIDOR QUALIFICADO
ARENA FUNDO DE INVESTIMENTO IMOBILIÁRIO,INVESTIDOR QUALIFICADO
FUNDO DE INVESTIMENTO IMOBILIÁRIO INDUSTRIAL DO BRASIL,INVESTIDORES EM GERAL
ESTRUTURA II - FUNDO DE INEVSTIMENTO IMOBILIÁRIO - FII,INVESTIDOR QUALIFICADO
BM BRASCAN LAJES CORPORATIVAS FII,INVESTIDORES EM GERAL
FII BM BRASCAN LAJES CORPORATIVAS,INVESTIDORES EM GERAL
BB PROGRESSIVO II FUNDO DE INVESTIMENTO IMOBILIÁRIO - FII,INVESTIDORES EM GERAL
FUNDO DE INVESTIMENTO IMOBILIÁRIO RENDA CORPORATIVA ANGICO,INVESTIDOR QUALIFICADO
FUNDO DE INVESTIMENTO IMOBILIÁRIO VOTORANTIM SECURITIES III,INVESTIDOR QUALIFICADO
KINEA II REAL ESTATE EQUITY FUNDO DE INVESTIMENTO IMOB,INVESTIDOR QUALIFICADO
PACALU FUNDO DE INVESTIMENTO IMOBILIÁRIO,INVESTIDOR QUALIFICADO
FUNDO DE INVESTIMENTO IMOBILIÁRIO JHSF CATARINA CORPORATE,INVESTIDOR QUALIFICADO
HAZ FUNDO DE INVESTIMENTO IMOBILIÁRIO,INVESTIDOR QUALIFICADO
FUNDO DE INVESTIMENTO IMOBILIÁRIO POLO ESTOQUE - FII,INVESTIDOR QUALIFICADO
FUNDO DE INVESTIMENTO IMOBILIÁRIO POLO SHOPPING INDAIATUBA,INVESTIDOR QUALIFICADO
HEDGE SHOPPING PRAÇA DA MOÇA FUNDO DE INVEST IMOB,INVESTIDOR QUALIFICADO
FUNDO DE INVESTIMENTO IMOBILIÁRIO - FII AMETISTA,INVESTIDORES EM GERAL
FUNDO INVESTIMENTO IMOBILIARIO AMETISTA,INVESTIDORES EM GERAL
FUNDO DE INVESTIMENTO IMOBILIARIO - FII PATEO BANDEIRANTES,INVESTIDORES EM GERAL
FUNDO DE INVESTIMENTO IMOBILIÁRIO - FII PATEO BANDEIRANTES,INVESTIDORES EM GERAL
FII PATEO BANDEIRANTES,INVESTIDORES EM GERAL
NEWPORT RENDA URBANA FUNDO DE INVESTIMENTO IMOBILIARIO FII,INVESTIDORES EM GERAL
FII SHOPPING JARDIM SUL,INVESTIDORES EM GERAL
TRX EDIFICIOS CORPORATIVOS FII,INVESTIDORES EM GERAL
TRX EDIFÍCIOS CORPORATIVOS FII,INVESTIDORES EM GERAL
FUNDO DE INVESTIMENTO IMOBILIARIO RIO NEGRO,INVESTIDORES EM GERAL
FUNDO DE INVESTIMENTO IMOBILIARIO - FII PLUS,INVESTIDOR QUALIFICADO
FI IMOBILIARIO PLUS,INVESTIDOR QUALIFICADO
FUNDO DE INVESTIMENTO IMOBILIÁRIO PLUS,INVESTIDOR QUALIFICADO
CAIXA FII VLT VEICULO LEVE SOBRE TRILHOS,INVESTIDOR QUALIFICADO
VILA OLIMPIA FUNDO DE INVESTIMENTO IMOBILIARIO - FII,INVESTIDORES EM GERAL
FUNDO DE INVESTIMENTO IMOBILIARIO - FII EDIFICIO GALERIA,INVESTIDORES EM GERAL
FUNDO DE INVESTIMENTO IMOBILIÁRIO - FII EDIFICIO GALERIA,INVESTIDORES EM GERAL
FUNDO DE INVESTIMENTO IMOBILIÁRIO - FII EDIFÍCIO GALERIA,INVESTIDORES EM GERAL
SUCCESS - FUNDO DE INVESTIMENTO IMOBILIÁRIO,INVESTIDOR QUALIFICADO
BB RENDA DE PAPÉIS IMOBILIÁRIOS FUNDO DE INVESTIMENTO IMOBIL,INVESTIDOR QUALIFICADO
INTERNACIONAL SHOPPING FII,INVESTIDOR QUALIFICADO
INTERNACIONAL SHOPPING FUNDO DE INVESTIMENTO IMOBILIÁRIO,INVESTIDOR QUALIFICADO
FUNDO DE INVESTIMENTO IMOBILIÁRIO SHOPPING CIDADE JARDIM,INVESTIDOR QUALIFICADO
FII SHOPPING CIDADE JARDIM,INVESTIDOR QUALIFICADO
FUNDO DE INVESTIMENTOS IMOBILIÁRIOS BR HÓTEIS,INVESTIDOR QUALIFICADO E PROFISSIONAL
INHAUMA FUNDO DE INVESTIMENTO IMOBILIARIO,INVESTIDOR QUALIFICADO
JFDCAM - FUNDO DE INVESTIMENTO IMOBILIÁRIO - FII,INVESTIDOR QUALIFICADO
SP DOWNTOWN FUNDO DE INVESTIMENTO IMOBILIÁRIO - FII,INVESTIDORES EM GERAL
BANRISUL NOVAS FRONTEIRAS FII,INVESTIDORES EM GERAL
FUNDO DE INVESTIMENTO IMOBILIÁRIO RIO BRAVO RENDA VAREJO,INVESTIDORES EM GERAL
RIO BRAVO CREDITO IMOBILIARIO II FI IMOBILIARIO,INVESTIDORES EM GERAL
ORCHID - FUNDO DE INVESTIMENTO IMOBILIÁRIO,INVESTIDOR PROFISSIONAL
FII CEO CYRELA COMMERCIAL PROPERTIES,INVESTIDORES EM GERAL
SÃO DOMINGOS - FUNDO DE INVESTIMENTO IMOBILIÁRIO - FII,INVESTIDOR QUALIFICADO
FUNDO INVESTIMENTO IMOBILIARIO SDI RIO BRAVO RENDA LOGISTICA,INVESTIDORES EM GERAL
KINEA RENDIMENTOS IMOBILIÁRIOS FII,INVESTIDORES EM GERAL
XP CORPORATE MACAÉ FUNDO DE INVESTIMENTO IMOBILIÁRIO,INVESTIDORES EM GERAL
FUNDO DE INVESTIMENTO IMOBILIÁRIO SOFI,INVESTIDOR QUALIFICADO
SOCOPA FUNDO DE INVESTIMENTO IMOBILIÁRIO - FII,INVESTIDOR QUALIFICADO
SANTANDER AGENCIAS FUNDO DE INVESTIMENTO IMOBILIARIO FII,INVESTIDORES EM GERAL
JHSF RIO BRAVO FAZENDA BOA VISTA CAPITAL PROTEGIDO FII,INVESTIDORES EM GERAL
MÉRITO DESENVOLVIMENTO IMOBILIÁRIO I FII,INVESTIDORES EM GERAL
VISTA REAL ESTATE FUNDO DE INVESTIMENTO IMOBILIÁRIO,INVESTIDOR QUALIFICADO
HEDGE REALTY DEVELOPMENT FUNDO DE INVESTIMENTO IMOBILIÁRIO,INVESTIDOR QUALIFICADO
TRANSINC FUNDO DE INVESTIMENTO IMOBILIÁRIO - FII,INVESTIDORES EM GERAL
FII TRANSINC,INVESTIDORES EM GERAL
FUNDO DE INVESTIMENTO IMOBILIÁRIO GENERAL SEVERIANO,INVESTIDOR QUALIFICADO E PROFISSIONAL
FUNDO DE INVESTIMENTO IMOBILIARIO - FII NOVO HORIZONTE,INVESTIDORES EM GERAL
FUNDO DE INVESTIMENTO IMOBILIÁRIO HUMAITÁ - FII,INVESTIDOR PROFISSIONAL
CAIXA RIO BRAVO FUNDO DE FII,INVESTIDORES EM GERAL
CSHG GR LOUVEIRA - FUNDO DE INVESTIMENTO IMOBILIÁRIO - FII,INVESTIDORES EM GERAL
GR LOUVEIRA FUNDO DE INVESTIMENTO IMOBILIÁRIO,INVESTIDORES EM GERAL
CASTELLO BRANCO OFFICE PARK FUNDO DE INVEST IMOBILIÁRIO FII,INVESTIDORES EM GERAL
POLO FII RECEBÍVEIS IMOBILIÁRIOS II,INVESTIDORES EM GERAL
FUNDO DE INVEST. IMOBILIÁRIO PEDRA NEGRA RENDA IMOBILIÁRIA,INVESTIDORES EM GERAL
JIVE ATIVOS IMOBILIÁRIOS FUNDO DE INVESTIMENTO IMOBILIÁRIO,INVESTIDOR QUALIFICADO
SB FUNDO DE INVESTIMENTO IMOBILIÁRIO,INVESTIDOR QUALIFICADO E PROFISSIONAL
LATERES FUNDO DE INVESTIMENTO IMOBILIÁRIO - FII,INVESTIDOR QUALIFICADO
FUNDO DE INVESTIMENTO IMOBILIARIO JHSF CATARINA CORPORATE BE,INVESTIDOR QUALIFICADO
FI IMOBILIARIO JHSF CATARINA CORPORATE BERLIM,INVESTIDOR QUALIFICADO
JPP CAPITAL FUNDO DE INVESTIMENTO IMOBILIÁRIO - FII,INVESTIDORES EM GERAL
FUNDO DE INVESTIMENTO IMOBILIARIO - FII GOLDEN,INVESTIDORES EM GERAL
GOLDEN FUNDO DE INVESTIMENTO IMOBILIARIO,INVESTIDORES EM GERAL
FUNDO DE INVESTIMENTO IMOBILIARIO - FII GOLDEN,INVESTIDOR QUALIFICADO
FUNDO DE INVESTIMENTO IMOBILIÁRIO - FII GOLDEN,INVESTIDOR QUALIFICADO
FUNDO DE INVESTIMENTO IMOBILIÁRIO SHOPPING LIGHT,INVESTIDOR QUALIFICADO
FUNDO DE INVESTIMENTO IMOBILIARIO SHOPPING LIGHT,INVESTIDOR QUALIFICADO
FII SHOPPING LIGHT,INVESTIDOR QUALIFICADO
FUNDO DE INVESTIMENTO IMOBILIÁRIO - FII SIA CORPORATE,INVESTIDOR QUALIFICADO
FII BRASIL PLURAL ABSOLUTO FUNDOS DE FUNDOS,INVESTIDORES EM GERAL
RIO BRAVO IFIX FUNDO DE FUNDOS DE INVESTIMENTI IMOBILIARIO,INVESTIDORES EM GERAL
RIO BRAVO FUNDO DE FUNDOS DE INVESTIMENTO IMOBILIÁRIO,INVESTIDORES EM GERAL
SALUS II FUNDO DE INVESTIMENTO IMOBILIÁRIO - FII,INVESTIDOR QUALIFICADO E PROFISSIONAL
TB OFFICE FII,INVESTIDORES EM GERAL
FUNDO DE INVESTIMENTO IMOBILIÁRIO - FII TB OFFICE,INVESTIDORES EM GERAL
REAG RENDA FUNDO DE INVESTIMENTO - FII,INVESTIDORES EM GERAL
REAG MULTI ATIVOS IMOBILIÁRIOS - FII,INVESTIDORES EM GERAL
VINCI SHOPPING CENTERS FUNDO DE INVESTIMENTO IMOBILIÁRIO-FII,INVESTIDORES EM GERAL
MAIS SHOPPING FII,INVESTIDOR QUALIFICADO
MAIS SHOPPING FUNDO DE INVESTIMENTO IMOBILIÁRIO,INVESTIDOR QUALIFICADO
GENERAL SHOPPING ATIVO E RENDA FUNDO DE INVEST IMOB,INVESTIDORES EM GERAL
PESCARA FUNDO DE INVESTIMENTO IMOBILIÁRIO - FII,INVESTIDOR QUALIFICADO
SAFIRA FUNDO DE INVESTIMENTO IMOBILIÁRIO,INVESTIDOR QUALIFICADO
VANQUISH FUNDO DE INVESTIMENTO IMOBILIÁRO - FII,INVESTIDOR QUALIFICADO
NF CAPITAL II FUNDO DE INVESTIMENTO IMOBILIÁRIO,INVESTIDOR PROFISSIONAL
VIDA NOVA FUNDO DE INVESTIMENTO IMOBILIÁRIO - FII,INVESTIDORES EM GERAL
FII VOTORANTIM SECURITIES MASTER,INVESTIDOR QUALIFICADO
FII NCH BRASIL RECEBÍVEIS IMOBILIÁRIOS,INVESTIDOR QUALIFICADO
FII NCH BRASIL RECEBÍVEIS IMOBILIÁRIOS,INVESTIDORES EM GERAL
ETR PROPERTIES FUNDO DE INVESTIMENTO IMOBILIÁRIO - FII,INVESTIDOR QUALIFICADO
YAGO FUNDO DE INVESTIMENTO IMOBILIÁRIO,INVESTIDOR QUALIFICADO
BIRD FUNDO DE INVESTIMENTO IMOBILIÁRIO - FII,INVESTIDOR PROFISSIONAL
HEDGE TOP FOFII 3 FUNDO DE INVESTIMENTO IMOBILIÁRIO,INVESTIDORES EM GERAL
XP HOTÉIS - FUNDO DE INVESTIMENTO IMOBILIÁRIO - FII,INVESTIDOR QUALIFICADO
SPA FUNDO DE INVESTIMENTO IMOBILIÁRIO,INVESTIDORES EM GERAL
EZTB FUNDO DE INVESTIMENTO IMOBILIÁRIO - FII,INVESTIDOR PROFISSIONAL
BTG PACTUAL PRIME OFFICES I - FII,INVESTIDOR QUALIFICADO E PROFISSIONAL
RB CAPITAL PETROS FII,INVESTIDOR QUALIFICADO
FUNDO DE INVESTIMENTO IMOBILIÁRIO INFRA REAL ESTATE - FII,INVESTIDOR QUALIFICADO
FUNDO DE INVESTIMENTO IMOBILIÁRIO POLO ESTOQUE II - FII,INVESTIDOR QUALIFICADO
QUORUM HASTA - FUNDO DE INVESTIMENTO IMOBILIÁRIO - FII,INVESTIDOR QUALIFICADO
FII EXCLUSIVO INFRA PATRIMONIAL II,INVESTIDOR PROFISSIONAL
TARANTO FUNDO DE INVESTIMENTO IMOBILIÁRIO,INVESTIDOR QUALIFICADO
CIDADE - FUNDO DE INVESTIMENTO IMOBILIARIO - FII,INVESTIDOR QUALIFICADO
CIDADE - FUNDO DE INVESTIMENTO IMOBILIÁRIO - FII,INVESTIDOR QUALIFICADO
GOODMAN PATRIMONIAL I FUNDO DE INVESTIMENTO IMOBILIÁRIO,INVESTIDOR QUALIFICADO
BRL EDIFÍCIOS COMERCIAIS FUNDO DE INVESTIMENTO IMOBILIÁRIO,INVESTIDOR QUALIFICADO
CHALLENGER FUNDO DE INVESTIMENTO IMOBILIÁRIO - FII,INVESTIDOR QUALIFICADO
CAPITANIA SECURITIES II FUNDO DE INVESTIMENTO IMOBILIÁRIO,INVESTIDORES EM GERAL
CAPITÂNIA SECURITIES II FUNDO DE INVESTIMENTO IMOBILIÁRIO,INVESTIDORES EM GERAL
CAPITANIA SECURITIES II FII,INVESTIDOR QUALIFICADO
CAPITÂNIA SECURITIES II FII,INVESTIDORES EM GERAL
BRL LAJES CORPORATIVA FUNDO DE INVESTIMENTO IMOBILIÁRIO,INVESTIDOR PROFISSIONAL
OURO VERDE DESENVOLVIMENTO IMOBILIÁRIO I FII,INVESTIDORES EM GERAL
SAPUCAÍ RIO FUNDO DE INVESTIMENTO IMOBILIÁRIO - FII,INVESTIDOR QUALIFICADO
AB CAPITAL FUNDO DE INVESTIMENTO IMOBILIÁRIO,INVESTIDOR PROFISSIONAL
FUNDO DE INVESTIMENTO IMOBILIÁRIO FL 3.500 I - FII,INVESTIDOR QUALIFICADO
LA DEFÉNSE FUNDO DE INVESTIMENTO IMOBILIÁRIO - FII,INVESTIDORES EM GERAL
RB CAPITAL DESENVOLVIMENTO RESIDENCIAL III - FII,INVESTIDOR QUALIFICADO
VGS FUNDO DE INVESTIMENTO IMOBILIÁRIO - FII,INVESTIDOR QUALIFICADO
2509 FUNDO DE INVESTIMENTO IMOBILIARIO - FII,INVESTIDOR QUALIFICADO
CTBH FUNDO DE INVESTIMENTO IMOBILIÁRIO - FII,INVESTIDOR QUALIFICADO
FII MORUMBI TOWN I,INVESTIDOR QUALIFICADO
FUNDO DE INVESTIMENTO IMOBILIÁRIO MORUMBI TOWN I,INVESTIDOR QUALIFICADO
LOFT I FUNDO DE INVESTIMENTO IMOBILIÁRIO,INVESTIDOR QUALIFICADO
FUNDO DE INVESTIMENTO IMOBILIÁRIO MINT EDUCACIONAL,INVESTIDOR PROFISSIONAL
PLT FUNDO IMOBILIÁRIO - FII,INVESTIDOR PROFISSIONAL
17007 FUNDO DE INVESTIMENTO IMOBILIÁRIO,INVESTIDOR PROFISSIONAL
AB CAPITAL II FUNDO DE INVESTIMENTO IMOBILIÁRIO,INVESTIDOR PROFISSIONAL
MIKEONE FUNDO DE INVESTIMENTO IMOBILIÁRIO,INVESTIDOR QUALIFICADO
FUNDO DE INVESTIMENTO IMOBILIÁRIO - FII 4KIDS,INVESTIDOR QUALIFICADO
IBC FUNDO DE INVESTIMENTOS IMOBILIÁRIOS - FII,INVESTIDOR PROFISSIONAL
CASPER FUNDO DE INVESTIMENTO IMOBILIÁRIO - FII,INVESTIDOR PROFISSIONAL
PLATINUM FUNDO DE INVESTIMENTO IMOBILIÁRIO,INVESTIDOR QUALIFICADO
CEDRO - FUNDO DE INVESTIMENTO IMOBILIÁRIO - FII,INVESTIDOR PROFISSIONAL
FUNDO DE INVESTIMENTO IMOBILIARIO TC BTOWERS,INVESTIDOR QUALIFICADO
BRADESCO CARTEIRA IMOBILIÁRIA ATIVA FII,INVESTIDORES EM GERAL
FUNDO DE INVESTIMENTO IMOBILIÁRIO VOTORANTIM SECURITIES IV,INVESTIDOR QUALIFICADO
FUNDO DE INVESTIMENTO IMOBILIÁRIO HIERON BERLIM,INVESTIDOR QUALIFICADO
FII BRISA RENDA IMOBILIÁRIA,INVESTIDOR QUALIFICADO
BRISA RENDA IMOBILIARIA FII,INVESTIDOR QUALIFICADO
BB RECEBIVEIS IMOBILIARIOS FUNDO DE INVESTIMENTO IMOB FII,INVESTIDORES EM GERAL
BRESCO LOGÍSTICA FUNDO DE INVESTIMENTO IMOBILIÁRIO,INVESTIDORES EM GERAL
FUNDO DE INVESTIMENTO IMOBILIÁRIO - FII MEILI,INVESTIDORES EM GERAL
FUNDO DE INVESTIMENTO IMOBILIARIO - FII MEILI,INVESTIDORES EM GERAL
FII MEILI,INVESTIDORES EM GERAL
HEDGE TOP FOFII FUNDO DE INVESTIMENTO IMOBILIÁRIO,INVESTIDOR QUALIFICADO
FGRP FUNDO DE INVESTIMENTO IMOBILIÁRIO,INVESTIDORES EM GERAL
BPGB-001 FUNDO DE INVESTIMENTO IMOBILIÁRIO,INVESTIDOR QUALIFICADO
BPG LOGÍSTICA I FUNDO DE INVESTIMENTO IMOBILIÁRIO,INVESTIDOR QUALIFICADO
TA FUNDO DE INVESTIMENTO IMOBILIARIO,INVESTIDOR PROFISSIONAL
EBT FUNDO DE INVESTIMENTO IMOBILIÁRIO,INVESTIDOR QUALIFICADO
SKM FUNDO DE INVESTIMENTO IMOBILIÁRIO,INVESTIDOR QUALIFICADO
FUNDO DE INVESTIMENTO IMOBILIÁRIO BRASIL VAREJO FII,INVESTIDORES EM GERAL
HAMAL - FUNDO DE INVESTIMENTO IMOBILIÁRIO - FII,INVESTIDOR QUALIFICADO
FUNDO DE INVESTIMENTO IMOBILIARIO RBR PROPERTIES,INVESTIDORES EM GERAL
FUNDO DE INVESTIMENTO IMOBILIÁRIO VOTORANTIM PATRIMONIAL V,INVESTIDOR QUALIFICADO
IRB INTERNACIONAL FUNDO DE INVESTIMENTO IMOBILIÁRIO - FII,INVESTIDOR QUALIFICADO
IRB INTERNACIONAL FII,INVESTIDOR QUALIFICADO
IRB INTERNACIONAL FUNDO DE INVESTIMENTO IMOBILIARIO - FII,INVESTIDOR QUALIFICADO
PARKING PARTNERS FUNDO DE INVESTIMENTO IMOBILIÁRIO - FII,INVESTIDOR PROFISSIONAL
VRE DESENVOLVIMENTO III FUNDO DE INVESTIMENTO IMOBILIÁRIO,INVESTIDOR QUALIFICADO
IPS PB FUNDO DE INVESTIMENTO IMOBILIÁRIO,INVESTIDOR QUALIFICADO
NOVA I - FUNDO DE INVESTIMENTO IMOBILIARIO - FII,INVESTIDOR QUALIFICADO
EMPRO FUNDO DE INVESTIMENTO IMOBILIÁRIO,INVESTIDORES EM GERAL
BRAZIL PROPERTIES FUNDO DE INVESTIMENTO IMOBILIÁRIO - FII,INVESTIDOR QUALIFICADO
TC ALMAVI FII,INVESTIDOR PROFISSIONAL
TC ALMAVI FUNDO DE INVESTIMENTO IMOBILIARIO - FII,INVESTIDOR PROFISSIONAL
BTERRA FUNDO DE INVESTIMENTO IMOBILIÁRIO,INVESTIDOR QUALIFICADO
SOLARIUM FII FUNDO DE INVESTIMENTO IMOBILIARIO,INVESTIDOR QUALIFICADO
ALIANZA REAL ESTATE FUNDO DE INVESTIMENTO IMOBILIÁRIO - FII,INVESTIDOR PROFISSIONAL
FUNDO DE INVESTIMENTO IMOBILIÁRIO CAIXA CONVIDA SUAPE,INVESTIDOR QUALIFICADO
BANESTES RECEBIVEIS IMOBILIARIOS FII,INVESTIDORES EM GERAL
G5 JOMAFIL - FUNDO DE INVESTIMENTO IMOBILIARIO - FII,INVESTIDOR QUALIFICADO E PROFISSIONAL
MULTI SHOPPINGS FUNDO DE INVESTIMENTO IMOBILIARIO - FII,INVESTIDORES EM GERAL
MULTI SHOPPINGS  FII,INVESTIDORES EM GERAL
MULTI SHOPPINGS FII,INVESTIDORES EM GERAL
IZAR - FUNDO DE INVESTIMENTO IMOBILIÁRIO - FII,INVESTIDOR PROFISSIONAL
MULTIOFFICES 1 - FUNDO DE INVESTIMENTO IMOBILIÁRIO,INVESTIDOR QUALIFICADO
MULTI PROPERTIES FII,INVESTIDOR QUALIFICADO
FUNDO DE INVESTIMENTO IMOBILIÁRIO VOTORANTIM BII BTS - FII,INVESTIDOR QUALIFICADO
BB RENDA DE PAPÉIS IMOBILIÁRIOS II,INVESTIDOR QUALIFICADO
FUNDO DE INVESTIMENTO IMOBILIÁRIO LECREC,INVESTIDOR QUALIFICADO
NIHAL - FUNDO DE INVESTIMENTO IMOBILIÁRIO - FII,INVESTIDOR PROFISSIONAL
GOODMAN PATRIMONIAL II FUNDO DE INVESTIMENTO IMOBILIÁRIO,INVESTIDOR PROFISSIONAL
BM II FUNDO DE INVESTIMENTO IMOBILIÁRIO,INVESTIDOR PROFISSIONAL
FUNDO DE INVESTIMENTO IMOBILIÁRIO JK E - FII,INVESTIDOR PROFISSIONAL
FUNDO DE INVESTIMENTO IMOBILIARIO JK D - FII,INVESTIDOR PROFISSIONAL
FUNDO DE INVESTIMENTO IMOBILIARIO MV9 - FII,INVESTIDORES EM GERAL
FUNDO DE INVESTIMENTO IMOBILIÁRIO MV9 - FII,INVESTIDORES EM GERAL
FUNDO DE INVESTIMENTO IMOBILIARIO SF - FII,INVESTIDOR PROFISSIONAL
FUNDO DE INVESTIMENTO IMOBILIARIO TM - FII,INVESTIDOR PROFISSIONAL
FUNDO DE INVESTIMENTO IMOBILIÁRIO CJ - FII,INVESTIDORES EM GERAL
FUNDO DE INVESTIMENTO IMOBILIÁRIO - CJ FII,INVESTIDORES EM GERAL
MAUÁ CAPITAL RECEBÍVEIS IMOBILIÁRIOS - FII,INVESTIDORES EM GERAL
FUNDO DE INVESTIMENTO IMOBILIÁRIO GREEN TOWERS,INVESTIDOR PROFISSIONAL
FUNDO DE INVESTIMENTO IMOBILIÁRIO GREEN TOWERS,INVESTIDORES EM GERAL
FUNDO DE INVESTIMENTO IMOBILIÁRIO VOTORANTIM PATRIMONIAL XII,INVESTIDOR PROFISSIONAL
FUNDO DE INVESTIMENTO IMOBILIÁRIO VOTORANTIM SHOPPING,INVESTIDORES EM GERAL
TOP CENTER FII,INVESTIDOR QUALIFICADO
TOP CENTER FUNDO DE INVESTIMENTO IMOBILIÁRIO,INVESTIDOR QUALIFICADO
FII NORTHWEST INVESTIMENTOS IMOBILIÁRIOS EM SAÚDE FUND I,INVESTIDOR PROFISSIONAL
NORTHWEST INVESTIMENTOS IMOBILIÁRIOS EM SAÚDE FUND I - FII,INVESTIDORES EM GERAL
JT PREV FUNDO DE INVESTIMENTO IMOBILIÁRIO D. HAB,INVESTIDORES EM GERAL
BRIO REAL ESTATE II,INVESTIDORES EM GERAL
PRIME 16 FUNDO DE INVESTIMENTO IMOBILIÁRIO,INVESTIDOR PROFISSIONAL
