Nome_Fundo,Publico_Alvo
EVEN PERMUTA KINEA FII FUNDO DE INVESTIMENTO IMOBILIÁRIO,INVESTIDORES EM GERAL
FUNDO DE INVESTIMENTO IMOBILIÁRIO KEYCASH,INVESTIDORES EM GERAL
NF CAPITAL FUNDO DE INVESTIMENTO IMOBILIÁRIO,INVESTIDOR PROFISSIONAL
LOFT II MAISON SÃO PAULO FUNDO DE INVESTIMENTO IMOBILIÁRIO,INVESTIDOR QUALIFICADO
FII - FUNDO DE INVESTIMENTO IMOBILIÁRIO NESTPAR,INVESTIDOR QUALIFICADO
VINCI LOGÍSTICA FUNDO DE INVESTIMENTO IMOBILIÁRIO,INVESTIDORES EM GERAL
XPCE RE FUNDO DE INVESTIMENTO IMOBILIÁRIO,INVESTIDOR PROFISSIONAL
XPCE RE FUNDO DE INVESTIMENTO IMOBILIÁRIO,INVESTIDOR QUALIFICADO
KINEA INDICES DE PREÇOS FII,INVESTIDOR QUALIFICADO
IRON CAPITAL REAL ESTATE I - FII,INVESTIDOR QUALIFICADO
FUNDO DE INVESTIMENTO IMOBILIÁRIO TG ATIVO REAL,INVESTIDORES EM GERAL
WHITE TIGER FUNDO DE INVESTIMENTO IMOBILIÁRIO,INVESTIDOR PROFISSIONAL
OURINVEST JPP FUNDO DE INVESTIMENTO IMOBILIÁRIO - FII,INVESTIDORES EM GERAL
GOLDEN WEST VX FUNDO DE INVESTIMENTO IMOBILIARIO,INVESTIDOR QUALIFICADO
BRAZIL REAL ESTATE VICTORY FUND I - FII,INVESTIDORES EM GERAL
WHITE BEAR FUNDO DE INVESTIMENTO IMOBILIÁRIO,INVESTIDOR QUALIFICADO
FUNDO DE INVESTIMENTO IMOBILIÁRIO - FII RBR DESENVOLVIMENTO,INVESTIDOR QUALIFICADO
RBR DESENVOLVIMENTO FI IMOBILIARIO,INVESTIDOR QUALIFICADO
FII RBR DESENVOLVIMENTO,INVESTIDOR QUALIFICADO
FUNDO DE INVESTIMENTO IMOBILIÁRIO TOURMALET I,INVESTIDOR PROFISSIONAL
FUNDO DE INVESTIMENTO IMOBILIARIO ANTILHAS,INVESTIDOR PROFISSIONAL
MALLS BRASIL PLURAL FUNDO DE INVESTIMENTO IMOBILIÁRIO,INVESTIDORES EM GERAL
CATUAI FUNDO DE INVESTIMENTO IMOBILIARIO,INVESTIDOR PROFISSIONAL
CATUAÍ FUNDO DE INVESTIMENTO IMOBILIÁRIO,INVESTIDOR PROFISSIONAL
XP LOG FUNDO DE INVESTIMENTO IMOBILIÁRIO,INVESTIDORES EM GERAL
XPCE RE FII 2 - FUNDO DE INVESTIMENTO IMOBILIÁRIO,INVESTIDOR PROFISSIONAL
RB CAPITAL RENDIMENTOS IMOBILIARIOS FII,INVESTIDOR QUALIFICADO
BRL VI FUNDO DE INVESTIMENTO IMOBILIÁRIO,INVESTIDOR QUALIFICADO
GGR COVEPI RENDA FUNDO DE INVESTIMENTO IMOBILIARIO,INVESTIDORES EM GERAL
DIAMANTE FUNDO DE INVESTIMENTO IMOBILIARIO,INVESTIDOR QUALIFICADO
JIVE ATIVOS IMOBILIÁRIOS II - FII,INVESTIDOR QUALIFICADO
SDI PROPERTIES - FUNDO DE INVESTIMENTO IMOBILIÁRIO,INVESTIDORES EM GERAL
TELLUS PROPERTIES FUNDO DE INVESTIMENTO IMOBILIÁRIO,INVESTIDORES EM GERAL
FUNDO DE INVESTIMENTO IMOBILIÁRIO BRASIL LAND,INVESTIDOR QUALIFICADO
FUNDO DE INVESTIMENTO IMOBILIÁRIO BRASIL,INVESTIDOR PROFISSIONAL
FUNDO DE INVESTIMENTOS IMOBILIARIOS - HABITAT I,INVESTIDORES EM GERAL
FUNDO DE INVESTIMENTO IMOBILIÁRIO FUTURO,INVESTIDOR QUALIFICADO
TREECORP REAL ESTATE FUNDO DE INVESTIMENTO IMOBILIÁRIO - I,INVESTIDOR QUALIFICADO
TREECORP REAL ESTATE FUNDO DE INVESTIMENTO IMOBILIÁRIO - I,INVESTIDORES EM GERAL
OLAVSEN FUNDO DE INVESTIMENTO IMOBILIÁRIO,INVESTIDOR QUALIFICADO
FUNDO DE INVESTIMENTO IMOBILIÁRIO VOTORANTIM LOGÍSTICA,INVESTIDOR QUALIFICADO
FUNDO DE INVESTIMENTO IMOBILIÁRIO VOTORANTIM LOGÍSTICA,INVESTIDORES EM GERAL
FUNDO DE INVESTIMENTO IMOBILIÁRIO QUINTAS,INVESTIDOR QUALIFICADO
FUNDO DE INVESTIMENTO IMOBILIÁRIO COLATERAL,INVESTIDOR QUALIFICADO
HEDGE AAA FUNDO DE INVESTIMENTO IMOBILIÁRIO,INVESTIDOR QUALIFICADO
HEDGE LOGÍSTICA FUNDO DE INVESTIMENTO IMOBILIÁRIO,INVESTIDOR QUALIFICADO
HEDGE LOGÍSTICA FUNDO DE INVESTIMENTO IMOBILIÁRIO,INVESTIDORES EM GERAL
RBR ALPHA MULTIESTRATÉGIA REAL ESTATE FII,INVESTIDORES EM GERAL
FUNDO DE INVESTIMENTO IMOBILIÁRIO SUCCESPAR VAREJO,INVESTIDOR PROFISSIONAL
FUNDO DE INVESTIMENTO IMOBILIARIO HARMONIA,INVESTIDOR QUALIFICADO
TRADE INVEST CARE II FUNDO DE INVESTIMENTO IMOBILIÁRIO - FII,INVESTIDOR PROFISSIONAL
MPM FUNDO DE INVESTIMENTO IMOBILIÁRIO,INVESTIDOR QUALIFICADO
RB CAPITAL PATRIMONIAL VI  FUNDO DE INVESTIMENTO IMOBILIÁRIO,INVESTIDOR QUALIFICADO
FUNDO DE INVESTIMENTO IMOBILIÁRIO MILLENIUM,INVESTIDORES EM GERAL
SJ AU LOGÍSTICA FUNDO DE INVESTIMENTO IMOBILIÁRIO,INVESTIDOR QUALIFICADO
GRUPO RCFA - FUNDO DE INVESTIMENTO IMOBILIÁRIO,INVESTIDOR PROFISSIONAL
GRUPO RCFA FUNDO DE INVESTIMENTO IMOBILIARIO,INVESTIDOR PROFISSIONAL
AIRPORT TOWN FUNDO DE INVESTIMENTO IMOBILIARIO FII,INVESTIDOR QUALIFICADO
AIRPORT TOWN FUNDO DE INVESTIMENTO IMOBILIARIO - FII,INVESTIDOR QUALIFICADO
PRAZO II -  FUNDO DE INVESTIMENTO IMOBILIÁRIO,INVESTIDOR QUALIFICADO
VALORA RE I FUNDO DE INVESTIMENTO IMOBILIÁRIO - FII,INVESTIDOR PROFISSIONAL
DEL MONTE FUNDO DE INVESTIMENTO IMOBILIÁRIO - FII,INVESTIDORES EM GERAL
FUNDO DE INVEST IMOB - FII UBS (BR) RECEBÍVEIS IMOBILIÁRIOS,INVESTIDORES EM GERAL
FII REC RECEBÍVEIS IMOBILIÁRIOS,INVESTIDORES EM GERAL
FUNDO DE INVEST IMOBILIÁRIO REC RECEBÍVEIS IMOBILIÁRIOS,INVESTIDORES EM GERAL
SICOOB AGÊNCIAS FUNDO DE INVESTIMENTO IMOBILIÁRIO,INVESTIDOR QUALIFICADO
SABUGAL FUNDO DE INVESTIMENTO IMOBILIARIO,INVESTIDOR QUALIFICADO
SABUGAL FUNDO DE INVESTIMENTO IMOBILIÁRIO,INVESTIDOR QUALIFICADO
BASILICA PARTNERS LED CORPORATE FII,INVESTIDOR QUALIFICADO
YAGUARA CAPITAL HIGH YIELD FUNDO DE INVESTIMENTO IMOBILIARIO,INVESTIDOR QUALIFICADO
RIZA ARCTIUM REAL ESTATE FUNDO DE INVESTIMENTO IMOBILIÁRIO,INVESTIDORES EM GERAL
RIZA ARCTIUM REAL ESTATE FII,INVESTIDOR QUALIFICADO E PROFISSIONAL
XP CRÉDITO IMOBILIÁRIO - FUNDO DE INVESTIMENTO IMOBILIÁRIO,INVESTIDORES EM GERAL
FUNDO DE INVESTIMENTO IMOBILIÁRIO XP INDUSTRIAL,INVESTIDORES EM GERAL
FUNDO DE INVEST IMOB - OURINVEST CYRELA,INVESTIDORES EM GERAL
FUNDO DE INVEST IMOB - OURINVEST RENDA ESTRUTURADA,INVESTIDORES EM GERAL
TRX REAL ESTATE FUNDO DE INVESTIMENTO IMOBILIÁRIO - FII,INVESTIDORES EM GERAL
FUNDO DE INVESTIMENTO IMOBILIARIO - OURINVEST RE I,INVESTIDOR QUALIFICADO
FUNDO DE INVESTIMENTO IMOBILIARIO VBI CRI,INVESTIDORES EM GERAL
ALIANZA TRUST RENDA IMOBILIARIA FII,INVESTIDORES EM GERAL
ALIANZA TRUST RENDA IMOBILIÁRIA FII,INVESTIDORES EM GERAL
XP MALLS FUNDO DE INVESTIMENTO IMOBILIARIO,INVESTIDORES EM GERAL
FII XP MALLS,INVESTIDORES EM GERAL
XP MALLS FUNDO DE INVESTIMENTO IMOBILIÁRIO FII,INVESTIDORES EM GERAL
IRIDIUM RECEBIVEIS IMOBILIÁRIOS FII,INVESTIDORES EM GERAL
FII IRIDIUM RECEBÍVEIS IMOBILIÁRIOS,INVESTIDORES EM GERAL
FUNDO DE INVEST. IMOBILIÁRIO HOSPITAL UNIMED SUL CAPIXABA,INVESTIDORES EM GERAL
IMMOB I  FII,INVESTIDOR PROFISSIONAL
FUNDO DE INVESTIMENTO IMOBILIARIOS HIRE PROPERTIES,INVESTIDOR QUALIFICADO
TOP CENTER II FII,INVESTIDOR QUALIFICADO
TOP CENTER II FUNDO DE INVESTIMENTO IMOBILIÁRIO,INVESTIDOR QUALIFICADO
FUNDO DE INVESTIMENTO IMOBILIARIO MOGNO FUNDO DE FUNDOS,INVESTIDORES EM GERAL
FUNDO DE INVESTIMENTO IMOBILIÁRIO MOGNO FUNDO DE FUNDOS,INVESTIDORES EM GERAL
PRAZO EDUCACIONAL - FII,INVESTIDOR QUALIFICADO
TRANCOSO FII,INVESTIDOR QUALIFICADO
FII BARIGUI RENDIMENTOS IMOBILIÁRIOS I FII,INVESTIDORES EM GERAL
RB CAPITAL TFO SITUS FUNDO DE INVESTIMENTO IMOBILIÁRIO - FII,INVESTIDOR QUALIFICADO
FII RBR RENDIMENTO HIGH GRADE,INVESTIDORES EM GERAL
FII IMOBILIÁRIO FII RBR REND HIGH GRADE,INVESTIDORES EM GERAL
CSHG RENDA URBANA FUNDO DE INVESTIMENTO IMOBILIARIO FII,INVESTIDORES EM GERAL
FII BTG PACTUAL CREDITO IMOBILIARIO,INVESTIDORES EM GERAL
FII BTG PACTUAL CRÉDITO IMOBILIÁRIO,INVESTIDORES EM GERAL
FUNDO DE INVESTIMENTO IMOBILIARIO - FII BRLPROP,INVESTIDOR QUALIFICADO
FUNDO DE INVESTIMENTO IMOBOLIÁRIO - FII BRLPROP,INVESTIDOR QUALIFICADO
FUNDO DE INVESTIMENTO IMOBILIÁRIO - FII BRLPROP,INVESTIDOR QUALIFICADO
VALORA RE III FUNDO DE INVESTIMENTO IMOBILIARIO - FII,INVESTIDORES EM GERAL
VALORA RE III FUNDO DE INVESTIMENTO IMOBILIÁRIO - FII,INVESTIDORES EM GERAL
HUSI FUNDO DE INVESTIMENTO IMOBILIÁRIO,INVESTIDOR QUALIFICADO
PATRIA EDIFICIOS CORPORATIVOS  FII,INVESTIDORES EM GERAL
FUNDO DE FUNDOS DE INVESTIMENTO IMOBILIÁRIO KINEA FII,INVESTIDORES EM GERAL
FUNDO DE INVESTIMENTO IMOBILIÁRIO NOVA IGUAÇU,INVESTIDORES EM GERAL
KINEA HIGH YIELD CRI FUNDO DE INVESTIMENTO IMOBILIÁRIO FII,INVESTIDOR QUALIFICADO
FII RBR CRÉDITO IMOBILIÁRIO HIGH YIELD,INVESTIDOR QUALIFICADO
FII RBR CRÉDITO IMOBILIÁRIO ESTRUTURADO,INVESTIDORES EM GERAL
FUNDO DE INVESTIMENTO IMOBILIÁRIO F2ZZ,INVESTIDOR QUALIFICADO
FII TORDESILHAS EMPREENDIMENTOS IMOBILIARIOS,INVESTIDORES EM GERAL
VX VI - FUNDO DE INVESTIMENTO IMOBILIÁRIO,INVESTIDOR PROFISSIONAL
VX VI - FUNDO DE INVESTIMENTO IMOBILIÁRIO,INVESTIDOR QUALIFICADO
VX VI FUNDO DE INVESTIMENTO IMOBILIÁRIO - FII,INVESTIDOR QUALIFICADO
LEGATUS SHOPPINGS FUNDO DE INVESTIMENTO IMOBILIÁRIO - FII,INVESTIDORES EM GERAL
HECTARE CE - FUNDO DE INVESTIMENTO IMOBILIÁRIO,INVESTIDORES EM GERAL
PRAZO FUNDO DE INVESTIMENTO IMOBILIÁRIO,INVESTIDOR QUALIFICADO
FUNDO DE INVESTIMENTO IMOBILIÁRIO CDURP,INVESTIDOR QUALIFICADO
NE LOGISTIC FUNDO DE INVESTIMENTO IMOBILIÁRIO,INVESTIDORES EM GERAL
FUNDO DE INVESTIMENTO IMOBILIÁRIO ATHENA,INVESTIDOR QUALIFICADO
FUNDO DE INVESTIMENTO IMOBILIÁRIO ATHENA I,INVESTIDORES EM GERAL
FUNDO DE INVESTIMENTO IMOBILIÁRIO ATHENA,INVESTIDORES EM GERAL
FII HECTARE CRI,INVESTIDORES EM GERAL
FII HECTARE CRI,INVESTIDOR QUALIFICADO
FUNDO DE INVESTIMENTO IMOBILIÁRIO GV BLUE CHIP,INVESTIDOR PROFISSIONAL
FUNDO DE INVESTIMENTO IMOBILIÁRIO GV BLUE CHIP,INVESTIDOR QUALIFICADO
FUNDO DE INVESTIMENTO IMOBILIARIO TOURMALET II,INVESTIDOR QUALIFICADO
VX XII - FUNDO DE INVESTIMENTO IMOBILIÁRIO,INVESTIDOR QUALIFICADO
HABITAT II - FUNDO DE INVESTIMENTO IMOBILIÁRIO,INVESTIDORES EM GERAL
MAC FUNDO DE INVESTIMENTO IMOBILIARIO,INVESTIDOR QUALIFICADO
FUNDO DE INVESTIMENTO IMOBILIARIO - VBI LOGISTICO,INVESTIDORES EM GERAL
FUNDO DE INVESTIMENTO IMOBILIÁRIO - VBI LOGISTICO,INVESTIDORES EM GERAL
FII VBI LOGISTICO,INVESTIDORES EM GERAL
FUNDO DE INVESTIMENTO IMOBILIÁRIO - VBI LOGÍSTICO,INVESTIDORES EM GERAL
BACURI FUNDO DE INVESTIMENTO IMOBILIÁRIO,INVESTIDOR PROFISSIONAL
RIO BRAVO CRÉDITO IMOBILIÁRIO IV FII,INVESTIDORES EM GERAL
XP PROPERTIES FUNDO DE INVESTIMENTO IMOBILIÁRIO - FII,INVESTIDORES EM GERAL
FUNDO DE INVEST IMOB - OURINVEST FUNDO DE FUNDOS,INVESTIDORES EM GERAL
KINEA CO-INVESTIMENTO FUNDO DE INVESTIMENTO IMOBILIÁRIO,INVESTIDOR QUALIFICADO
METROPOLITANO - FUNDO DE INVESTIMENTO IMOBILIÁRIO - FII,INVESTIDOR PROFISSIONAL
VBI ULIVING FUNDO DE INVESTIMENTO IMOBILIÁRIO,INVESTIDOR QUALIFICADO
FII MULTI RENDA URBANA,INVESTIDORES EM GERAL
GREEN ROCK FUNDO DE INVESTIMENTO IMOBILIÁRIO,INVESTIDOR QUALIFICADO
JPP ALLOCATON MOGNO FUNDO DE INVESTIMENTO IMOBILIÁRIO,INVESTIDORES EM GERAL
FUNDO DE INVESTIMENTO IMOBILIÁRIO - FII VITACON,INVESTIDOR QUALIFICADO
VX XVI - FUNDO DE INVESTIMENTO IMOBILIÁRIO,INVESTIDOR QUALIFICADO
XP SELECTION FUNDO DE FUNDOS DE INVESTIMENTO IMOBILIÁRIO,INVESTIDORES EM GERAL
BFC FUNDO DE INVESTIMENTO IMOBILIÁRIO,INVESTIDOR PROFISSIONAL
RCH FUNDO DE INVESTIMENTO IMOBILIÁRIO,INVESTIDOR QUALIFICADO
FII HECTARE STUDENT HOUSING,INVESTIDORES EM GERAL
HECTARE DESENVOLVIMENTO STUDENT HOUSING - FII,INVESTIDORES EM GERAL
RB CAPITAL DESENVOLVIMENTO RESIDENCIAL IV FII,INVESTIDORES EM GERAL
SÃO JORGE FUNDO DE INVESTIMENTO IMOBILIARIO,INVESTIDOR QUALIFICADO
EUROPA 105 - FUNDO DE INVESTIMENTO IMOBILIÁRIO,INVESTIDOR QUALIFICADO
MULTIOFFICES 2 - FUNDO DE INVESTIMENTO IMOBILIÁRIO,INVESTIDOR QUALIFICADO
KODY FUNDO DE INVESTIMENTO IMOBILIÁRIO,INVESTIDOR QUALIFICADO
PORTO PREMIUM FUNDO DE INVESTIMENTO IMOBILIARIO,INVESTIDOR PROFISSIONAL
FUNDO DE INVESTIMENTO IMOBILIARIO ECOPARQUE,INVESTIDOR PROFISSIONAL
FUNDO DE INVESTIMENTO IMOBILIARIO MIRANTE DAS AGUAS,INVESTIDOR QUALIFICADO
AGRI8 - FUNDO DE INVESTIMENTO IMOBILIÁRIO,INVESTIDOR QUALIFICADO
VINCI INSTRUMENTOS FINANCEIROS FII,INVESTIDORES EM GERAL
APOLLO CORPORATE FUNDO DE INVESTIMENTO IMOBILIÁRIO,INVESTIDOR PROFISSIONAL
TOLLOG FUNDO DE INVESTIMENTO IMOBILIÁRIO - FII,INVESTIDOR QUALIFICADO
COLONIZADOR I FUNDO DE INVESTIMENTO IMOBILIÁRIO - FII,INVESTIDORES EM GERAL
CAIXA RIO BRAVO FUNDO DE FII II,INVESTIDORES EM GERAL
FII RB CAPITAL OFFICE INCOME,INVESTIDORES EM GERAL
SBC FUNDO DE INVESTIMENTO IMOBILIÁRIO,INVESTIDOR PROFISSIONAL
PROLOGIS BRAZIL LOGISTICS VENTURE FII,INVESTIDOR PROFISSIONAL
BRESCO GROWTH FUNDO DE INVESTIMENTO IMOBILIÁRIO,INVESTIDOR PROFISSIONAL
ÁTRIO REIT RECEBÍVEIS IMOBILIÁRIOS - FII,INVESTIDORES EM GERAL
AF INVEST FUNDO DE INVESTIMENTO IMOBILIÁRIO RECEBÍVEIS IMOB,INVESTIDORES EM GERAL
SÃO FRANCISCO 34 FUNDO DE INVESTIMENTO IMOBILIÁRIO,INVESTIDOR PROFISSIONAL
COSMOS FUNDO DE INVESTIMENTO IMOBILIÁRIO,INVESTIDOR PROFISSIONAL
MB BI FUNDO DE INVESTIMENTO IMOBILIÁRIO,INVESTIDOR QUALIFICADO
VAM FUNDO DE INVESTIMENTO IMOBILIÁRIO,INVESTIDOR QUALIFICADO
FUNDO DE INVESTIMENTO IMOBILIARIO - FII UBS (BR) OFFICE,INVESTIDORES EM GERAL
FUNDO DE INVESTIMENTO IMOBILIÁRIO REC RENDA IMOBILIÁRIA,INVESTIDORES EM GERAL
FUNDO DE INVESTIMENTO IMOBILIÁRIO - REC RENDA IMOBILIÁRIA,INVESTIDORES EM GERAL
SNOWBIRD MASTER FUNDO DE INVESTIMENTO IMOBILIARIO,INVESTIDOR PROFISSIONAL
SNOWBIRD PARALELL FUNDO DE INVESTIMENTO IMOBILIARIO,INVESTIDOR QUALIFICADO
DALLAS FUNDO DE INVESTIMENTO IMOBILIÁRIO,INVESTIDOR PROFISSIONAL
EVEN II KINEA FUNDO DE INVESTIMENTO IMOBILIÁRIO,INVESTIDOR QUALIFICADO
MÉRITO FUNDOS E AÇÕES IMOBILIÁRIAS FII,INVESTIDOR QUALIFICADO
MÉRITO FUNDOS E AÇÕES IMOBILIÁRIAS FII,INVESTIDORES EM GERAL
VECTIS JUROS REAL FUNDO DE INVESTIMENTO IMOBILIÁRIO - FII,INVESTIDOR QUALIFICADO
VECTIS JUROS REAL FUNDO DE INVESTIMENTO IMOBILIÁRIO - FII,INVESTIDORES EM GERAL
FII RBR DESENVOLVIMENTO III,INVESTIDOR QUALIFICADO
VIC DESENVOLVIMENTO - VINTAGE 20/21 FII,INVESTIDOR PROFISSIONAL
NEWPORT LOGISTICA FUNDO DE INVESTIMENTO IMOBILIÁRIO,INVESTIDOR PROFISSIONAL
PLURAL RECEBÍVEIS IMOBILIÁRIOS FII,INVESTIDORES EM GERAL
IMMOB II  FII,INVESTIDOR PROFISSIONAL
FUNDO DE INVESTIMENTO IMOBILIÁRIO - M8 EDUCACIONAL I,INVESTIDOR PROFISSIONAL
FUNDO DE INVESTIMENTO IMOBILIARIO - M8 EDUCACIONAL I,INVESTIDOR PROFISSIONAL
M8 FUNDO DE INVESTIMENTO IMOBILIÁRIO MULTIESTRATÉGIA,INVESTIDOR PROFISSIONAL
FII QUASAR AGRO,INVESTIDORES EM GERAL
QUASAR AGRO - FUNDO DE INVESTIMENTO IMOBILIÁRIO,INVESTIDORES EM GERAL
CSHG IMOBILIARIO FOF - FUNDO DE INVESTIMENTO IMO - FII,INVESTIDORES EM GERAL
HSI MALLS FUNDO DE INVESTIMENTO IMOBILIÁRIO,INVESTIDORES EM GERAL
SANTANDER PAPÉIS IMOBILIÁRIOS CDI FII,INVESTIDORES EM GERAL
HSI LOG I FUNDO DE INVESTIMENTO IMOBILIÁRIO,INVESTIDOR QUALIFICADO
HSI LOGÍSTICA FUNDO DE INVESTIMENTO IMOBILIÁRIO,INVESTIDORES EM GERAL
HSI LOG II FUNDO DE INVESTIMENTO IMOBILIÁRIO,INVESTIDOR QUALIFICADO
SANTANDER RENDA DE ALUGUÉIS FII,INVESTIDORES EM GERAL
FII V2 PROPERTIES,INVESTIDOR QUALIFICADO
FUNDO DE INVESTIMENTO IMOBILIÁRIO V2 PROPERTIES,INVESTIDOR QUALIFICADO
FUNDO DE INVESTIMENTO IMOBILIÁRIO - V2 PROPERTIES,INVESTIDORES EM GERAL
FUNDO DE INVESTIMENTO IMOBILIÁRIO BTG PACTUAL SHOPPINGS,INVESTIDOR QUALIFICADO
FII BTG PACTUAL SHOPPINGS,INVESTIDOR QUALIFICADO
FII BTG PACTUAL SHOPPINGS,INVESTIDORES EM GERAL
AVM FII,INVESTIDOR PROFISSIONAL
FUNDO DE INVESTIMENTO IMOBILIARIO - AVM FII,INVESTIDOR PROFISSIONAL
FRAM CAPITAL PENHA FUNDO DE INVESTIMENTO OMOBILIÁRIO,INVESTIDOR QUALIFICADO
FRAM CAPITAL TESSEN FUNDO DE INVESTIMENTO IMOBILIÁRIO,INVESTIDOR QUALIFICADO
FRAM CAPITAL ODARA FUNDO DE INVESTIMENTO IMOBILIÁRIO,INVESTIDOR QUALIFICADO
INTRABANK FUNDO DE INVESTIMENTO IMOBILIÁRIO,INVESTIDORES EM GERAL
FII FOF INTEGRAL BREI,INVESTIDORES EM GERAL
KIEV FUNDO DE INVESTIMENTO IMOBILIARIO - FII,INVESTIDOR QUALIFICADO
YORK - FUNDO DE INVESTIMENTO IMOBILIARIO,INVESTIDOR QUALIFICADO
FARIA LIMA CAPITAL RECEBÍVEIS IMOBILIÁRIOS I - FII,INVESTIDORES EM GERAL
FARIA LIMA CAPITAL RECEBÍVEIS IMOBILIÁRIOS I - FII,INVESTIDOR QUALIFICADO
SÃO MIGUEL DOS MILAGRES FUNDO DE INVESTIMENTO IMOBILIARIO,INVESTIDORES EM GERAL
INTER TITULOS IMOBILIARIOS FUNDO DE INVESTIMENTO IMOBILIARIO,INVESTIDORES EM GERAL
FUNDO DE INVESTIMENTO IMOBILIÁRIO RB CAPITAL I FOF,INVESTIDORES EM GERAL
FII CAPITANIA REIT FOF,INVESTIDORES EM GERAL
CAPITÂNIA REIT FOF - FUNDO DE INVESTIMENTO IMOBILIÁRIO,INVESTIDORES EM GERAL
CAPITÂNIA REIT FOF FII,INVESTIDORES EM GERAL
FUNDO DE INVESTIMENTO IMOBILIÁRIO HOUSI,INVESTIDORES EM GERAL
BLUEMACAW LOGÍSTICA FUNDO INVESTIMENTO IMOBILIÁRIO,INVESTIDORES EM GERAL
FII TOURMALET V - EDIFICIO CIDADE NOVA,INVESTIDOR QUALIFICADO
MORE REAL ESTATE FOF FII,INVESTIDORES EM GERAL
FUNDO DE INVESTIMENTO IMOBILIÁRIO - MOGNO HOTEIS,INVESTIDOR QUALIFICADO
FII MOGNO HOTÉIS,INVESTIDOR PROFISSIONAL
VALORA CRI ÍNDICE DE PREÇO  - FII,INVESTIDORES EM GERAL
VALORA CRI ÍNDICE DE PREÇO FII,INVESTIDORES EM GERAL
FRAM CAPITAL SBCLOG FUNDO DE INVESTIMENTO IMOBILIÁRIO,INVESTIDOR QUALIFICADO
URCA PRIME RENDA FUNDO DE INVESTIMENTO IMOBILIÁRIO - FII,INVESTIDORES EM GERAL
CF2 FUNDO DE INVESTIMENTO IMOBILIARIO,INVESTIDOR PROFISSIONAL
CF2 FUNDO DE INVESTIMENTO IMOBILIARIO,INVESTIDOR QUALIFICADO
FUNDO DE INVESTIMENTO IMOBILIÁRIO JAPURÁ,INVESTIDOR PROFISSIONAL
ARC FUNDO DE INVESTIMENTO IMOBILIÁRIO III - FII,INVESTIDOR PROFISSIONAL
LOGCP INTER FUNDO DE INVESTIMENTO IMOBILIARIO,INVESTIDORES EM GERAL
LOGCP INTER FUNDO DE INVESTIMENTO IMOBILIÁRIO,INVESTIDORES EM GERAL
VBI CONSUMO ESSENCIAL FUNDO DE INVESTIMENTO IMOBILIÁRIO,INVESTIDORES EM GERAL
IMMOB III FUNDO DE INVESTIMENTO IMOBILIARIO - FII,INVESTIDOR PROFISSIONAL
IMMOB IV BRAGANÇA FI IMOBILIARIO,INVESTIDOR PROFISSIONAL
QUATÁ MONETAI FUNDO DE FUNDOS - FII,INVESTIDORES EM GERAL
QUATÁ IMOB FUNDO DE FUNDOS - FUNDO DE INV IMOBILIÁRIO,INVESTIDORES EM GERAL
RBR DESENVOLVIMENTO COMERCIAL I - FII,INVESTIDOR QUALIFICADO
PERFORMA REAL ESTATE - FUNDO DE INVESTIMENTO IMOBILIÁRIO,INVESTIDOR PROFISSIONAL
LUGGO FUNDO DE INVESTIMENTO IMOBILIARIO - FII,INVESTIDORES EM GERAL
LUGGO FUNDO DE INVESTIMENTO IMOBILIÁRIO - FII,INVESTIDORES EM GERAL
ALIANZA FOFII FUNDO DE INVESTIMENTO IMOBILIÁRIO,INVESTIDORES EM GERAL
ALIANZA FOF FUNDO DE INVESTIMENTO IMOBILIÁRIO,INVESTIDORES EM GERAL
CIVITAS - FUNDO DE INVESTIMENTO IMOBILIÁRIO,INVESTIDOR QUALIFICADO
BRIO REAL ESTATE III FUNDO DE INVESTIMENTO IMOBILIÁRIO,INVESTIDORES EM GERAL
BLUEMACAW OFFICE FUND II F,INVESTIDORES EM GERAL
BRIX FUNDO DE INVESTIMENTO IMOBILIÁRIO,INVESTIDOR QUALIFICADO
HSI ATIVOS FINANCEIROS - FUNDO DE INVESTIMENTO IMOBILIÁRIO,INVESTIDORES EM GERAL
ANKARA DISTRESSED FII,INVESTIDOR QUALIFICADO
LOTE M2 FUNDO IMOBILIARIO,INVESTIDORES EM GERAL
HEDGE RECEBÍVEIS IMOBILIÁRIOS FUNDO DE INVESTIMENTO IMOB,INVESTIDORES EM GERAL
VBI REITS FOF - FUNDO DE INVESTIMENTO IMOBILIÁRIO,INVESTIDORES EM GERAL
BARZEL FUNDO DE INVESTIMENTO IMOBILIÁRIO,INVESTIDORES EM GERAL
HEDGE SHOPPING PARQUE DOM PEDRO FII,INVESTIDOR QUALIFICADO
HEDGE SHOPPING PARQUE DOM PEDRO FII,INVESTIDORES EM GERAL
BLUECAP RENDA LOGISTICA FUNDO DE INVESTIMENTO IMOBILIÁRIO,INVESTIDOR QUALIFICADO
BLUECAP RENDA LOGÍSTICA FII,INVESTIDOR QUALIFICADO
FUNDO DE INVESTIMENTO IMOBILIÁRIO - FII GOLDEN LOGISTICA,INVESTIDOR QUALIFICADO
GOLDEN LOGISTICA FII,INVESTIDOR QUALIFICADO
FUNDO DE INVESTIMENTO IMOBILIÁRIO - FII GOLDEN LOGÍSTICA,INVESTIDOR QUALIFICADO
FII VBI PRIME PROPERTIES,INVESTIDORES EM GERAL
FUNDO DE INVESTIMENTO IMOBILIÁRIO - VBI PRIME PROPERTIES,INVESTIDORES EM GERAL
GALAPAGOS FUNDO DE FUNDOS - FII,INVESTIDOR QUALIFICADO
GALAPAGOS FUNDO DE FUNDOS - FII,INVESTIDORES EM GERAL
FII RBR CRÉDITO IMOBILIÁRIO SPECIAL OPPORTUNITIES,INVESTIDOR QUALIFICADO
FII MOGNO CERTIFICADOS DE RECEBÍVEIS IMOB HIGH GRADE,INVESTIDORES EM GERAL
RB CAPITAL LOGÍSTICO FUNDO DE INVESTIMENTO IMOBILIÁRIO - FII,INVESTIDOR PROFISSIONAL
NAVI FUNDO DE FUNDOS DE INVESTIMENTO IMOBILIÁRIO,INVESTIDORES EM GERAL
NAVI IMOBILIÁRIO FUNDO DE FUNDOS -  FII,INVESTIDORES EM GERAL
FUNDO DE INVESTIMENTO IMOBILIÁRIO - BRL PROP II,INVESTIDOR QUALIFICADO E PROFISSIONAL
FUNDO DE INVESTIMENTO IMOBILIÁRIO - BRL PROP II,INVESTIDOR QUALIFICADO
RBR DESENVOLVIMENTO COMERCIAL FEEDER FOF FII,INVESTIDOR PROFISSIONAL
RB CAPITAL RECEBÍVEIS IMOBILIÁRIOS FII,INVESTIDORES EM GERAL
MILETO - FUNDO DE INVESTIMENTO IMOBILIÁRIO,INVESTIDOR PROFISSIONAL
RBR LOG FUNDO DE INVESTIMENTO IMOBILIÁRIO,INVESTIDOR QUALIFICADO
RBR LOG FUNDO DE INVESTIMENTO IMOBILIÁRIO,INVESTIDORES EM GERAL
COLONIZADOR II FUNDO DE INVESTIMENTO IMOBILIÁRIO,INVESTIDOR QUALIFICADO
CAPITAL RS FUNDO DE INVESTIMENTO IMOBILIARIO - FII,INVESTIDOR QUALIFICADO
BOA VISTA FUNDO DE INVESTIMENTO IMOBILARIO FII,INVESTIDOR QUALIFICADO
PÁTRIA LOGÍSTICA FUNDO DE INVESTIMENTO IMOBILIÁRIO,INVESTIDORES EM GERAL
XP EXETER DESENVOLVIMENTO LOGISTICO - FII,INVESTIDOR PROFISSIONAL
AUTONOMY EDIFICIOS CORPORATIVOS FII,INVESTIDOR QUALIFICADO
AUTONOMY EDIFICIOS CORPORATIVOS FII,INVESTIDORES EM GERAL
JACARANDA - FUNDO DE INVESTIMENTO IMOBILIÁRIO,INVESTIDOR QUALIFICADO
GOLGI FUNDO DE INVESTIMENTO IMOBILIÁRIO,INVESTIDOR QUALIFICADO
JIVE ATIVOS IMOBILIÁRIOS III - FII,INVESTIDOR QUALIFICADO
ZION CAPITAL FUNDO DE INVESTIMENTO IMOBILIÁRIO - FII,INVESTIDOR QUALIFICADO
KINEA SECURITIES FUNDO DE INVESTIMENTO IMOBILIÁRIO - FII,INVESTIDORES EM GERAL
DARP JIVE FUNDO DE INVESTIMENTO IMOBILIÁRIO,INVESTIDOR QUALIFICADO
BTSP I FUNDO DE INVESTIMENTO IMOBILIARIO - FII,INVESTIDORES EM GERAL
BTSP I FUNDO DE INVESTIMENTO IMOBILIÁRIO - FII,INVESTIDORES EM GERAL
IFI-E FUNDO DE INVESTIMENTO IMOBILIARIO - FII,INVESTIDORES EM GERAL
BLUEMACAW RENDA+ FOF FUNDO DE INVESTIMENTO IMOBILIÁRIO,INVESTIDORES EM GERAL
TRX REAL ESTATE II FUNDO DE INVESTIMENTO IMOBILIÁRIO - FII,INVESTIDORES EM GERAL
BS APOLO FUNDO DE INVESTIMENTO IMOBILIÁRIO,INVESTIDOR PROFISSIONAL
YUCA FUNDO DE INVESTIMENTO IMOBILIÁRIO,INVESTIDOR PROFISSIONAL
FUNDO DE INVESTIMENTO IMOBILIÁRIO RIZA TERRAX,INVESTIDORES EM GERAL
FUNDO DE INVESTIMENTO IMOBILIÁRIO HBC RENDA URBANA,INVESTIDORES EM GERAL
LWTC FUNDO DE INVESTIMENTO IMOBILIÁRIO,INVESTIDOR PROFISSIONAL
RIO BRAVO RENDA RESIDENCIAL FII,INVESTIDORES EM GERAL
JBFO FOF FUNDO DE INVESTIMENTO IMOBILIÁRIO,INVESTIDORES EM GERAL
FII MOGNO REAL ESTATE IMPACT DEVELOPMENT FUND,INVESTIDOR PROFISSIONAL
RIZA AKIN FUNDO DE INVESTIMENTO IMOBILIÁRIO - FII,INVESTIDORES EM GERAL
FII RBR DESENVOLVIMENTO IV,INVESTIDOR QUALIFICADO
BTG PACTUAL REAL ESTATE PRIME OPPORTUNITIES - FII,INVESTIDOR PROFISSIONAL
VENUS FUNDO DE INVESTIMENTO IMOBILIÁRIO,INVESTIDORES EM GERAL
KILIMA FUNDO DE INVESTIMENTO EM COTAS DE FII SUNO 30,INVESTIDORES EM GERAL
STRUAN FUNDO DE INVESTIMENTO IMOBILIÁRIO - FII,INVESTIDOR PROFISSIONAL
RADOMA 16 FUNDO DE INVESTIMENTO IMOBILIÁRIO - FII,INVESTIDOR PROFISSIONAL
ABEL 33 FUNDO DE INVESTIMENTO IMOBILIÁRIO - FII,INVESTIDOR PROFISSIONAL
ENERGY RESORT FUNDO DE INVESTIMENTO IMOBILIÁRIO - FII,INVESTIDORES EM GERAL
DEVANT RECEBÍVEIS IMOBILIÁRIOS FII,INVESTIDORES EM GERAL
FUNDO DE INVESTIMENTO IMOBILIÁRIO REC LOGÍSTICA,INVESTIDORES EM GERAL
BB FUNDO DE FUNDOS - FUNDO DE INVESTIMENTO IMOBILIÁRIO,INVESTIDORES EM GERAL
XP IDEA!ZARVOS FUNDO DE INVESTIMENTO IMOBILIÁRIO,INVESTIDOR QUALIFICADO E PROFISSIONAL
ESTOQUE RJ FUNDO DE INVESTIMENTO IMOBILIÁRIO,INVESTIDOR PROFISSIONAL
FUNDO DE INVESTIMENTO IMOBILIÁRIO GUARDIAN LOGÍSTICA,INVESTIDORES EM GERAL
FBV KEYDEV FUNDO DE INVESTIMENTO IMOBILIÁRIO,INVESTIDOR PROFISSIONAL
PANORAMA DESENVOLVIMENTO LOGÍSTICO - FII,INVESTIDOR PROFISSIONAL
PANORAMA DESENV LOGÍSTICO FUNDO DE INVESTIMENTO IMOBILIÁRIO,INVESTIDOR PROFISSIONAL
RIO BRAVO CRÉDITO IMOB HIGH YIELD FUNDO DE INV. IMOB. - FII,INVESTIDORES EM GERAL
PETTRA FUNDO DE INVESTIMENTO IMOBILIÁRIO.,INVESTIDOR QUALIFICADO
GALAPAGOS RECEBIVEIS IMOBILIÁRIOS - FII,INVESTIDOR PROFISSIONAL
IMMOB V DESENVOLVIMENTO FII,INVESTIDOR PROFISSIONAL
HGI CRÉDITOS IMOBILIÁRIOS FUNDO DE INVESTIMENTO IMOBILIÁRIO,INVESTIDORES EM GERAL
FUNDO DE INVESTIMENTO IMOBILIÁRIO ROOFTOP I,INVESTIDOR QUALIFICADO
FUNDO DE INVESTIMENTO IMOBILIÁRIO CAIXA IMÓVEIS CORPORATIVOS,INVESTIDORES EM GERAL
F.I.I. HOSPITAL UNIMED CAMPINA GRANDE,INVESTIDOR PROFISSIONAL
TJK RENDA IMOBILIARIA FUNDO DE INVESTIMENTO IMOBILIARIO,INVESTIDOR PROFISSIONAL
CLARITAS LOGÍSTICA I - FI IMOBILIÁRIO,INVESTIDOR QUALIFICADO
MAXI RENDA FI IMOBILIARIO FII,INVESTIDORES EM GERAL
MAXI RENDA FUNDO DE INVESTIMENTO IMOBILIARIO - FII,INVESTIDORES EM GERAL
MAXI RENDA FUNDO DE INVESTIMENTO IMOBILIÁRIO - FII,INVESTIDORES EM GERAL
