Nome_Fundo,Publico_Alvo
FII RBR CRÉDITO PULVERIZADO RESPONSABILIDADE LIMITADA,INVESTIDORES EM GERAL
VERA CRUZ THREE FEEDER FII RESPONSABILIDADE LIMITADA,INVESTIDOR PROFISSIONAL
JPR DS FUNDO DE INVESTIMENTO IMOBILIÁRIO DE RESPONSABILIDAD,INVESTIDORES EM GERAL
EXITUS PLUS FUNDO DE INVESTIMENTO IMOBILIÁRIO,INVESTIDOR PROFISSIONAL
LCP SPECIAL OPPORTUNITIES I FII RESPONSABILIDADE ILIMITADA,INVESTIDORES EM GERAL
BLUE SECURITIES FUNDO DE INVESTIMENTO IMOBILIÁRIO,INVESTIDORES EM GERAL
ÍCONE - FII RESPONSABILIDADE LIMITADA,INVESTIDOR QUALIFICADO
ARC PLAZA IGUATEMI II - FII RESPONSABILIDADE LIMITADA,INVESTIDOR QUALIFICADO
ARC PLAZA IGUATEMI I - FII RESPONSABILIDADE LIMITADA,INVESTIDOR QUALIFICADO
BOQ1 FI NAS CADEIAS PRODUTIVAS AGROINDUSTRIAIS  FIAGRO FII,INVESTIDOR QUALIFICADO
OTTER FINO DE INVESTIMENTO IMOBILIARIO,INVESTIDOR QUALIFICADO
RWM FUNDO DE INVESTIMENTO IMOBILIARIO,INVESTIDOR QUALIFICADO
ESPANHOL FUNDO DE INVESTIMENTO IMOBILIÁRIO,INVESTIDOR QUALIFICADO
SGON FUNDO DE INVESTIMENTO IMOBILIARIO,INVESTIDOR QUALIFICADO
TCG FUNDO DE INVESTIMENTO IMOBILIARIO,INVESTIDOR QUALIFICADO
JHSF CAPITAL BELA VISTA FUNDO DE INVESTIMENTO IMOBILIÁRIO,INVESTIDOR QUALIFICADO
JHSF CAPITAL PONTA NEGRA FUNDO DE INVESTIMENTO IMOBILIÁRIO,INVESTIDOR QUALIFICADO
CROMOSSOMO REAL ESTATE  RESPONSABILIDADE LIMITADA,INVESTIDOR PROFISSIONAL
FII ECOPARQUE BAIRROS INTEGRADOS,INVESTIDOR QUALIFICADO
JAFFA NOV FUNDO DE INVESTIMENTO IMOBILIÁRIO,INVESTIDOR QUALIFICADO
KOMBI AZUL II FUNDO DE INVESTIMENTO IMOBILIÁRIO,INVESTIDOR QUALIFICADO
MAXI RENDA FI IMOBILIARIO FII,INVESTIDORES EM GERAL
FII MAXI RENDA,INVESTIDORES EM GERAL
