Nome_Fundo,Publico_Alvo
FUNDO DE INVESTIMENTO IMOBILIÁRIO VIA PARQUE SHOPPING,INVESTIDORES EM GERAL
FUNDO DE INVESTIMENTO IMOBILIÁRIO PANAMBY,INVESTIDORES EM GERAL
FUNDO INVESTIMENTO IMOBILIÁRIO CENTRO TEXTIL INTERNACIONAL,INVESTIDORES EM GERAL
FUNDOS DE INVESTIMENTO IMOBILIÁRIO HERMES,INVESTIDORES EM GERAL
FUNDO DE INVESTIMENTO IMOBILIÁRIO GRAND PLAZA SHOPPING,INVESTIDORES EM GERAL
OPPORTUNITY FUNDO E INVESTIMENTO IMOBILIÁRIO,INVESTIDOR PROFISSIONAL
OPPORTUNITY FUNDO DE INVESTIMENTO IMOBILIÁRIO,INVESTIDOR PROFISSIONAL
LAGRA FUNDO DE INVESTIMENTO IMOBILIÁRIO,INVESTIDORES EM GERAL
FUNDO DE INVESTIMENTO IMOBILIÁRIO MISTRAL,INVESTIDORES EM GERAL
FUNDO FORTALEZA DE INVESTIMENTO IMOBILIÁRIO,INVESTIDORES EM GERAL
FUNDO DE INVESTIMENTO IMOBILIÁRIO MEMORIAL OFFICE,INVESTIDORES EM GERAL
FUNDO DE INVESTIMENTO IMOBILIÁRIO PÁTEO MOINHOS DE VENTO,INVESTIDOR QUALIFICADO
SCP FUNDO DE INVESTIMENTO IMOBILIÁRIO,INVESTIDORES EM GERAL
FUNDO DE INVESTIMENTO IMOBILIÁRIO GEO GUARARAPES,INVESTIDOR QUALIFICADO E PROFISSIONAL
FUNDO BRASÍLIO MACHADO DE INVESTIMENTO IMOBILIÁRIO,INVESTIDORES EM GERAL
LOGINVEST FUNDO DE INVESTIMENTO IMOBILIÁRIO INDUSTRIAL,INVESTIDORES EM GERAL
FUNDO DE INVESTIMENTO IMOBILIÁRIO PROJETO ÁGUA BRANCA,INVESTIDORES EM GERAL
FUNDO DE INVESTIMENTO IMOBILIÁRIO SHOP. PÁTIO HIGIENÓPOLIS,INVESTIDORES EM GERAL
FUNDO DE INVESTIMENTO IMOBILIARIO RIOBRAVO RENDA CORPORATIVA,INVESTIDORES EM GERAL
FUNDO DE INVESTIMENTO IMOBILIÁRIO RB LOGÍSTICA,INVESTIDORES EM GERAL
FUNDO DE INVESTIMENTO IMOBILIARIO - FII HOSPITAL DA CRIANCA,INVESTIDORES EM GERAL
FUNDO DE INVEST. IMOBILIÁRIO CONTINENTAL SQUARE FARIA LIMA,INVESTIDORES EM GERAL
STARK FUNDO DE INVESTIMENTO IMOBILIÁRIO-FII,INVESTIDOR PROFISSIONAL
FUNDO DE INVESTIMENTO IMOBILIARIO - FII TORRE NORTE,INVESTIDORES EM GERAL
FP. F ANDROMEDA FUNDO DE INVESTIMENTO IMOBILIÁRIO,INVESTIDOR PROFISSIONAL
FUNDO DE INVESTIMENTO IMOBILIÁRIO EUROPAR,INVESTIDORES EM GERAL
FII EDIFICIO ALMIRANTE BARROSO,INVESTIDORES EM GERAL
FII ALMIRANTE BARROSO,INVESTIDORES EM GERAL
FUNDO DE INVESTIMENTO IMOBILIÁRIO EDIFÍCIO OURINVEST,INVESTIDORES EM GERAL
FUNDO DE INVESTIMENTO IMOBILIÁRIO EDIFÍCIO OURINVEST - FII,INVESTIDORES EM GERAL
BB FUNDO DE INVESTIMENTO IMOBILIARIO PROGRESSIVO,INVESTIDORES EM GERAL
FII TORRE ALMIRANTE,INVESTIDORES EM GERAL
FII SHOPPING PARQUE D. PEDRO,INVESTIDORES EM GERAL
FUNDO DE INVESTIMENTO IMOBILIARIO PENINSULA,INVESTIDOR QUALIFICADO
FII ANCAR IC,INVESTIDORES EM GERAL
FII HOSPITAL NOSSA SENHORA DE LOURDES,INVESTIDORES EM GERAL
FII - HOSPITAL NOSSA SENHORA DE LOURDES,INVESTIDORES EM GERAL
HSI RENDA IMOBILIÁRIA FUNDO DE INVESTIMENTO IMOBILIÁRIO,INVESTIDORES EM GERAL
FUNDO DE INVESTIMENTO IMOBILIÁRIO FCM,INVESTIDORES EM GERAL
HEDGE BRASIL SHOPPING FUNDO DE INVESTIMENTO IMOBILIÁRIO,INVESTIDORES EM GERAL
FUNDO DE INVESTIMENTO IMOBILIARIO VEREDA - FII,INVESTIDORES EM GERAL
RB CAPITAL RENDA I FUNDO DE INVESTIMENTO IMOBILIÁRIO - FII,INVESTIDORES EM GERAL
FUNDO DE INVESTIMENTO IMOBILIARIO - FII HOTEL MAXINVEST,INVESTIDORES EM GERAL
FII HOTEL MAXINVEST,INVESTIDORES EM GERAL
BTG PACTUAL CORPORATE OFFICE FUND,INVESTIDORES EM GERAL
FII BTG PACTUAL CORPORATE OFFICE FUND,INVESTIDORES EM GERAL
FUNDO RB CAPITAL RENDA II FUNDO DE INVESTIMENTO IMOBILIÁRIO,INVESTIDOR QUALIFICADO
CSHG REAL ESTATE - FUNDO DE INVESTIMENTO IMOBILIÁRIO - FII,INVESTIDORES EM GERAL
FUNDO DE INVESTIMENTO IMOBILIARIO PATRIMONIAL IV,INVESTIDOR QUALIFICADO
PROPERTY INVEST - FUNDO DE INVESTIMENTO IMOBILIÁRIO,INVESTIDOR PROFISSIONAL
FII PROPERTY INVEST,INVESTIDOR PROFISSIONAL
SHOPPING WEST PLAZA FUNDO DE INVESTIMENTO IMOBILIARIO,INVESTIDORES EM GERAL
FUNDO DE INVESTIMENTO IMOBILIÁRIO SÃO FERNANDO,INVESTIDORES EM GERAL
SEQUÓIA III RENDA IMOBILIÁRIA FII,INVESTIDORES EM GERAL
FII BTG PACTUAL FUNDO DE CRI,INVESTIDORES EM GERAL
FUNDO DE INVESTIMENTO IMOB - BTG PACTUAL CRÉDITO IMOBILIÁRIO,INVESTIDORES EM GERAL
FUNDO DE INVESTIMENTO IMOBILIÁRIO VOTORANTIM SECURITIES,INVESTIDOR QUALIFICADO
CIDADE JARDIM CONTINENTAL TOWER FII,INVESTIDOR QUALIFICADO
FLORIPA SHOPPING FUNDO DE INVESTIMENTO IMOBILIARIO - FII,INVESTIDORES EM GERAL
HEDGE FLORIPA SHOPPING FUNDO DE INVESTIMENTO IMOBILIÁRIO,INVESTIDORES EM GERAL
FUNDO DE INVESTIMENTO IMOBILIARIO FII PRIME PORTFOLIO,INVESTIDOR QUALIFICADO
FUNDO DE INVESTIMENTO IMOBILIÁRIO PHORBIS,INVESTIDORES EM GERAL
MULTIGESTÃO RENDA COMERCIAL FUNDO DE INV. IMOBILIÁRIO,INVESTIDORES EM GERAL
MULTIGESTÃO RENDA COMERCIAL FUNDO DE INV IMOBILIÁRIO,INVESTIDORES EM GERAL
MULTIGESTÃO  FUNDO DE INVESTIMENTO IMOBILIÁRIO - FII,INVESTIDORES EM GERAL
DOVEL FII,INVESTIDOR QUALIFICADO E PROFISSIONAL
FII PARQUE DOM PEDRO SHOPPING CENTER,INVESTIDORES EM GERAL
FUNDO DE INVESTIMENTO IMOBILIÁRIO CAIXA CEDAE,INVESTIDORES EM GERAL
FII BTG PACTUAL FUNDO DE FUNDOS,INVESTIDORES EM GERAL
STARX FUNDO DE INVESTIMENTO IMOBILIÁRIO - FII,INVESTIDORES EM GERAL
CSHG RECEBIVEIS IMOBILIÁRIOS FUNDO DE INV IMOBILIÁRIO - FII,INVESTIDORES EM GERAL
CSHG RECEBÍVEIS IMOBILIÁRIOS FUNDO DE INV IMOBILIÁRIO - FII,INVESTIDORES EM GERAL
FII ANHANGUERA EDUCACIONAL,INVESTIDORES EM GERAL
REAL MINAS FUNDO DE INVESTIMENTO IMOBILIÁRIO - FII,INVESTIDOR QUALIFICADO
CSHG PRIME OFFICES FUNDO DE INVESTIMENTO IMOBILIÁRIO FII,INVESTIDORES EM GERAL
JPP FII,INVESTIDOR PROFISSIONAL
FUNDO DE INVESTIMENTO IMOBILIARIO - FII MAX RETAIL,INVESTIDORES EM GERAL
PRESIDENTE VARGAS FUNDO DE INVESTIMENTO IMOBILIÁRIO,INVESTIDORES EM GERAL
TAG GR IV FUNDO DE INVESTIMENTO IMOBILIÁRIO,INVESTIDOR QUALIFICADO
MB FUNDO DE INVESTIMENTO IMOBILIÁRIO,INVESTIDOR QUALIFICADO
FUNDO DE INVESTIMENTO IMOBILIARIO - FII CAMPUS FARIA LIMA,INVESTIDORES EM GERAL
FATOR VERITA FII,INVESTIDORES EM GERAL
CSHG LOGISTICA - FUNDO DE INVESTIMENTO IMOBILIÁRIO - FII,INVESTIDORES EM GERAL
GENERAL SHOPPING E OUTLETS DO BRASIL FII,INVESTIDORES EM GERAL
INCENTIVO FUNDO DE INVESTIMENTO IMOBILIÁRIO-FII,INVESTIDOR QUALIFICADO E PROFISSIONAL
BTG PACTUAL LOGISTICA FUNDO DE INVESTIMENTO IMOBILIARIO,INVESTIDORES EM GERAL
RB CAPITAL DESENVOLVIMENTO RESIDENCIAL II - FII,INVESTIDOR QUALIFICADO
KINEA RENDA IMOBILIARIA FII,INVESTIDORES EM GERAL
SABIA FUNDO DE INVESTIMENTO IMOBILIÁRIO - FII,INVESTIDOR QUALIFICADO
EXITUS FUNDO DE INVESTIMENTO IMOBILIÁRIO - FII,INVESTIDOR PROFISSIONAL
ATRIUM NACOES UNIDAS FUNDO DE INVESTIMENTO IMOBILIARIO - FII,INVESTIDOR QUALIFICADO
VINCI OFFICES FUNDO DE INVESTIMENTO IMOBILIÁRIO,INVESTIDORES EM GERAL
BB RENDA CORPORATIVA FUNDO DE INVESTIMENTO IMOBILIÁRIO - FII,INVESTIDORES EM GERAL
FUNDO DE INVESTIMENTO IMOBILIÁRIO SC 401,INVESTIDORES EM GERAL
HEDGE ATRIUM SHOPPING SANTO ANDRÉ FUNDO DE INVEST IMOB,INVESTIDORES EM GERAL
OAR FUNDO DE INVESTIMENTO IMOBILIÁRIO,INVESTIDOR QUALIFICADO
OAR - FUNDO DE INVESTIMENTO IMOBILIÁRIO,INVESTIDOR PROFISSIONAL
FUNDO DE INVESTIMENTO IMOBILIÁRIO CAIXA SEQ LOGÍSTICA RENDA,INVESTIDORES EM GERAL
FUNDO DE INVESTIMENTO IMOBILIARIO DA REGIAO DO PORTO,INVESTIDOR QUALIFICADO
FUNDO DE INVESTIMENTO IMOBILIÁRIO THE ONE,INVESTIDORES EM GERAL
FUNDO DE INVESTIMENTO IMOBILIÁRIO CAIXA INCORPORAÇÃO,INVESTIDOR PROFISSIONAL
PARQUE ANHANGUERA FUNDO DE INVESTIMENTO IMOBILIÁRIO,INVESTIDORES EM GERAL
CAIXA FUNDO DE INVESTIMENTO IMOBILIARIO PORTO MARAVILHA,INVESTIDOR QUALIFICADO
OSASCO PROPERTIES FUNDO DE INVESTIMENTO IMOBILIÁRIO,INVESTIDOR QUALIFICADO
SALUS - FUNDO DE INVESTIMENTO IMOBILIÁRIO,INVESTIDOR QUALIFICADO
FII CAIXA DESENVOLVIMENTO IMOBILIARIO,INVESTIDOR QUALIFICADO
FUNDO DE INVESTIMENTO IMOBILIÁRIO - FII ELDORADO,INVESTIDORES EM GERAL
PSG FUNDO DE INVESTIMENTO IMOBILIÁRIO,INVESTIDOR QUALIFICADO
TERRA - FUNDO DE INVESTIMENTO IMOBILIÁRIO,INVESTIDOR QUALIFICADO
JS REAL ESTATE MULTIGESTÃO FUNDO DE INVESTIMENTO IMOBILIÁRIO,INVESTIDORES EM GERAL
FUNDO DE INVESTIMENTO IMOBILIÁRIO MERCANTIL DO BRASIL,INVESTIDORES EM GERAL
FII RIO BRAVO OPORTUNIDADES IMOBILIÁRIAS,INVESTIDORES EM GERAL
FUNDO DE INVESTIMENTO IMOBILIARIO CENESP,INVESTIDORES EM GERAL
AQUILLA FUNDO DE INVESTIMENTO IMOBILIÁRIO,INVESTIDOR QUALIFICADO E PROFISSIONAL
RB CAPITAL PATRIMONIAL V FUNDO DE INVESTIMENTO IMOBILIÁRIO,INVESTIDOR QUALIFICADO
BRAZILIAN GRAVEYARD AND DEATH CARE SERVICES FUNDO DE INV,INVESTIDORES EM GERAL
FUNDO DE INVESTIMENTO IMOBILIÁRIO DO ESTADO DE SÃO PAULO,INVESTIDOR QUALIFICADO
TREVISO - FUNDO DE INVESTIMENTO IMOBILIÁRIO,INVESTIDOR QUALIFICADO
SONDA FUNDO DE INVESTIMENTO IMOBILIÁRIO - FII,INVESTIDOR QUALIFICADO
VECTOR QUELUZ LAJES CORPORATIVAS FUNDO DE INVESTIMENTO IMOBI,INVESTIDOR QUALIFICADO
FUNDO INVESTIMENTO IMOBILIÁRIO RIO BRAVO RENDA EDUCACIONAL,INVESTIDORES EM GERAL
REAG CICA JUNDIAI FUNDO DE INVESTIMENTO IMOBILIARIO  FII,INVESTIDOR QUALIFICADO
CICA JUNDIAÍ - FUNDO DE INVESTIMENTO IMOBILIÁRIO,INVESTIDOR QUALIFICADO
FUDO DE INVESTIMENTO IMOBILIÁRIO OURINVEST LOGÍSTICA,INVESTIDORES EM GERAL
PERSONALE I FUNDO DE INVESTIMENTO IMOBILIÁRIO - FII,INVESTIDOR QUALIFICADO
BRAZIL REALTY FUNDO DE INVESTIMENTO IMOBILIÁRIO,INVESTIDOR QUALIFICADO
BRAZIL REALTY FUNDO DE INVESTIMENTO IMOBILIÁRIO - FII,INVESTIDOR QUALIFICADO
POLO FII RECEBÍVEIS IMOBILIÁRIOS I,INVESTIDOR QUALIFICADO
FUNDO DE INVESTIMENTO IMOBILIÁRIO RAILWAY MALL I - FII,INVESTIDOR QUALIFICADO
ARENA FUNDO DE INVESTIMENTO IMOBILIÁRIO,INVESTIDOR QUALIFICADO
FUNDO DE INVESTIMENTO IMOBILIÁRIO INDUSTRIAL DO BRASIL,INVESTIDORES EM GERAL
ESTRUTURA II - FUNDO DE INEVSTIMENTO IMOBILIÁRIO - FII,INVESTIDOR QUALIFICADO
ESTRUTURA II FUNDO DE INVESTIMENTO IMOBILIÁRIO - FII,INVESTIDOR QUALIFICADO
FII BM BRASCAN LAJES CORPORATIVAS,INVESTIDORES EM GERAL
FII BM BRASCAN LAJES CORPORATIVAS - FII,INVESTIDORES EM GERAL
BB PROGRESSIVO II FUNDO DE INVESTIMENTO IMOBILIÁRIO - FII,INVESTIDORES EM GERAL
FUNDO DE INVESTIMENTO IMOBILIÁRIO RENDA CORPORATIVA ANGICO,INVESTIDOR QUALIFICADO
KINEA II REAL ESTATE EQUITY FUNDO DE INVESTIMENTO IMOB,INVESTIDOR QUALIFICADO
FUNDO DE INVESTIMENTO IMOBILIÁRIO JHSF CATARINA CORPORATE,INVESTIDOR QUALIFICADO
HAZ FUNDO DE INVESTIMENTO IMOBILIÁRIO,INVESTIDOR QUALIFICADO
FUNDO DE INVESTIMENTO IMOBILIÁRIO POLO SHOPPING INDAIATUBA,INVESTIDOR QUALIFICADO
FUNDO DE INVESTIMENTO IMOBILIARIO POLO SHOPPING INDAIATUBA,INVESTIDOR QUALIFICADO
FII POLO SHOPPING INDAIATUBA,INVESTIDORES EM GERAL
FUNDO DE INVESTIMENTO IMOBILIARIO AMETISTA - FII,INVESTIDOR QUALIFICADO
FUNDO DE INVESTIMENTO IMOBILIARIO - FII PATEO BANDEIRANTES,INVESTIDORES EM GERAL
NEWPORT RENDA URBANA FUNDO DE INVESTIMENTO IMOBILIARIO FII,INVESTIDORES EM GERAL
FUNDO DE INVESTIMENTO IMOBILIARIO SHOPPING JARDIM SUL,INVESTIDORES EM GERAL
FUNDO DE INVESTIMENTO IMOBILIÁRIO - FII SHOPPING JARDIM SUL,INVESTIDORES EM GERAL
TRX EDIFICIOS CORPORATIVOS FUNDO DE INVESTIMENTO IMOBILIARIO,INVESTIDORES EM GERAL
V2 EDIFICIOS CORPORATIVOS FUNDO DE INVESTIMENTO IMOBILIARIO,INVESTIDORES EM GERAL
FUNDO DE INVESTIMENTO IMOBILIARIO RIO NEGRO,INVESTIDORES EM GERAL
FUNDO DE INVESTIMENTO IMOBILIARIO PLUS,INVESTIDOR QUALIFICADO
CAIXA FII VLT VEICULO LEVE SOBRE TRILHOS,INVESTIDOR QUALIFICADO
VILA OLIMPIA FUNDO DE INVESTIMENTO IMOBILIARIO - FII,INVESTIDORES EM GERAL
FUNDO DE INVESTIMENTO IMOBILIARIO - FII EDIFICIO GALERIA,INVESTIDORES EM GERAL
SUCCESS - FUNDO DE INVESTIMENTO IMOBILIÁRIO,INVESTIDOR QUALIFICADO
SUCCESS - FUNDO DE INVESTIMENTO IMOBILIÁRIO,INVESTIDOR PROFISSIONAL
BB RENDA DE PAPÉIS IMOBILIÁRIOS FUNDO DE INVESTIMENTO IMOBIL,INVESTIDOR QUALIFICADO
GAZIT MALLS FUNDO DE INVESTIMENTO IMOBILIARIO,INVESTIDORES EM GERAL
GAZIT MALLS FUNDO DE INVESTIMENTO IMOBILIARIO,INVESTIDOR QUALIFICADO
FUNDO DE INVESTIMENTO IMOBILIARIO SHOPPING CIDADE JARDIM,INVESTIDOR QUALIFICADO
FUNDO DE INVESTIMENTOS IMOBILIÁRIOS BR HÓTEIS,INVESTIDOR QUALIFICADO E PROFISSIONAL
INHAÚMA FUNDO DE INVESTIMENTO IMOBILIÁRIO - FII,INVESTIDOR QUALIFICADO
WHITE BEAR FUNDO DE INVESTIMENTO IMOBILIÁRIO - FII,INVESTIDOR QUALIFICADO
FUNDO DE INVESTIMENTO IMOBILIARIO INHAUMA,INVESTIDOR QUALIFICADO
JFDCAM - FUNDO DE INVESTIMENTO IMOBILIÁRIO - FII,INVESTIDOR QUALIFICADO
SP DOWNTOWN FUNDO DE INVESTIMENTO IMOBILIÁRIO - FII,INVESTIDORES EM GERAL
BANRISUL NOVAS FRONTEIRAS FII,INVESTIDORES EM GERAL
FUNDO DE INVESTIMENTO IMOBILIÁRIO RIO BRAVO RENDA VAREJO,INVESTIDORES EM GERAL
RIO BRAVO CREDITO IMOBILIARIO II FI IMOBILIARIO,INVESTIDORES EM GERAL
ORCHID - FUNDO DE INVESTIMENTO IMOBILIÁRIO,INVESTIDOR PROFISSIONAL
FII CEO CYRELA COMMERCIAL PROPERTIES,INVESTIDORES EM GERAL
SÃO DOMINGOS - FUNDO DE INVESTIMENTO IMOBILIÁRIO - FII,INVESTIDOR QUALIFICADO
FUNDO INVESTIMENTO IMOBILIARIO SDI RIO BRAVO RENDA LOGISTICA,INVESTIDORES EM GERAL
KINEA RENDIMENTOS IMOBILIÁRIOS FII,INVESTIDORES EM GERAL
XP CORPORATE MACAÉ FUNDO DE INVESTIMENTO IMOBILIÁRIO,INVESTIDORES EM GERAL
FUNDO DE INVESTIMENTO IMOBILIÁRIO SOFI,INVESTIDOR QUALIFICADO
SINGULARE FUNDO DE INVESTIMENTO IMOBILIÁRIO - FII,INVESTIDOR QUALIFICADO
MÉRITO DESENVOLVIMENTO IMOBILIÁRIO I FII,INVESTIDORES EM GERAL
VISTA REAL ESTATE FUNDO DE INVESTIMENTO IMOBILIÁRIO,INVESTIDOR QUALIFICADO
HEDGE REALTY DEVELOPMENT FUNDO DE INVESTIMENTO IMOBILIÁRIO,INVESTIDOR QUALIFICADO
SOLARA FUNDO DE INVESTIMENTO IMOBILIÁRIO,INVESTIDOR PROFISSIONAL
TRANSINC FUNDO DE INVESTIMENTO IMOBILIARIO FII,INVESTIDORES EM GERAL
FUNDO DE INVESTIMENTO IMOBILIARIO GENERAL SEVERIANO,INVESTIDOR QUALIFICADO E PROFISSIONAL
FUNDO DE INVESTIMENTO IMOBILIARIO - FII NOVO HORIZONTE,INVESTIDORES EM GERAL
FUNDO DE INVESTIMENTO IMOBILIÁRIO HUMAITÁ - FII,INVESTIDOR QUALIFICADO
CAIXA RIO BRAVO FUNDO DE FII,INVESTIDORES EM GERAL
CASTELLO BRANCO OFFICE PARK FUNDO DE INVEST IMOBILIÁRIO FII,INVESTIDORES EM GERAL
POLO CRÉDITO IMOBILIÁRIO - FUNDO DE INVESTIMENTO IMOBILIÁRIO,INVESTIDORES EM GERAL
FUNDO DE INVEST. IMOBILIÁRIO PEDRA NEGRA RENDA IMOBILIÁRIA,INVESTIDORES EM GERAL
SB FI NAS CADEIAS PRODUTIVAS AGROINDUSTRIAIS - IMOBILIARIO,INVESTIDOR QUALIFICADO
LATERES FUNDO DE INVESTIMENTO IMOBILIÁRIO - FII,INVESTIDOR QUALIFICADO
FI IMOBILIARIO JHSF CATARINA CORPORATE BERLIM,INVESTIDOR QUALIFICADO
JPP CAPITAL FUNDO DE INVESTIMENTO IMOBILIÁRIO - FII,INVESTIDORES EM GERAL
FUNDO DE INVESTIMENTO IMOBILIARIO FII GOLDEN,INVESTIDOR QUALIFICADO
FUNDO DE INVESTIMENTO IMOBILIARIO SHOPPING LIGHT,INVESTIDOR QUALIFICADO
FUNDO DE INVESTIMENTO IMOBILIÁRIO - FII SIA CORPORATE,INVESTIDOR QUALIFICADO
FUNDO DE INVESTIMENTO IMOBILIÁRIO - FII SAI CORPORATE,INVESTIDOR QUALIFICADO
FII BRASIL PLURAL ABSOLUTO FUNDOS DE FUNDOS,INVESTIDORES EM GERAL
RIO BRAVO FUNDO DE FUNDOS DE INVESTIMENTO IMOBILIÁRIO,INVESTIDORES EM GERAL
SALUS -II- FUNDO DE INVESTIMENTO IMOBILIÁRIO - FII,INVESTIDOR QUALIFICADO
FUNDO DE INVESTIMENTO IMOBILIARIO - FII TB OFFICE,INVESTIDORES EM GERAL
REAG MULTI ATIVOS IMOBILIÁRIOS - FII,INVESTIDORES EM GERAL
VINCI SHOPPING CENTERS FUNDO DE INVESTIMENTO IMOBILIÁRIO-FII,INVESTIDORES EM GERAL
MAIS SHOPPING FUNDO DE INVESTIMENTO IMOBILIARIO,INVESTIDOR QUALIFICADO
GENERAL SHOPPING ATIVO E RENDA FUNDO DE INVEST IMOB,INVESTIDORES EM GERAL
PESCARA FUNDO DE INVESTIMENTO IMOBILIÁRIO,INVESTIDOR QUALIFICADO
SAFIRA FUNDO DE INVESTIMENTO IMOBILIÁRIO,INVESTIDOR QUALIFICADO
VANQUISH FUNDO DE INVESTIMENTO IMOBILIÁRO - FII,INVESTIDOR QUALIFICADO
NF CAPITAL II FUNDO DE INVESTIMENTO IMOBILIÁRIO,INVESTIDOR PROFISSIONAL
VIDA NOVA FUNDO DE INVESTIMENTO IMOBILIÁRIO - FII,INVESTIDORES EM GERAL
FII VOTORANTIM SECURITIES MASTER,INVESTIDOR QUALIFICADO
FII NCH EQI HIGH YIELD RI,INVESTIDORES EM GERAL
FII NCH BRASIL RECEBÍVEIS IMOBILIÁRIOS,INVESTIDORES EM GERAL
ETR PROPERTIES FUNDO DE INVESTIMENTO,INVESTIDOR QUALIFICADO
ETR PROPERTIES FUNDO DE INVESTIMENTO IMOBILIÁRIO - FII,INVESTIDOR QUALIFICADO
YAGO FUNDO DE INVESTIMENTO IMOBILIÁRIO,INVESTIDOR QUALIFICADO
BIRD FUNDO DE INVESTIMENTO IMOBILIÁRIO - FII,INVESTIDOR PROFISSIONAL
BIRD FII - FII,INVESTIDORES EM GERAL
HEDGE TOP FOFII 3 FUNDO DE INVESTIMENTO IMOBILIÁRIO,INVESTIDORES EM GERAL
XP HOTÉIS - FUNDO DE INVESTIMENTO IMOBILIÁRIO - FII,INVESTIDOR QUALIFICADO
SPA FUNDO DE INVESTIMENTO IMOBILIÁRIO,INVESTIDORES EM GERAL
BTG PACTUAL PRIME OFFICES I - FII,INVESTIDOR QUALIFICADO
FII BTG PACTUAL PRIME OFFICES I,INVESTIDOR QUALIFICADO
FII BTG PACTUAL PRIME OFFICES I - FII,INVESTIDOR QUALIFICADO
RB CAPITAL PETROS FII,INVESTIDOR QUALIFICADO
PETROS FUNDO DE INVESTIMENTO IMOBILIARIO FII,INVESTIDOR QUALIFICADO
FUNDO DE INVESTIMENTO IMOBILIÁRIO INFRA REAL ESTATE - FII,INVESTIDOR QUALIFICADO
FUNDO DE INVESTIMENTO IMOBILIÁRIO POLO ESTOQUE II - FII,INVESTIDOR QUALIFICADO
FUNDO DE INVESTIMENTO IMOBILIÁRIO POLO ESTOQUE II FII,INVESTIDOR QUALIFICADO
CAM VERA CRUZ FUNDO DE INVESTIMENTO IMOBILIÁRIO,INVESTIDOR QUALIFICADO
FII EXCLUSIVO INFRA PATRIMONIAL II,INVESTIDOR PROFISSIONAL
TARANTO FUNDO DE INVESTIMENTO IMOBILIÁRIO,INVESTIDOR QUALIFICADO
TARANTO FUNDO DE INVESTIMENTO IMOBILIÁRIO,INVESTIDOR PROFISSIONAL
CIDADE - FUNDO DE INVESTIMENTO IMOBILIÁRIO - FII,INVESTIDOR QUALIFICADO
BRL EDIFÍCIOS COMERCIAIS FUNDO DE INVESTIMENTO IMOBILIÁRIO,INVESTIDOR QUALIFICADO
CHALLENGER FUNDO DE INVESTIMENTO IMOBILIÁRIO - FII,INVESTIDOR QUALIFICADO
CAPITANIA SECURITIES II - FII,INVESTIDORES EM GERAL
CAPITANIA SECURITIES II FII,INVESTIDORES EM GERAL
BRL LAJES CORPORATIVA FUNDO DE INVESTIMENTO IMOBILIÁRIO,INVESTIDOR PROFISSIONAL
OURO VERDE DESENVOLVIMENTO IMOBILIÁRIO I FII,INVESTIDORES EM GERAL
SAPUCAÍ RIO FUNDO DE INVESTIMENTO IMOBILIÁRIO - FII,INVESTIDOR QUALIFICADO
AB CAPITAL FUNDO DE INVESTIMENTO IMOBILIÁRIO,INVESTIDOR PROFISSIONAL
FUNDO DE INVESTIMENTO IMOBILIÁRIO FL 3.500 I - FII,INVESTIDOR QUALIFICADO
LA DEFÉNSE FUNDO DE INVESTIMENTO IMOBILIÁRIO - FII,INVESTIDORES EM GERAL
LA DEFENSE FUNDO DE INVESTIMENTO IMOBILIÁRIO - FII,INVESTIDORES EM GERAL
RB CAPITAL DESENVOLVIMENTO RESIDENCIAL III - FII,INVESTIDOR QUALIFICADO
VGS FUNDO DE INVESTIMENTO IMOBILIÁRIO - FII,INVESTIDOR QUALIFICADO
2509 FUNDO DE INVESTIMENTO IMOBILIARIO - FII,INVESTIDOR QUALIFICADO
CTBH FUNDO DE INVESTIMENTO IMOBILIÁRIO - FII,INVESTIDOR QUALIFICADO
FUNDO DE INVESTIMENTO IMOBILIARIO MORUMBI TOWN I,INVESTIDOR QUALIFICADO
LOFT I FUNDO DE INVESTIMENTO IMOBILIÁRIO,INVESTIDOR QUALIFICADO
FUNDO DE INVESTIMENTO IMOBILIÁRIO MINT EDUCACIONAL,INVESTIDOR PROFISSIONAL
FUNDO DE INVESTIMENTO IMOBILIARIO MINT EDUCACIONAL,INVESTIDORES EM GERAL
PLT FUNDO IMOBILIÁRIO - FII,INVESTIDOR PROFISSIONAL
17007 FUNDO DE INVESTIMENTO IMOBILIÁRIO,INVESTIDOR PROFISSIONAL
AB CAPITAL II FUNDO DE INVESTIMENTO IMOBILIÁRIO,INVESTIDOR PROFISSIONAL
FUNDO DE INVESTIMENTO IMOBILIARIO 4KIDS,INVESTIDOR QUALIFICADO
IBC FUNDO DE INVESTIMENTOS IMOBILIÁRIOS - FII,INVESTIDOR PROFISSIONAL
CASPER FUNDO DE INVESTIMENTO IMOBILIÁRIO - FII,INVESTIDOR PROFISSIONAL
CASPER FUNDO DE INVESTIMENTO IMOBILIÁRIO - FII,INVESTIDOR QUALIFICADO
PLATINUM FUNDO DE INVESTIMENTO IMOBILIÁRIO,INVESTIDOR QUALIFICADO
CEDRO - FUNDO DE INVESTIMENTO IMOBILIÁRIO - FII,INVESTIDOR PROFISSIONAL
FUNDO DE INVESTIMENTO IMOBILIARIO TC BTOWERS,INVESTIDOR QUALIFICADO
BTOWERS FUNDO DE INVESTIMENTO IMOBILIÁRIO,INVESTIDOR QUALIFICADO
RESIDENCIAIS ONE FUNDO DE INVESTIMENTO IMOBILIARIO,INVESTIDOR QUALIFICADO
BRADESCO CARTEIRA IMOBILIÁRIA ATIVA FII,INVESTIDORES EM GERAL
FUNDO DE INVESTIMENTO IMOBILIÁRIO HIERON BERLIM,INVESTIDOR QUALIFICADO
FII BRISA RENDA IMOBILIARIA,INVESTIDOR QUALIFICADO
BB RECEBIVEIS IMOBILIARIOS FUNDO DE INVESTIMENTO IMOB FII,INVESTIDORES EM GERAL
LA SHOPPING II CENTERS FUNDO DE INVESTIEMNTO IMOBILIARIO,INVESTIDOR QUALIFICADO
BRESCO LOGÍSTICA FUNDO DE INVESTIMENTO IMOBILIÁRIO,INVESTIDORES EM GERAL
FUNDO DE INVESTIMENTO IMOBILIARIO - FII MEILI,INVESTIDOR QUALIFICADO
FGRP FUNDO DE INVESTIMENTO IMOBILIÁRIO,INVESTIDORES EM GERAL
BPGB-001 FUNDO DE INVESTIMENTO IMOBILIÁRIO,INVESTIDOR QUALIFICADO
BPG LOGÍSTICA I FUNDO DE INVESTIMENTO IMOBILIÁRIO,INVESTIDOR QUALIFICADO
TA FUNDO DE INVESTIMENTO IMOBILIARIO,INVESTIDOR PROFISSIONAL
EBT FUNDO DE INVESTIMENTO IMOBILIÁRIO,INVESTIDOR QUALIFICADO
SKM FUNDO DE INVESTIMENTO IMOBILIÁRIO,INVESTIDOR QUALIFICADO
FUNDO DE INVESTIMENTO IMOBILIÁRIO BRASIL VAREJO FII,INVESTIDORES EM GERAL
HAMAL - FUNDO DE INVESTIMENTO IMOBILIÁRIO - FII,INVESTIDOR QUALIFICADO
LA SHOPPING CENTERS  FUNDO DE INVESTIMENTO IMOBILIARIO,INVESTIDOR QUALIFICADO
FUNDO DE INVESTIMENTO IMOBILIARIO RBR PROPERTIES,INVESTIDORES EM GERAL
FUNDO DE INVESTIMENTO IMOBILIÁRIO VOTORANTIM PATRIMONIAL V,INVESTIDOR QUALIFICADO
SHOPPING INTERNACIONAL GUARULHOS - FII,INVESTIDOR QUALIFICADO
PARKING PARTNERS FUNDO DE INVESTIMENTO IMOBILIÁRIO - FII,INVESTIDOR PROFISSIONAL
VRE DESENVOLVIMENTO III FUNDO DE INVESTIMENTO IMOBILIÁRIO,INVESTIDOR QUALIFICADO
CAM THRONE FUNDO DE INVESTIMENTO IMOBILIÁRIO,INVESTIDOR QUALIFICADO
IPS PB FUNDO DE INVESTIMENTO IMOBILIÁRIO,INVESTIDOR QUALIFICADO
NOVA I - FUNDO DE INVESTIMENTO IMOBILIARIO - FII,INVESTIDOR QUALIFICADO
BRAZIL PROPERTIES INVEST FUNDO DE INVESTIMENTO IMOBILIÁRIO,INVESTIDOR QUALIFICADO
TC ALMAVI FUNDO DE INVESTIMENTO IMOBILIARIO - FII,INVESTIDOR PROFISSIONAL
SOLARIUM FII - FUNDO DE INVESTIMENTO IMOBILIARIO,INVESTIDOR QUALIFICADO
ALIANZA REAL ESTATE II FII,INVESTIDOR PROFISSIONAL
FUNDO DE INVESTIMENTO IMOBILIÁRIO CAIXA CONVIDA SUAPE,INVESTIDOR QUALIFICADO
BANESTES RECEBIVEIS IMOBILIARIOS FII,INVESTIDORES EM GERAL
G5 JOMAFIL - FUNDO DE INVESTIMENTO IMOBILIARIO - FII,INVESTIDOR QUALIFICADO E PROFISSIONAL
MULTI SHOPPINGS FUNDO DE INVESTIMENTO IMOBILIARIO FII,INVESTIDORES EM GERAL
OPORTUNIDADE I - FUNDO DE INVESTIMENTO IMOBILIÁRIO,INVESTIDOR QUALIFICADO
OPORTUNIDADE I FUNDO DE INVESTIMENTO IMOBILIÁRIO,INVESTIDOR PROFISSIONAL
IZAR - FUNDO DE INVESTIMENTO IMOBILIÁRIO - FII,INVESTIDOR PROFISSIONAL
IZAR FUNDO DE INVESTIMENTO IMOBILIÁRIO - FII,INVESTIDOR PROFISSIONAL
ALIANZA MULTIOFFICES - FUNDO DE INVESTIMENTO IMOBILIÁRIO,INVESTIDOR QUALIFICADO
MULTI PROPERTIES FII,INVESTIDOR QUALIFICADO
FUNDO DE INVESTIMENTO IMOBILIÁRIO VOTORANTIM BII BTS-FII,INVESTIDOR QUALIFICADO
FUNDO DE INVESTIMENTO IMOBILIÁRIO CONTAGEM BTS - FII,INVESTIDOR QUALIFICADO
BB RENDA DE PAPÉIS IMOBILIÁRIOS II,INVESTIDOR QUALIFICADO
FUNDO DE INVESTIMENTO IMOBILIÁRIO LECREC,INVESTIDOR QUALIFICADO
NIHAL - FUNDO DE INVESTIMENTO IMOBILIÁRIO - FII,INVESTIDOR PROFISSIONAL
BM II FUNDO DE INVESTIMENTO IMOBILIÁRIO,INVESTIDOR PROFISSIONAL
TRIPLE A FUNDO DE INVESTIMENTO IMOBILIÁRIO,INVESTIDOR PROFISSIONAL
FUNDO DE INVESTIMENTO IMOBILIÁRIO JK E - FII,INVESTIDOR PROFISSIONAL
FUNDO DE INVESTIMENTO IMOBILIARIO JK D - FII,INVESTIDOR PROFISSIONAL
FUNDO DE INVESTIMENTO IMOBILIARIO MV9 - FII,INVESTIDOR QUALIFICADO
FUNDO DE INVESTIMENTO IMOBILIARIO SF - FII,INVESTIDOR PROFISSIONAL
FUNDO DE INVESTIMENTO IMOBILIÁRIO TM - FII,INVESTIDORES EM GERAL
FUNDO DE INVESTIMENTO IMOBILIARIO CJ - FII,INVESTIDOR QUALIFICADO
MAUA CAPITAL RECEBIVEIS IMOBILIARIOS  FII,INVESTIDORES EM GERAL
FII MAUA CAPITAL RECEBIVEIS IMOBILIARIOS - FII,INVESTIDORES EM GERAL
FUNDO DE INVESTIMENTO IMOBILIÁRIO GREEN TOWERS,INVESTIDORES EM GERAL
FUNDO DE INVESTIMENTO IMOBILIÁRIO VOTORANTIM PATRIMONIAL XII,INVESTIDOR PROFISSIONAL
FUNDO DE INVESTIMENTO IMOBILIÁRIO VOTORANTIM SHOPPING,INVESTIDORES EM GERAL
TOP CENTER FUNDO DE INVESTIMENTO IMOBILIARIO,INVESTIDOR QUALIFICADO
NORTHWEST INVESTIMENTOS IMOBILIÁRIOS EM SAÚDE FUND I - FII,INVESTIDORES EM GERAL
NORTHWEST INVESTIMENTOS IMOBILIÁRIOS EM SAÚDE FUND I - FII,INVESTIDOR QUALIFICADO E PROFISSIONAL
NORTHWEST INVESTIMENTOS IMOBILIÁRIOS EM SAÚDE FUND I - FII,INVESTIDOR PROFISSIONAL
JT PREV FUNDO DE INVESTIMENTO IMOBILIÁRIO D. HAB,INVESTIDORES EM GERAL
BRIO REAL ESTATE II,INVESTIDORES EM GERAL
BRIO REAL ESTATE II - FUNDO DE INVESTIMENTO IMOBILIÁRIO,INVESTIDORES EM GERAL
PRIME 16 FUNDO DE INVESTIMENTO IMOBILIÁRIO,INVESTIDOR PROFISSIONAL
EVEN PERMUTA KINEA FII FUNDO DE INVESTIMENTO IMOBILIÁRIO,INVESTIDORES EM GERAL
PRAIA DO CASTELO FUNDO DE INVESTIMENTO IMOBILIÁRIO,INVESTIDOR PROFISSIONAL
FUNDO DE INVESTIMENTO IMOBILIÁRIO KEYCASH,INVESTIDORES EM GERAL
NF CAPITAL FUNDO DE INVESTIMENTO IMOBILIÁRIO,INVESTIDOR PROFISSIONAL
LOFT II MAISON SÃO PAULO FUNDO DE INVESTIMENTO IMOBILIÁRIO,INVESTIDOR QUALIFICADO
FII - FUNDO DE INVESTIMENTO IMOBILIÁRIO NESTPAR,INVESTIDOR QUALIFICADO
VINCI LOGÍSTICA FII,INVESTIDORES EM GERAL
XPCE RE FUNDO DE INVESTIMENTO IMOBILIÁRIO,INVESTIDOR QUALIFICADO
KINEA INDICES DE PREÇOS FII,INVESTIDOR QUALIFICADO
IRON CAPITAL REAL ESTATE I-FUNDO DE INVESTIMENTO IMOBILIÁRIO,INVESTIDOR QUALIFICADO
FUNDO DE INVESTIMENTO IMOBILIÁRIO TG ATIVO REAL,INVESTIDORES EM GERAL
OURINVEST JPP FUNDO DE INVESTIMENTO IMOBILIÁRIO - FII,INVESTIDORES EM GERAL
GOLDEN WEST VX FUNDO DE INVESTIMENTO IMOBILIARIO,INVESTIDOR QUALIFICADO
BRAZIL REAL ESTATE VICTORY FUND I - FII,INVESTIDORES EM GERAL
FUNDO DE INVESTIMENTO IMOBILIARIO  FII RBR DESENVOLVIMENTO,INVESTIDOR QUALIFICADO
FUNDO DE INVESTIMENTO IMOBILIARIO RBR DESENVOLVIMENTO,INVESTIDOR QUALIFICADO
FUNDO DE INVESTIMENTO IMOBILIÁRIO ANTILHAS,INVESTIDOR PROFISSIONAL
MALLS BRASIL PLURAL FUNDO DE INVESTIMENTO IMOBILIÁRIO,INVESTIDORES EM GERAL
XP LOG FUNDO DE INVESTIMENTO IMOBILIÁRIO,INVESTIDORES EM GERAL
XPCE RE FII 2 - FUNDO DE INVESTIMENTO IMOBILIÁRIO,INVESTIDOR PROFISSIONAL
BRL VI FUNDO DE INVESTIMENTO IMOBILIÁRIO,INVESTIDOR QUALIFICADO
GGR COVEPI RENDA FUNDO DE INVESTIMENTO IMOBILIÁRIO,INVESTIDORES EM GERAL
DIAMANTE FUNDO DE INVESTIMENTO IMOBILIÁRIO,INVESTIDORES EM GERAL
JIVE ATIVOS IMOBILIÁRIOS II - FII,INVESTIDOR QUALIFICADO
TELLUS PROPERTIES FUNDO DE INVESTIMENTO IMOBILIÁRIO,INVESTIDORES EM GERAL
PANORAMA PROPERTIES FUNDO DE INVESTIMENTO IMOBILIÁRIO,INVESTIDOR QUALIFICADO
FUNDO DE INVESTIMENTO IMOBILIÁRIO BRASIL LAND,INVESTIDOR PROFISSIONAL
FUNDO DE INVESTIMENTO IMOBILIÁRIO FUTURO,INVESTIDOR PROFISSIONAL
TREECORP REAL ESTATE FUNDO DE INVESTIMENTO IMOBILIÁRIO - I,INVESTIDORES EM GERAL
OLAVSEN FUNDO DE INVESTIMENTO IMOBILIÁRIO,INVESTIDOR QUALIFICADO
FUNDO DE INVESTIMENTO IMOBILIÁRIO VOTORANTIM LOGÍSTICA,INVESTIDORES EM GERAL
