Nome_Fundo,Publico_Alvo
FUNDO DE INVEST. IMOB. HOSPITAL INVESTCOOP NACIONAL,INVESTIDORES EM GERAL
FUNDO DE INVESTIMENTO IMOBILIARIO ROOFTOP II,INVESTIDOR QUALIFICADO
OURINVEST INNOVATION FIAGRO IMOBILIARIO,INVESTIDORES EM GERAL
BS2 ALLINVESTMENTS FUNDO DE INVESTIMENTO IMOBILIÁRIO,INVESTIDOR QUALIFICADO
TISHMAN SPEYER GESTÃO DE ATIVOS IMOBILIÁRIOS FII,INVESTIDOR QUALIFICADO
TISHMAN SPEYER GESTÃO DE ATIVOS IMOBILIÁRIOS,INVESTIDOR QUALIFICADO
TISHMAN SPEYER FII,INVESTIDOR QUALIFICADO
COXIM FUNDO DE INVESTIMENTO  IMOBILIÁRIO,INVESTIDOR QUALIFICADO
COXIM FUNDO DE INVESTIMENTO IMOBILIÁRIO,INVESTIDOR QUALIFICADO
ECOAGRO I,INVESTIDORES EM GERAL
FRONTEIRA MULTI FUNDO DE INVESTIMENTO IMOBILIÁRIO,INVESTIDORES EM GERAL
MMVE OPORTUNIDADES IMOBILIÁRIAS FII,INVESTIDORES EM GERAL
MIRANTE REALTY RECEBIVEIS IMOBILIARIOS,INVESTIDORES EM GERAL
WHG REAL ESTATE FII,INVESTIDOR QUALIFICADO E PROFISSIONAL
FII GUARDIAN MULTIESTRATÉGIA IMOBILIÁRIA I,INVESTIDORES EM GERAL
XPCA FIAGRO IMOB,INVESTIDORES EM GERAL
PLURAL BRB CRÉDITO AGRO - FIAGRO - IMOBILIÁRIO,INVESTIDORES EM GERAL
MOGNO RENDA URBANA FUNDO DE INVESTIMENTO IMOBILIARIO,INVESTIDORES EM GERAL
CF3 FUNDO DE INVESTIMENTO IMOBILIÁRIO,INVESTIDOR QUALIFICADO
CONTE ROSSO FUNDO DE INVESTIMENTO IMOBILIÁRIO,INVESTIDOR QUALIFICADO
RIO NEGRO FUNDO DE INVESTIMENTO IMOBILIÁRIO,INVESTIDOR QUALIFICADO
TARUMÃ FUNDO DE INVESTIMENTO IMOBILIÁRIO,INVESTIDOR QUALIFICADO
SATURNO FUNDO DE INVESTIMENTO IMOBILIARIO,INVESTIDOR QUALIFICADO
RDP LOG FUNDO DE INVESTIMENTO IMOBILIÁRIO,INVESTIDORES EM GERAL
CLD GUARULHOS - FUNDO DE INVESTIMENTO IMOBILIÁRIO - FII,INVESTIDORES EM GERAL
KINEA CRÉDITO AGRO FIAGRO-IMOBILIÁRIO,INVESTIDORES EM GERAL
LOS ANGELES 01 FUNDO DE INVESTIMENTO IMOBILIÁRIO,INVESTIDOR PROFISSIONAL
LUCERNA FUNDO DE INVESTIMENTO IMOBILIÁRIOS,INVESTIDOR PROFISSIONAL
HIGH FUNDO DE INVESTIMENTO IMOBILIÁRIO,INVESTIDOR PROFISSIONAL
HIGH FUNDO DE INVESTIMENTO IMOBILIÁRIO,INVESTIDOR QUALIFICADO
FLORIANO FUNDO DE INVESTIMENTO IMOBILIÁRIO,INVESTIDOR PROFISSIONAL
BARZEL RETAIL FUNDO DE INVESTIMENTO IMOBILIÁRIO,INVESTIDORES EM GERAL
BARZEL RETAIL FII  RESPONSABILIDADE LIMITADA,INVESTIDORES EM GERAL
BRASIS FUNDO DE INVESTIMENTO IMOBILIÁRIO,INVESTIDOR QUALIFICADO
EVORIS FUNDO DE INVESTIMENTO IMOBILIÁRIO,INVESTIDOR PROFISSIONAL
ANGRA FUNDO DE INVESTIMENTO IMOBILIÁRIO,INVESTIDOR PROFISSIONAL
VBI RENDA PREFERENCIAL FII,INVESTIDOR PROFISSIONAL
VINCI OPORTUNIDADE RESIDENCIAL FII R LTDA,INVESTIDOR PROFISSIONAL
BARZEL BLP FUNDO DE INVESTIMENTO IMOBILIÁRIO,INVESTIDORES EM GERAL
BARZEL BLP FII RESPONSABILIDADE LIMITADA,INVESTIDORES EM GERAL
INSTANT RENDA URBANA FUNDO DE INVESTIMENTO IMOBILIÁRIO,INVESTIDOR QUALIFICADO
FUNDO DE INVESTIMENTO IMOBILIÁRIO CAIXA CARTEIRA IMOBILIÁRIA,INVESTIDORES EM GERAL
JS ATIVOS FINANCEIROS FUNDO DE INVESTIMENTO IMOBILIÁRIO,INVESTIDORES EM GERAL
TELLUS DESENVOLVIMENTO RESIDENCIAL FII,INVESTIDOR PROFISSIONAL
OPPORTUNITY BALASSIANO FUNDO DE INVESTIMENTO IMOBILIÁRIO,INVESTIDOR QUALIFICADO
KILIMA VOLKANO REC IMOBILIARIOS FII,INVESTIDOR PROFISSIONAL
FUNDO DE INVESTIMENTO NAS CADEIAS PRODUTIVAS AGROINDUSTRIAIS,INVESTIDORES EM GERAL
PORT2 FUNDO DE INVESTIMENTO IMOBILIARIO,INVESTIDOR PROFISSIONAL
NAVI RESIDENCIAL FUNDO DE INVESTIMENTO IMOBILIÁRIO,INVESTIDORES EM GERAL
XP EXETER II DESENVOLVIMENTO LOGISTICO FII,INVESTIDOR PROFISSIONAL
ITAÚ ASSET RURAL FIAGRO - IMOBILIÁRIO,INVESTIDORES EM GERAL
KINEA CREDITAS FUNDO DE INVESTIMENTO IMOBILIÁRIO - FII,INVESTIDORES EM GERAL
VECTIS DATAGRO CRÉD AGRONEGÓCIO FI NAS CADEIAS PROD AGRO IMO,INVESTIDORES EM GERAL
RBR PREMIUM RECEBÍVEIS IMOB FUNDO INVESTIMENTO IMOBILIÁRIO,INVESTIDORES EM GERAL
BRAY REAL ESTATE FII,INVESTIDOR PROFISSIONAL
BRAY REAL ESTATE FUNDO DE INVESTIMENTO IMOBILIARIO,INVESTIDOR PROFISSIONAL
ARAGUAIA FII RESPONSABILIDADE LIMITADA,INVESTIDOR PROFISSIONAL
ARAGUAIA FII RESP LIMT,INVESTIDOR PROFISSIONAL
NCH RECEBIVEIS DO AGRONEGOCIO FIAGRO IMOBILIARIO,INVESTIDORES EM GERAL
FUNDO DE INSVESTIMENTO IMOBILIARIO PRIME OFFICES III,INVESTIDOR QUALIFICADO
FUNDO DE INVESTIMENTO IMOBILIÁRIO - BRICK 80,INVESTIDOR PROFISSIONAL
FUNDO DE INVESTIMENTO IMOBILIARIO  BRICK 80,INVESTIDOR PROFISSIONAL
CAPITANIA AGRO STRATEGIES - FIAGRO-IMOBILIARIO,INVESTIDORES EM GERAL
SPECIALE REAL ESTATE DEVELOPMENT FII,INVESTIDOR PROFISSIONAL
BB FUNDO DE INVESTIMENTO DE CRÉDITO FIAGRO-IMOBILIÁRIO,INVESTIDORES EM GERAL
LESTE FI NAS CAD PROD AGROINDUSTRIAIS - FIAGRO - IMOBILIÁRIO,INVESTIDOR PROFISSIONAL
PGP FUNDO DE INVESTIMENTO IMOBILIÁRIO - FII,INVESTIDOR QUALIFICADO
FUNDO DE INVESTIMENTO IMOBILIÁRIO BIG BOX,INVESTIDOR PROFISSIONAL
FUNDO DE INVESTIMENTO IMOBILIARIO BIG BOX,INVESTIDORES EM GERAL
WITEX FUNDO DE INVESTIMENTO IMOBILIÁRIO,INVESTIDOR PROFISSIONAL
INTER AMERRA - FIAGRO - IMOBILIÁRIO,INVESTIDORES EM GERAL
KINEA PREMIUM PROPERTIES FUNDO DE INVESTIMENTO IMOBILIÁRIO,INVESTIDORES EM GERAL
ITAÚ TEMPUS FUNDO DE INVESTIMENTO IMOBILIÁRIO,INVESTIDORES EM GERAL
KINEA HEDGE FUND FUNDO DE INVESTIMENTO IMOBILIÁRIO,INVESTIDORES EM GERAL
KINEA UNIQUE HY CDI FUNDO DE INVESTIMENTO IMOBILIÁRIO,INVESTIDORES EM GERAL
FII HIRE RESIDENCIAL I - FUNDO DE INVESTIMENTO IMOBILIÁRIO,INVESTIDORES EM GERAL
BARZEL SP FUNDO DE INVESTIMENTO IMOBILIÁRIO,INVESTIDORES EM GERAL
BARZEL SP FII RESPONSABILIDADE LIMITADA,INVESTIDORES EM GERAL
JACARANDÁ 03 FUNDO DE INVESTIMENTO IMOBILIÁRIO - FII,INVESTIDOR QUALIFICADO
BRIO REAL ESTATE IV - FUNDO DE INVESTIMENTO IMOBILIÁRIO,INVESTIDOR PROFISSIONAL
JGP CRÉDITO - FIAGRO - IMOBILIÁRIO,INVESTIDORES EM GERAL
DEVANT FUNDO DE INVESTIMENTO  - FIAGRO,INVESTIDOR PROFISSIONAL
DEVANT FIAGRO-IMOBILIÁRIO,INVESTIDOR PROFISSIONAL
MANATÍ CAPITAL HEDGE FUND DUNDO DE INVESTIMENTO IMOBILIÁRIO,INVESTIDOR PROFISSIONAL
MANATÍ CAPITAL HEDGE FUND FII,INVESTIDOR PROFISSIONAL
DEVANT PROPERTIES FUNDO DE INVESTIMENTO IMOBILIÁRIO,INVESTIDORES EM GERAL
GHIA DESENVOLVIMENTO FUNDO DE INVESTIMENTO IMOBILIÁRIO,INVESTIDOR PROFISSIONAL
BTG PACTUAL CREDITO PARA INCORPORACAO  FII,INVESTIDORES EM GERAL
FII MAUA PROPRIEDADES PARA INVESTIMENTO,INVESTIDOR PROFISSIONAL
RBR MALLS FUNDO DE INVESTIMENTO IMOBILIARIO,INVESTIDOR PROFISSIONAL
FUNDO DE INVESTIMENTO IMOBILIARIO APEX MALLS FII,INVESTIDOR PROFISSIONAL
FUNDO DE INVESTIMENTO IMOBILIARIO SPX SYN MULTIESTRATEGIA,INVESTIDORES EM GERAL
CYRELA DESENVOLVIMENTO LOGISTICO FII,INVESTIDOR QUALIFICADO
CYRELA DESENVOLVIMENTO LOGISTICO FUNDO DE INVESTIMENTO IMOB,INVESTIDOR QUALIFICADO
CANUMA CAPITAL MULTIESTRATEGIA FII,INVESTIDORES EM GERAL
FUNDO DE INVESTIMENTO IMOBILIARIO NM KSM LOG,INVESTIDOR QUALIFICADO
FII MEIRINGEN FUNDO DE INVESTIMENTO IMOBILIÁRIO,INVESTIDOR PROFISSIONAL
DJF JIVE PROPERTIES FII FUNDO DE INVESTIMENTO IMOBILIÁRIO,INVESTIDOR PROFISSIONAL
WARREN SECURITIES FUNDO DE INVESTIMENTO IMOBILIÁRIO - FII,INVESTIDORES EM GERAL
PRIME HOTELS FUNDO DE INVESTIMENTO IMOBILIÁRIO,INVESTIDOR QUALIFICADO
REAL ESTATE TRANCOSO FUNDO DE INVESTIMENTO IMOBILIÁRIO,INVESTIDORES EM GERAL
FUNDO DE INVESTIMENTO IMOBILIARIO - FII BIOTIC,INVESTIDOR QUALIFICADO
MODULO RENDA CORPORATIVA FII,INVESTIDORES EM GERAL
GRANBRAVA FUNDO DE INVESTIMENTO IMOBILIARIO,INVESTIDOR PROFISSIONAL
GRANBRAVA FUNDO DE INVESTIMENTO IMOBILIÁRIO - RL,INVESTIDOR PROFISSIONAL
BARZEL CEA FUNDO DE INVESTIMENTO IMOBILIÁRIO,INVESTIDORES EM GERAL
BARZEL CEA FII RESPONSABILIDADE LIMITADA,INVESTIDORES EM GERAL
LAGUNA FUNDO DE INVESTIMENTO IMOBILIÁRIO - FII,INVESTIDOR PROFISSIONAL
AZURITA FUNDO DE INVESTIMENTO IMOBILIÁRIO,INVESTIDOR PROFISSIONAL
KOMBI AZUL FUNDO DE INVESTIMENTO IMOBILIÁRIO,INVESTIDOR QUALIFICADO
WHG FINVEST SP REALTY FII,INVESTIDOR QUALIFICADO
FII SUNO ENERGIAS LIMPAS,INVESTIDORES EM GERAL
FUNDO DE INVESTIMENTO IMOBILIÁRIO SUNO ENERGIAS LIMPAS,INVESTIDORES EM GERAL
XP CRÉDITO AGRO FII,INVESTIDORES EM GERAL
MAUÁ CAPITAL FII,INVESTIDORES EM GERAL
JGP CRÉDITO AGRO FII,INVESTIDORES EM GERAL
NOVO CAMPO FUNDO DE INVESTIMENTO IMOBILIÁRIO - FII,INVESTIDOR PROFISSIONAL
BRC II FUNDO DE INVESTIMENTO IMOBILIÁRIO,INVESTIDORES EM GERAL
JK 1455 FUNDO DE INVESTIMENTO IMOBILIÁRIO - FII,INVESTIDOR QUALIFICADO
MS FUNDO DE INVESTIMENTO IMOBILIÁRIO - FII,INVESTIDOR QUALIFICADO
VT TOWER FUNDO DE INVESTIMENTO IMOBILIÁRIO - FII,INVESTIDOR QUALIFICADO
FL SQUARE FUNDO DE INVESTIMENTO IMOBILIÁRIO - FII,INVESTIDOR PROFISSIONAL
PDC FUNDO DE INVESTIMENTO IMOBILIÁRIO - FII,INVESTIDOR QUALIFICADO
TNU FUNDO DE INVESTIMENTO IMOBILIÁRIO - FII,INVESTIDOR QUALIFICADO
VIC DESENVOLVIMENTO VINTAGE 22/23 FII,INVESTIDOR PROFISSIONAL
FI NAS CADEIAS PRODUTIVAS AGROINDUSTRIAIS EXES ARAGUAIA,INVESTIDORES EM GERAL
FLFC FUNDO DE INVESTIMENTO IMOBILIÁRIO - FII,INVESTIDOR PROFISSIONAL
PDC II FUNDO DE INVESTIMENTO IMOBILIÁRIO - FII,INVESTIDOR QUALIFICADO
TRX HEDGE FII,INVESTIDORES EM GERAL
TORINO FUNDO DE INVESTIMENTO IMOBILIÁRIO,INVESTIDOR PROFISSIONAL
TORINO FII RESPONSABILIDADE LIMITADA,INVESTIDOR PROFISSIONAL
BRM FUNDO DE INVESTIMENTO IMOBILIARIO,INVESTIDOR QUALIFICADO E PROFISSIONAL
FUNDO DE INVESTIMENTO IMOBILIÁRIO DE UNIDADES AUTÔNOMAS II,INVESTIDOR PROFISSIONAL
SFI INVESTIMENTOS DO AGRENEGÓCIO - FIAGRO IMOBILIÁRIO,INVESTIDOR PROFISSIONAL
SFI INVESTIMENTOS DO AGRONEGÓCIO - FIAGRO-IMOBILIÁRIO,INVESTIDOR PROFISSIONAL
BARRA FUNDO DE INVESTIMENTO IMOBILIARIO,INVESTIDOR QUALIFICADO
FII JIVE PROPERTIES III FII,INVESTIDOR QUALIFICADO
JIVE PROPERTIES MULTIESTRATEGIA FII,INVESTIDOR PROFISSIONAL
HEDGE DESENVOLVIMENTO LOGÍSTICO FII,INVESTIDOR QUALIFICADO
ARX DOVER RECEBÍVEIS FUNDO DE INVESTIMENTO IMOBILIÁRIO,INVESTIDORES EM GERAL
FOCO FUNDO DE INVESTIMENTO IMOBILIARIO,INVESTIDOR QUALIFICADO
ASSET BANK - FUNDO DE INVESTIMENTO IMOBILIÁRIO,INVESTIDOR PROFISSIONAL
VINCI CRÉDITO AGRO FIAGRO-IMOBILIÁRIO,INVESTIDOR PROFISSIONAL
FII TG REAL ESTATE,INVESTIDORES EM GERAL
REAL INVESTOR FII,INVESTIDORES EM GERAL
REAL INVESTOR FUNDO DE INVESTIMENTO IMOBILIARIO,INVESTIDORES EM GERAL
FII TG RENDA IMOBILIÁRIA,INVESTIDOR QUALIFICADO
XP 051 FIAGRO,INVESTIDOR PROFISSIONAL
AZ QUEST SOLE FII AGRO,INVESTIDOR PROFISSIONAL
BRM FUNDO DE INVESTIMENTO IMOBILIARIO II,INVESTIDOR PROFISSIONAL
TAG OCEANUS FUNDO DE INVESTIMENTO IMOBILIARIO,INVESTIDOR QUALIFICADO E PROFISSIONAL
AROEIRA 333 RENDA LOGÍSTICA FII,INVESTIDORES EM GERAL
OCTO FUNDO DE INVESTIMENTO IMOBILIÁRIO,INVESTIDOR PROFISSIONAL
MAHOGANY MULTIESTRATÉGIA FUNDO DE INVESTIMENTO IMOBILIÁRIO,INVESTIDOR PROFISSIONAL
FUNDO DE INVESTIMENTO IMOBILIÁRIO ALUMIE,INVESTIDOR PROFISSIONAL
LBV FUNDO DE INVESTIMENTO IMOBILIÁRIO,INVESTIDOR QUALIFICADO
REAG RECEBÍVEIS IMOBILIÁRIOS FII,INVESTIDOR PROFISSIONAL
MOGNO LOGÍSTICA FUNDO DE INVESTIMENTO IMOBILIARIO,INVESTIDOR QUALIFICADO
HIGH END REAL ESTATE FUNDO DE INVESTIMENTO IMOBILIÁRIO,INVESTIDOR PROFISSIONAL
ARTEMIS 2022 FUNDO DE INVESTIMENTO IMOBILIÁRIO,INVESTIDOR QUALIFICADO
BSB PA FUNDO DE INVESTIMENTO IMOBILIÁRIO - FII,INVESTIDOR QUALIFICADO
CTN FUNDO DE INVESTIMENTO IMOBILIÁRIO - FII,INVESTIDOR QUALIFICADO
FUNDO DE INVESTIMENTO IMOBILIÁRIO JK B - FII,INVESTIDOR QUALIFICADO
MCH TOWER FUNDO DE INVESTIMENTO IMOBILIÁRIO - FII,INVESTIDOR QUALIFICADO
ALPH TOWER FUNDO DE INVESTIMENTO IMOBILIÁRIO - FII,INVESTIDOR QUALIFICADO
PLANTA DESENVOLVIMENTO URBANO FII,INVESTIDOR QUALIFICADO
PLANTA DESENVOLVIMENTO URBANO & RETROFIT FII,INVESTIDOR QUALIFICADO
PAN PARK FUNDO DE INVESTIMENTO IMOBILIÁRIO - FII,INVESTIDOR QUALIFICADO
GAZIN FUNO DE INVESTIMENTO IMOBILIÁRIO - FII,INVESTIDOR PROFISSIONAL
CANAÃ FI NAS CADEIAS PRODUTIVAS AGROINDUSTRIAIS - FIAGRO,INVESTIDOR PROFISSIONAL
ASA RETROFITS I FUNDO DE INVESTIMENTO IMOBILIARIO FII,INVESTIDOR QUALIFICADO
DAYCOVAL RETROFITS I FUNDO DE INVESTIMENTO IMOBILIARIO FII,INVESTIDOR QUALIFICADO
DAYCOVAL RETROFITS I FII,INVESTIDOR QUALIFICADO
ZAGROS MULTIESTRATEGIA FUNDO DE INVESTIMENTO IMOBILIARIO,INVESTIDOR QUALIFICADO
TELLUS MULTIESTRATEGIA  FII,INVESTIDOR QUALIFICADO
EMPIRICA RECEBIVEIS IMOBILIARIOS FII,INVESTIDOR QUALIFICADO
BTG PACTUAL REAL ESTATE HEDGE FUND FII,INVESTIDORES EM GERAL
BTG PACTUAL REAL ESTATE HEDGE FUND FII - RESP LIMITADA,INVESTIDORES EM GERAL
BTG PACTUAL REAL ESTATE HEDGE FUND FII - FII RESP LIMITADA,INVESTIDORES EM GERAL
FUNDO DE INVESTIMENTO IMOBILIARIO - BRICK 104,INVESTIDOR PROFISSIONAL
POXIM FUNDO DE INVESTIMENTO IMOBILIARIO,INVESTIDOR PROFISSIONAL
FII VBI CRÉDITO ALOCAÇÃO ESTRATÉGICA,INVESTIDORES EM GERAL
MERITO RECEBIVEIS IMOBILIARIOS FII,INVESTIDORES EM GERAL
RIZA EOS FIAGRO FII,INVESTIDOR QUALIFICADO
FUNDO DE INVESTIMENTO IMOBILIÁRIO JK B II - FII,INVESTIDOR QUALIFICADO
PDC III FUNDO DE INVESTIMENTO IMOBILIÁRIO - FII,INVESTIDOR QUALIFICADO
G5 EMPREENDIMENTO IMOBILIÁRIO FII,INVESTIDOR QUALIFICADO
BRC III DESENVOLVIMENTO FUNDO DE INVESTIMENTO IMOBILIÁRIO,INVESTIDORES EM GERAL
FOREMAN FUNDO DE INVESTIMENTO IMOBILIÁRIO,INVESTIDOR QUALIFICADO
MERITO M01 FII,INVESTIDORES EM GERAL
MERITO CEMITERIOS FII,INVESTIDORES EM GERAL
PANORAMA REAL ESTATE CREDITO FII,INVESTIDOR PROFISSIONAL
GALAPAGOS SPECIAL OPORTUNITIES FII,INVESTIDORES EM GERAL
VALORA CRI INFRA FUNDO DE INVESTIMENTO IMOBILIÁRIO,INVESTIDOR PROFISSIONAL
VALORA CRI INFRA FII,INVESTIDOR PROFISSIONAL
FII SULAMÉRICA REAL ESTATE,INVESTIDOR QUALIFICADO
NAVI HEDGE FUN FUNDO DE INVESTIMENTO IMOBILIARIO,INVESTIDORES EM GERAL
NAVI HEDGE FUND FUNDO DE INVESTIMENTO IMOBILIÁRIO,INVESTIDORES EM GERAL
NAVI HEDGE FII,INVESTIDORES EM GERAL
SPECIALE BLUE REAL ASSET FUNDO DE INVESTIMENTO IMOBILIÁRIO,INVESTIDOR QUALIFICADO E PROFISSIONAL
CONSORCIO DO EMPREENDIMENTO NCPFI-RJ FII,INVESTIDOR PROFISSIONAL
PEDRA ALTA FUNDO DE INVESTIMENTO IMOBILIÁRIO,INVESTIDOR PROFISSIONAL
JAI IV - FUNDO DE INVESTIMENTO IMOBILIÁRIO,INVESTIDOR PROFISSIONAL
FII EM ATIVOS DE SAUDE - SAUD,INVESTIDORES EM GERAL
FUNDO DE INVESTIMENTO IMOBILIARIO EM ATIVOS DE SAUDE - SAUD,INVESTIDORES EM GERAL
REAL ESTATE SPECIAL SITUATIONS I FII,INVESTIDOR PROFISSIONAL
PEDRA DOURADA FUNDO DE INVESTIMENTO IMOBILIARIO,INVESTIDOR QUALIFICADO
REAG RENDA URBANA FUNDO DE INVESTIMENTO IMOBILIÁRIO,INVESTIDOR QUALIFICADO
PROPP I FUNDO DE INVESTIMENTO IMOBILIÁRIO - FII,INVESTIDOR PROFISSIONAL
GREENWICH  - FIAGRO - IMOBILIÁRIO,INVESTIDORES EM GERAL
GREENWICH FIAGRO - IMOBILIÁRIO,INVESTIDORES EM GERAL
VENETO I FUNDO DE INVESTIMENTO IMOBILIÁRIO,INVESTIDOR PROFISSIONAL
SINAI PRIME FUNDO DE INVESTIMENTO IMOB CLASSE ÚNICA,INVESTIDOR PROFISSIONAL
CAPITANIA SHOPPINGS FUNDO DE INVESTIMENTO IMOBILIARIO,INVESTIDORES EM GERAL
CIX ITAPURANGA FUNDO DE INVESTIMENTO IMOBILIÁRIO,INVESTIDOR QUALIFICADO
CIX PONTA NEGRA FUNDO DE INVESTIMENTO IMOBILIÁRIO,INVESTIDOR PROFISSIONAL
CIX MUIRAQUITAN FUNDO DE INVESTIMENTO IMOBILIÁRIO,INVESTIDOR QUALIFICADO
JGP CRÉDITO IMOBILIÁRIO FUNDO DE INVESTIMENTO IMOBILIÁRIO,INVESTIDORES EM GERAL
051 AGRO FAZENDAS II FIAGRO,INVESTIDOR PROFISSIONAL
SPARTA FIAGRO FUNDO NAS CADEIAS PRODUTIVAS AGROINDUSTRIAIS,INVESTIDORES EM GERAL
SPARTA FIAGRO FI NAS CADEIAS PROD AGRO - IMOBILIARIO,INVESTIDORES EM GERAL
SPARTA FIAGRO NAS CADEIAS PRODUTIVAS AGROINDUSTRIAIS,INVESTIDORES EM GERAL
SPARTA FIAGRO,INVESTIDORES EM GERAL
CARFAN FUNDO DE INVESTIMENTO IMOBILIÁRIO,INVESTIDOR PROFISSIONAL
CAPITANIA OFFICE FII - FUNDO DE INVESTIMENTO IMOBILIARIO,INVESTIDOR QUALIFICADO
CAPITANIA OFFICE FII - FUNDO DE INVESTIMENTO IMOBILIARIO,INVESTIDORES EM GERAL
BRK DESENVOLVIMENTO IMOBILIARIO FII,INVESTIDOR PROFISSIONAL
BRYGGEN FUNDO DE INVESTIMENTO IMOBILIARIO,INVESTIDOR PROFISSIONAL
GRIFFIN FUNDO DE INVESTIMENTO IMOBILIÁRIO,INVESTIDOR PROFISSIONAL
FUNDO DE INVESTIMENTO IMOBILIÁRIO GRAND PLAZA II,INVESTIDOR PROFISSIONAL
FRATIX FUNDO DE INVESTIMENTO IMOBILIÁRIO - FII,INVESTIDOR PROFISSIONAL
MENESCAL FUNDO DE INVESTIMENTO IMOBILIÁRIO - FII,INVESTIDOR PROFISSIONAL
BRPR CORPORATE OFFICES FUNDO DE INVESTIMENTO IMOBILIARIO,INVESTIDORES EM GERAL
PINHEIROS FUNDO DE INVESTIMENTO IMOBILIÁRIO - FII,INVESTIDOR PROFISSIONAL
CLAVE INDICES DE PRECOS FUNDO DE INVESTIMENTO IMOBILIARIO,INVESTIDORES EM GERAL
XPCE HIGH YIELD FII,INVESTIDOR PROFISSIONAL
ID GOIANA FUNDO DE INVESTIMENTO FIAGRO IMOBILIÁRIO,INVESTIDOR PROFISSIONAL
OPQ FUNDO IMOBILIARIO FII,INVESTIDOR QUALIFICADO
V2 RENDA IMOBILIARIA FUNDO DE INVESTIMENTO IMOBILIARIO  FII,INVESTIDORES EM GERAL
V2 RENDA IMOBILIARIA FUNDO DE INVESTIMENTO IMOBILIARIO - FII,INVESTIDORES EM GERAL
NOAD LIFETIME RECEBÍVEIS IMOBILIÁRIOS FII,INVESTIDOR PROFISSIONAL
FII LAV SLDZ DESENVOLVIMENTO IMOBILIARIO,INVESTIDOR PROFISSIONAL
051 AGRO FAZENDAS III FIAGRO,INVESTIDOR PROFISSIONAL
FUNDO DE INVESTIMENTO IMOBILIARIO - FATOR RENDA ESTRUTURADA,INVESTIDOR QUALIFICADO
FUNDO DE INVESTIMENTO IMOBILIÁRIO - FATOR RENDA ESTRUTURADA,INVESTIDOR QUALIFICADO
BLUECAP LOG FUNDO DE INVESTIMENTO IMOBILIÁRIO,INVESTIDORES EM GERAL
AGILE INVESTE FUNDO DE INVESTIMENTO IMOBILIÁRIO,INVESTIDOR PROFISSIONAL
TEN DESENVOLVIMENTO FUNDO DE INVESTIMENTO IMOBILIÁRIO,INVESTIDOR PROFISSIONAL
CAPITÂNIA FIAGRO,INVESTIDORES EM GERAL
AZ QUEST LUNA  FIAGRO IMOBILIÁRIO,INVESTIDORES EM GERAL
CL GUARULHOS II - FUNDO DE INVESTIMENTO IMOBILIARIO - FII,INVESTIDORES EM GERAL
MANATÍ RECEBÍVEIS ESTRUTURADOS FII,INVESTIDORES EM GERAL
STONEX MB CREDITO AGRO FIAGRO - IMOBILIARIO,INVESTIDOR PROFISSIONAL
TERRA RICA FUNDO DE INVESTIMENTO IMOBILIÁRIO,INVESTIDOR PROFISSIONAL
RANCH FUNDO DE INVESTIMENTO IMOBILIÁRIO,INVESTIDOR QUALIFICADO
FUNDO DE INVESTIMENTO IMOBILIÁRIO TERRENO QUINTAS GLOBAIS,INVESTIDOR PROFISSIONAL
FII TERRENO QUINTAS GLOBAIS,INVESTIDOR PROFISSIONAL
ALDEOTA RENDA IMOBILIÁRIA FII - FII,INVESTIDOR PROFISSIONAL
SPECIALE REAL ESTATE FUND OF FUNDS FII,INVESTIDOR PROFISSIONAL
CAPITANIA FII,INVESTIDORES EM GERAL
VALORA IMOBILIÁRIO MULTIESTRATÉGIA PREMIUM FII,INVESTIDORES EM GERAL
VALORA PREMIUM - FII,INVESTIDORES EM GERAL
MAYA FUNDO DE INVESTIMENTO IMOBILIÁRIO,INVESTIDOR PROFISSIONAL
DEMETER FI NAS CADEIAS PRODUTIVAS AGROINDUSTRIAIS FIAGRO,INVESTIDOR PROFISSIONAL
ROHT FUNDO DE INVESTIMENTO IMOBILIÁRIO,INVESTIDOR QUALIFICADO
FII RBR OPORTUNIDADES EM CREDITO IMOBILIARIO,INVESTIDORES EM GERAL
REAG AUCTION OPPORTUNITIES FUNDO DE INVESTIMENTO IMOBILIÁRIO,INVESTIDOR QUALIFICADO
XP HABITAT FII,INVESTIDORES EM GERAL
FUNDO DE INVESTIMENTO IMOBILIÁRIO DE UNIDADES AUTÔNOMAS III,INVESTIDOR PROFISSIONAL
INVISTA SCJ FII,INVESTIDOR PROFISSIONAL
BTG PACTUAL LOGCP FUNDO DE INVESTIMENTO IMOBILIARIO  FII,INVESTIDORES EM GERAL
BARZEL RETAIL II FUNDO DE INVESTIMENTO IMOBILIÁRIO,INVESTIDOR PROFISSIONAL
BARZEL RETAIL II FII RESPONSABILIDADE LIMITADA,INVESTIDOR PROFISSIONAL
FII MULTIESTRATEGIA SANTA CATARINA,INVESTIDOR QUALIFICADO
DJF IV JIVE FUNDO DE INVESTIMENTO IMOBILIÁRIO,INVESTIDOR PROFISSIONAL
PANORAMA CRÉDITO RESIDENCIAL FII,INVESTIDORES EM GERAL
BARZEL LOG FUNDO DE INVESTIMENTO IMOBILIÁRIO,INVESTIDOR PROFISSIONAL
BARZEL LOG FII RESPONSABILIDADE LIMITADA,INVESTIDOR PROFISSIONAL
FUNDO DE INVESTIMENTO IMOBILIÁRIO REVO I,INVESTIDORES EM GERAL
IMMOBINVEST FUNDO DE INVESTIMENTO IMOBILIÁRIO,INVESTIDOR QUALIFICADO
JHSF CAPITAL CIDADE JARDIM - FII,INVESTIDOR PROFISSIONAL
FII  DO CAMPREV PARA SUST PREVIDENCIARIA DO MUNICIPIO,INVESTIDOR QUALIFICADO
FOF JHSF PRIVATE  FUNDO DE INVESTIMENTO IMOBILIARIO,INVESTIDOR PROFISSIONAL
FOF JHSF CAPITAL INSTITUCIONAL - FII,INVESTIDOR PROFISSIONAL
RIZA DOMUS FII,INVESTIDORES EM GERAL
VBI TR FARIA LIMA 4440 FII,INVESTIDOR QUALIFICADO
VBI TR FARIA LIMA 4440 FUNDO DE INVESTIMENTO IMOBILIÁRIO,INVESTIDOR QUALIFICADO
ARC IV FUNDO DE INVESTIMENTO IMOBILIÁRIO,INVESTIDOR QUALIFICADO
PIEMONTESE FII DE RESPONSABILIDADE LIMITADA,INVESTIDOR PROFISSIONAL
PIEMONTESE FII RESPONSABILIDADE LIMITADA,INVESTIDOR QUALIFICADO
FUNDO DE INVESTIMENTO IMOBILIARIO GREEN EAGLE,INVESTIDORES EM GERAL
GREY EAGLE FUNDO DE INVESTIMENTO IMOBILIARIO,INVESTIDORES EM GERAL
FUNDO DE INVESTIMENTO IMOBILIARIO RUBY GREEN,INVESTIDORES EM GERAL
BLACK BRIDGE FUNDO DE INVESTIMENTO IMOBILIÁRIO,INVESTIDORES EM GERAL
BASSANO DI GRAPPO FII,INVESTIDOR PROFISSIONAL
HOP FUNDO DE INVESTIMENTO IMOBILIARIO,INVESTIDORES EM GERAL
MORE CREDITO IMOBILIARIO FII,INVESTIDORES EM GERAL
MINESOTTA FUNDO DE INVESTIMENTO IMOBILIÁRIO,INVESTIDORES EM GERAL
ITAÚ CRÉDITO IMOBILIÁRIO IPCA FII,INVESTIDORES EM GERAL
LEGATUM FII RESPONSABILIDADE LIMITADA,INVESTIDOR PROFISSIONAL
LEGATUM FUNDO DE INVESTIMENTO IMOBILIÁRIO RL,INVESTIDOR PROFISSIONAL
THOR FUNDO DE INVESTIMENTO IMOBILIÁRIO,INVESTIDOR PROFISSIONAL
MOEMA FII IMOBILIÁRIO DE RESPONSABILIDADE LIMITADA,INVESTIDOR PROFISSIONAL
MOEMA FII DE RESP. LIMITADA,INVESTIDOR PROFISSIONAL
FUNDO DE INVESTIMENTO IMOBILIÁRIO ENSEADA,INVESTIDOR PROFISSIONAL
CARNAUBA FII,INVESTIDORES EM GERAL
FII XP GRUPO CARNAÚBA,INVESTIDORES EM GERAL
HEDGE YEES HABITAÇÕES ECONÔMICAS FII DE RESP LIM,INVESTIDOR PROFISSIONAL
HEDGE YEES HABITAÇÕES ECONÔMICAS FII DE RESP LIM,INVESTIDOR QUALIFICADO
CERRO VERDE FUNDO DE INVESTIMENTO IMOBILIÁRIO,INVESTIDOR QUALIFICADO
FUNDO DE INVESTIMENTO IMOBILIÁRIO VANCOUVER,INVESTIDORES EM GERAL
BLUECAP LAST MILE I FII,INVESTIDORES EM GERAL
BLUECAP LAST MILE I FII RESP LTDA,INVESTIDORES EM GERAL
FUNDO DE INVESTIMENTO IMOBILIÁRIO TORONTO,INVESTIDORES EM GERAL
AJ MALLS FII,INVESTIDORES EM GERAL
KINEA OPORTUNIDADES AGRO I FIAGRO IMOBILIÁRIO,INVESTIDOR QUALIFICADO
DELTA FUNDO DE INVESTIMENTO IMOBILIÁRIO,INVESTIDORES EM GERAL
W601 FUNDO DE INVESTIMENTO IMOBILIÁRIO,INVESTIDOR PROFISSIONAL
PÁTRIA CRÉDITO AGRÍCOLA FUNDO DE INVESTIMENTO FIAGRO-IMOB,INVESTIDORES EM GERAL
PÁTRIA CRÉDITO AGRÍCOLA FIAGRO,INVESTIDORES EM GERAL
PÁTRIA FIAGRO-IMOB,INVESTIDORES EM GERAL
CYRELA HEDGE FUND FUNDO DE INVESTIMENTO IMOBILIÁRIO - FII,INVESTIDORES EM GERAL
KINEA AGRO INCOME USD FIAGRO IMOBILIARIO,INVESTIDORES EM GERAL
SANTANDER PAPEIS IMOBILIARIOS FII,INVESTIDORES EM GERAL
VALORA HEDGE FUND AGRO - FIAGRO-IMOBILIÁRIO,INVESTIDORES EM GERAL
VALORA HEDGE FUND FIAGRO FII,INVESTIDORES EM GERAL
AZ QUEST PANORAMA CRÉDITO IMOBILIÁRIO FII,INVESTIDORES EM GERAL
BRPR E-TOWER FUNDO DE INVESTIMENTO IMOBILIARIO,INVESTIDOR QUALIFICADO
OLSEN FUNDO DE INVESTIMENTO IMOBILIÁRIO,INVESTIDOR PROFISSIONAL
LAVOURA I FIAGRO IMOBILIÁRIO,INVESTIDORES EM GERAL
KINEA DESENVOLVIMENTO LOGÍSTICO FII,INVESTIDOR QUALIFICADO
JALAPÃO FUNDO DE INVESTIMENTO IMOBILIÁRIO,INVESTIDOR QUALIFICADO
RAIZZ DESENV. I FUNDO DE INVESTIMENTO IMOBILIARIO - FII,INVESTIDOR PROFISSIONAL
RAIZZ DESENVOLVIMENTO I FUNDO DE INV. IMOBILIARIO - FII,INVESTIDOR PROFISSIONAL
FII VBI CREDITO MULTIESTRATEGIA,INVESTIDORES EM GERAL
FUNDO DE INVESTIMENTO IMOB VBI CREDITO MULTIESTRATEGIA,INVESTIDORES EM GERAL
BRIO REAL ESTATE V FUNDO DE INVESTIMENTO IMOBILIÁRIO,INVESTIDOR QUALIFICADO
PARAMIS HEDGE FUND FUNDO DE INVESTIMENTO IMOBILIÁRIO - FII,INVESTIDORES EM GERAL
FATOR VERITA MULTIESTRATEGIA FUNDO DE INVESTIMENTO IMOB,INVESTIDORES EM GERAL
FLORESTA FUNDO DE INVESTIMENTO IMOBILIÁRIO,INVESTIDOR PROFISSIONAL
AZ QUEST PANORAMA LOGÍSTICA FII - RESPONSABILIDADE LIMITADA,INVESTIDORES EM GERAL
AZ QUEST PANORAMA LOGÍSTICA FII - RESP.LIMITADA,INVESTIDORES EM GERAL
AZ QUEST PANORAMA LOGÍSTICA FII - RL,INVESTIDORES EM GERAL
MERCURY FUNDO DE INVESTIMENTO IMOBILIÁRIO,INVESTIDOR PROFISSIONAL
BTW 001 FUNDO DE INVESTIMENTO IMOBILIÁRIO,INVESTIDOR QUALIFICADO
BRIO COINVESTIMENTO JARDINS FII,INVESTIDOR PROFISSIONAL
NEX CRÉDITO AGRO - FIAGRO IMOBILIÁRIO,INVESTIDOR QUALIFICADO
FII ZAVIT CRÉDITO IMOBILIÁRIO,INVESTIDOR PROFISSIONAL
SANTA CLARA FUNDO DE INVESTIMENTO IMOBILIÁRIO,INVESTIDOR PROFISSIONAL
KINEA OPORTUNIDADES REAL ESTATE FII,INVESTIDORES EM GERAL
SUNO MULTIESTRATEGIA FUNDO DE INVESTIMENTO IMOBILIARIO,INVESTIDORES EM GERAL
OUTLET SANTA MARIA FUNDO DE INVESTIMENTO IMOBILIÁRIO,INVESTIDORES EM GERAL
ITAÚ TOTAL RETURN FUNDO DE INVESTIMENTO IMOBILIÁRIO,INVESTIDORES EM GERAL
PILAR FUNDO DE INVESTIMENTO IMOBILIÁRIO,INVESTIDOR QUALIFICADO
R8 FUNDO DE INVESTIMENTO IMOBILIÁRIO,INVESTIDOR QUALIFICADO
FUNDO DE INVESTIMENTO IMOBILIÁRIO DE UNIDADES AUTÔNOMAS IV,INVESTIDOR PROFISSIONAL
BTG RE STRUCTURED OPPORTUNITIES FII RESPONSABILIDADE LIMITAD,INVESTIDOR PROFISSIONAL
BTG RE STRUCTURED OPPORTUNITIES  FII,INVESTIDOR PROFISSIONAL
BTG RE STRUCTURED OPPORTUNITIES FII,INVESTIDOR PROFISSIONAL
REC - FAMI FUNDO DE CRI COTAS AMORTIZAVEIS FII,INVESTIDORES EM GERAL
IMIGRANTES IV - FUNDO DE INVESTIMENTO IMOBILIARIO - FII,INVESTIDORES EM GERAL
CL CASTELO BRANCO FUNDO DE INVESTIMENTO IMOBILIARIO,INVESTIDORES EM GERAL
FII ATLAS FUNDO DE INVESTIMENTO IMOBILIÁRIO,INVESTIDOR PROFISSIONAL
XP HEDGE FUND FUNDO DE INVESTIMENTO IMOBILIÁRIO - FII,INVESTIDORES EM GERAL
CODEMAR FUNDO DE INVESTIMENTO IMOBILIÁRIO,INVESTIDOR QUALIFICADO
CAPITANIA LOGISTICA FUNDO DE INVESTIMENTO IMOBILIARIO - FII,INVESTIDORES EM GERAL
CAPITÂNIA LOGÍSTICA FUNDO DE INVESTIMENTO IMOBILIÁRIO,INVESTIDORES EM GERAL
FUNDO DE INVESTIMENTO IMOBILIARIO APEX REALTY - FII,INVESTIDORES EM GERAL
APEX URB FII RESPONSABILIDADE LIMITADA,INVESTIDORES EM GERAL
APEX URB FUNDO DE INV. IMOBILIARIO RESPONSABILIDADE LIMITADA,INVESTIDORES EM GERAL
INVISTA BRAZILIAN BUSINESS PARK FII,INVESTIDOR QUALIFICADO
D3 TZI DESENVOLVIMENTO FUNDO DE INVESTIMENTO IMOBILIÁRIO,INVESTIDOR QUALIFICADO
SANDALS FUNDO DE INVESTIMENTO IMOBILIÁRIO,INVESTIDOR PROFISSIONAL
AJU FUNDO DE INVESTIMENTO IMOBILIÁRIO,INVESTIDOR PROFISSIONAL
CASTELO FUNDO DE INVESTIMENTO IMOBILIÁRIO,INVESTIDOR PROFISSIONAL
INTER DESENVOLVIMENTO FII RESPONSABILIDADE LIMITADA,INVESTIDORES EM GERAL
URCA HEDGE FUND ESTRATÉGIA IMOBILIÁRIA FII,INVESTIDOR QUALIFICADO
URCA HEDGE FUND ESTRATÉGIA IMOBILIÁRIA FII - RESP LIMITADA,INVESTIDOR QUALIFICADO
URCA HEDGE FUND ESTRATÉGIA - RESP LIMITADA,INVESTIDORES EM GERAL
VALORA CRI INFRA II FII DE RESPONSABILIDADE LIMITADA,INVESTIDOR PROFISSIONAL
VALORA CRI INFRA FII II,INVESTIDOR PROFISSIONAL
CANUMA CAPITAL RENDA VAREJO FII RESPONSABILIDADE LIMITADA,INVESTIDOR PROFISSIONAL
VERA CRUZ THREE FII RESPONSABILIDADE LTDA,INVESTIDOR QUALIFICADO
